,tid,userId,fid,typeId,domainId,topicId,nickName,subject,content,dateline,ip,stateInfo,traceInfo,processInfo,hasReported,favNum,forumName,typeName,domainName,sourceName,answerId,answerContent,answerDateline,answerOrganization,userType,threadState,publicAttachment,userFavStatus,grade,gradeLevel,gradeManner,gradeSpeed,trashRecheckState,attachment,threadsCheckTime,from,shisiwu,date
4,12867562,4302924,550,2,2.0,0,W***,沈阳集中隔离人员转运存在重大风险,本人家属绥中反沈，2.8日集中隔离时，当地派大巴车全城接人，长时间在大巴车上停留，大巴车上已经全员满载，在酒店门口又长时间停留。,1644464978,39.144.103.*,已办理,已办理,线下交办,0,0,辽宁省省长李乐成,投诉,政务,微信小程序,,,,,0,1,,,,,,,0,0,1644550246, 北京市,False,2022-02-10
5,12867397,4781883,543,2,7.0,0,大***,唐山曹妃甸富力城虚假宣传,在购买富力城项目低密度住宅项目中，原规划图、销售沙盘和售楼员均表示该项目用金属围栏与外界隔离。在房屋交付中，金属围栏变成了高达两米多实...,1644464173,36.98.0.*,办理中,待回复,线上交办,0,0,河北省委书记王东峰,投诉,城建,微信小程序,,,,,0,1,,,,,,,0,0,1644543391, 浙江省 杭州市,False,2022-02-10
6,12867266,5559261,1773,1,12.0,0,A***,医疗情况反映,诉求：请加强病区病床之间的隔离、消毒；对于阳性传染病人做好转移到专门病房进行治疗；防治二次感染问题的出现。保障无症状病人和家属的安全。...,1644463519,171.219.10.*,已办理,已办理,线下交办,0,0,锦江区委书记,咨询,医疗,客户端,,,,,0,1,0.0,,,,,,0,1,1644567188, 四川省 绵阳市,False,2022-02-10
7,12866784,5698212,2431,1,7.0,0,心***,中心路安不安装隔离护栏,领导您好：就想咨询一下，中心路作为辉县的一条主路，安装不安装隔离护栏，让大路看起来整齐有序，规划统一呢?谢谢！,1644460768,115.51.239.*,已办理,已办理,线下交办,0,0,辉县市委书记,咨询,城建,手机浏览器,,,,,0,1,,,,,,,0,0,1644499548, 河南省 新乡市,False,2022-02-10
8,12866524,1290883,1289,5,6.0,0,出***,成都长庆西一路隔离栏设置建议,成都长庆西一路设置非机动车隔离栏，距离太大，机动车可以靠边停放在里面，造成非机动车不好同行，这种白色油漆材质太容易损坏（图1），已经有...,1644459222,221.236.93.*,已办理,已办理,未交办,0,0,成都市委书记施小琳,建言,交通,PC浏览器,,,,,0,1,0.0,,,,,,0,1,1644491517, 四川省 德阳市,False,2022-02-10
9,12863989,3920867,1105,1,1.0,0,阿***,北京低风险区回淄博是否需要集中隔离,持48小时内核酸检测结果，北京低风险区回淄博是否需要集中隔离，谢谢！,1644418992,223.104.40.*,已办理,已办理,未交办,0,0,淄博市委书记江敦涛,咨询,治安,客户端,,,,,0,1,,,,,,,0,0,1644482695, 北京市,False,2022-02-09
0,12862762,5696551,2096,6,6.0,0,王***,建议加装隔离铁栏,书记您好！由于灌口安仁大道在施工，桥下红绿灯车流量较大，每次过都有不少车辆不按规矩随意变道插队，本来右转车道给硬生生的被等待插队车辆霸占，实在让人气愤，请让施工队或者交通部门加装铁栏。可有效预防车主随...,1644411616,223.104.48.*,已办理,已办理,未交办,0,0,集美区委书记,求助,交通,手机浏览器,,,,,0,1,0.0,,,,,,0,1,1644544004, 北京市,False,2022-02-09
1,12862579,5086967,1367,5,1.0,0,Z***,多排停车,建议道路中间加装隔离护栏，彻底解决多排乱停车问题。,1644410512,111.18.131.*,已办理,已办理,未交办,0,0,西安市委书记方红卫,建言,治安,微信小程序,,,,,0,1,,,,,,,0,0,1644485662, 北京市,False,2022-02-09
2,12859746,5694810,554,5,1.0,0,W***,关于征仪路高架桥跨越三环处，大型车辆横跨三环,"领导好：
      征仪路高架桥跨越三环处，高架桥下经常有大货车横过三环隔离带，给往来车辆带来极大的安全隐患，以前曾经发生过车祸，建...",1644393028,192.168.0.*,已办理,已办理,线上交办,0,1,黑龙江省省长胡昌升,建言,治安,黑龙江省政府网站,,,,,0,1,,,,,,,0,0,1644479085,热心网友,False,2022-02-09
3,12859293,5485560,3649,1,12.0,0,天***(已注销),从中高风险区返回环江人员为什么不见安排克隔离,从中高风险区返回环江人员为什么不见安排克环江毛南民族酒店，环江运达宾馆隔离。,1644390921,182.90.207.*,待回复,待回复,未交办,0,0,环江毛南族自治县委书记,咨询,医疗,客户端,,,,,0,1,,,,,,,0,0,1644801996, 广西壮族自治区 梧州市,False,2022-02-09
4,12857610,5391545,2016,2,13.0,0,J***,聚集直播 噪声扰民,现在国内疫情还没彻底结束，县城部分巷口还有挡板隔离，这样聚集让人看着胆战心惊，且中午时间正是午休时间，每天这样直播噪声严重影响上班族午...,1644382845,111.18.175.*,已办理,已办理,线下交办,0,0,宜川县委书记,投诉,环保,手机浏览器,,,,,0,1,,,,,,,0,0,1644399723, 北京市,False,2022-02-09
5,12856045,1088399,793,1,2.0,0,群***,尊敬的领导您好,我反应的是津南区小站镇敬老院（国有企业）在职职工受疫情影响听从领导安排在院隔离，对社会对家庭是挺好的。我们家属理解。目前为止津南区疫情...,1644375082,111.32.123.*,已办理,已办理,未交办,0,0,津南区委书记刘惠,咨询,政务,客户端,,,,,0,1,,,,,,,0,0,1644796864, 北京市,False,2022-02-09
6,12855430,5691783,2766,1,12.0,0,C***,关于次密接人员集中隔离费用问题,本人于1月27日从低风险地区四川省成都市出发，1月28日到达酒泉，期间未途径任何中风险地区，1月29日接到通知被判定为次密切接触者，当日即前往集中隔离...,1644372020,36.142.193.*,已办理,已办理,未交办,0,0,肃州区委书记,咨询,医疗,客户端,,,,,0,1,,,,,,,0,0,1644550787, 北京市,False,2022-02-09
7,12845974,5684839,4437,1,12.0,0,充***,关于反沈人员隔离费用政策,想向您咨询一下隔离费用政策问题，我属于浑南区彩霞社区，询问社区后社区答复是没有本地户口和房产，租贷不满五年的需要自费<label st...,1644315064,112.41.49.*,已办理,已办理,线下交办,0,0,浑南区委书记,咨询,医疗,手机浏览器,,,,,0,1,,,,,,,0,0,1644375307, 上海市,False,2022-02-08
8,12844928,1675547,1956,1,2.0,0,一***,关于2021年12月份疫情防控期间事宜,因2021年疫情防控原因，居家隔离未外出上班，现需要一份盖社区或者街道办公章的居家隔...,1644313346,223.104.204.*,已办理,已一次评价,未交办,0,0,未央区委书记,咨询,政务,客户端,,,,,0,1,,,3.6,3.0,4.0,4.0,0,0,1644455925, 北京市,False,2022-02-08
9,12839536,2627368,1318,1,2.0,0,小***,返乡政策咨询,你好，我是一名外地打工人员，我咨询一下现在回来，还需要隔离嘛，要不要核酸报告啊，谢谢,1644300784,220.196.194.*,已办理,已办理,线上交办,0,0,眉山市市长黄河,咨询,政务,客户端,,,,,0,1,,,,,,,0,0,1644371630, 江苏省 徐州市,False,2022-02-08
0,12838520,4187847,1135,2,7.0,0,咩***,万达公馆门口隔离石墩严重影响市民通行,尊敬的领导：        21年3月我曾就科源路万达公馆门口隔离墩影响推婴儿车带小孩儿和轮椅使用者出行一事投诉过。当时社区回复要求...,1644294103,182.118.239.*,已办理,已一次评价,线上交办,0,0,郑州市委书记安伟,投诉,城建,客户端,,,,,0,1,1.0,,3.0,3.0,3.0,3.0,0,1,1644543231, 河南省 郑州市,False,2022-02-08
1,12837975,5678552,1367,2,7.0,0,w***,违法占用公共道路 浇筑坡道 人行横道随意停车,为一己私利东**王违法浇筑坡道，占用非机动车道与人行横道，只为方便自己占用社会公共资源，对过往非机动车与附近小区居民造成很大困扰，为人行横道违停车辆打开方便之门，大兴西路安装<label style=...,1644290864,117.22.248.*,已办理,已一次评价,未交办,0,0,西安市委书记方红卫,投诉,城建,PC浏览器,,,,,0,1,0.0,,5.0,5.0,5.0,5.0,0,1,1644474718, 陕西省 西安市,False,2022-02-08
2,12835877,1313553,893,5,6.0,0,古***,规范停车、人行道上实现人车分离,希望人行道路口、人行道与停车位设置隔离墩或港湾停车，实现人车分离、互不干扰、文明出行。,1644281411,112.39.47.*,已办理,已办理,未交办,0,0,盘锦市委书记张成中,建言,交通,PC浏览器,,,,,0,1,,,,,,,0,0,1644316043, 上海市,False,2022-02-08
3,12835421,5677606,556,2,12.0,0,张***,妻子待产在即，随申码变黄码,24，25，31，多轮核酸均为阴性，2月2日接到来自嘉定区双丁路居委会电话0215916****电话，询问我何时从深圳回沪如实回复，告诉我深圳机场在宝安区（机场距离宝安中高风险区30公里），要求我居家...,1644277433,183.192.14.*,已办理,已办理,未交办,0,0,上海市市长龚正,投诉,医疗,客户端,,,,,0,1,0.0,,,,,,0,1,1644315030, 上海市,False,2022-02-07
4,12833443,4300124,1049,6,6.0,0,阜***,请求封堵阜南路段桥路口,我在此建议：能不能把阜南路与航颍路交叉口的红绿灯取消，用中央隔离栏封堵路口，现在复兴大道也开通了，车辆可以从复兴大道路口调头，虽然多跑...,1644236802,36.62.67.*,已办理,已办理,未交办,0,0,阜阳市委书记孙正东,求助,交通,手机浏览器,,,,,0,1,,,,,,,0,0,1644309166, 安徽省 合肥市,False,2022-02-07
5,12832728,5676602,1135,2,4.0,0,w***,退费,还一直到处骗人，找他退款，他就说他被隔离了，各种借口。转眼又和别人说在正常上班。,1644230380,218.83.68.*,已办理,已一次评价,线下交办,0,1,郑州市委书记安伟,投诉,企业,客户端,,,,,0,1,0.0,,1.3,1.0,1.0,2.0,0,1,1644309166, 上海市,False,2022-02-07
6,12831463,5676034,556,6,12.0,0,冯***,随申码显示错误，误显示黄码,我在深圳入境隔离21天后，于1.21号抵沪，现在在沪已经呆满14天，没有去过其它地方，应该是绿码，但是随申码错误的显示黄码，申诉几次，...,1644220425,112.65.61.*,已办理,已办理,未交办,0,1,上海市市长龚正,求助,医疗,手机浏览器,,,,,0,1,0.0,,,,,,0,1,1644277583, 上海市,False,2022-02-07
7,12830161,5661585,2831,1,1.0,0,k***,2022年隔离酒店慰问金,本人工作春节期间工作于香洲区隔离酒店。根据文件，可获得慰问金，但是目前尚未获得，咨询公司也未可知。到底怎么回事，何时才能发放。,1644209203,120.239.202.*,已办理,已办理,未交办,0,0,香洲区委书记,咨询,治安,客户端,,,,,0,1,0.0,,,,,,0,1,1644223390, 广东省,False,2022-02-07
8,12828468,4892104,1007,1,2.0,0,阿***,咨询新冠隔离政策,请问在曾经到访过中风险地区（停留2-3小时），未到过管控区和风控区，核酸检测阴性的人员是否需要集中隔离，如需集中<label styl...,1644195656,218.108.160.*,已办理,已一次评价,未交办,0,0,杭州市委书记刘捷,咨询,政务,PC浏览器,,,,,0,1,,,1.0,1.0,1.0,1.0,0,0,1644214316, 浙江省 杭州市,False,2022-02-07
9,12826013,5673974,1136,2,1.0,0,普***,投诉酒店,房间内卫生脏乱差，房间内遗留有上一位隔离人员使用过的口罩，使用过未清洗的餐具，由于餐具未清洗，酒店未打扫和消毒，周围都是蟑螂。房间内蟑...,1644144642,39.162.130.*,已办理,已办理,未交办,0,0,郑州市市长何雄（代）,投诉,治安,微信小程序,,,,,0,1,0.0,,,,,,0,1,1644197546, 北京市,False,2022-02-06
0,12824418,4321237,1136,1,6.0,0,z***,市区主干道路没标线，没护栏，没管理…,1、南阳路（东二街至太极公馆），路面已经铺完好几个月了，但一直没有施划标线，也没有安装隔离护栏，存在较大的安全隐患。,1644120354,39.148.224.*,已办理,已办理,未交办,0,1,郑州市市长何雄（代）,咨询,交通,客户端,,,,,0,1,0.0,,,,,,0,1,1644139101, 北京市,False,2022-02-06
1,12820942,5672335,2493,6,11.0,0,W***,实习期到底有没有工资？？,块钱的工资，一天10小时，店长说三天的试用期，期间回自己家吃住，但是我们家都在乡下所以店长就把三天试用期改为一天试用期，我们通过了试用期之后开始干活，干到第四天收到了县里疫情防控所的电话让我们回家自行...,1644050186,106.33.233.*,已办理,已办理,未交办,0,0,息县县委书记,求助,就业,微信小程序,,,,,0,1,1.0,,,,,,0,1,1644062756, 河南省 郑州市,False,2022-02-05
2,12816180,5670703,3899,6,7.0,0,W***,李沧区东方龙域小区青银高速路隔音板安装,隔音板是否可以安装在隔离绿化带或通过其他方式安装？请领导重点关注一下，感谢！,1643953781,112.224.67.*,已办理,已办理,未交办,0,0,李沧区委书记,求助,城建,微信小程序,,,,,0,1,,,,,,,0,0,1644032397, 山东省 青岛市,False,2022-02-04
3,12816022,3611839,891,5,6.0,0,辽***,太子河西路车辆路口抢行双黄线随意调头现象严重,还有因为太子河西路路中间没有隔离护栏，经常看到车辆在路上随意调头，这两种现象对车辆和行人都是非常危险的，希望有关部门重视一下。,1643951922,42.249.4.*,已办理,已一次评价,线下交办,0,2,辽阳市委书记霍步刚,建言,交通,手机浏览器,,,,,0,1,,,5.0,5.0,5.0,5.0,0,0,1644031603, 辽宁省 沈阳市,False,2022-02-04
4,12815629,3819452,1284,6,12.0,0,阿***,隔离人员膳食问题,2月3号16点，本人19岁侄女接到疾控中心电话因疫情防控要求，需至定点酒店进行隔离排查。,1643945301,39.144.66.*,已办理,已办理,未交办,0,0,来宾市市长廖和明,求助,医疗,手机浏览器,,,,,0,1,,,,,,,0,0,1644023141, 北京市,False,2022-02-04
5,12814352,5670171,593,2,5.0,0,w***,南滨河中路万达冰雪主题乐园,本人带孩子于2022年2月3日下午4：30左右在属于万达名下的室外冰雪主题乐园玩耍时，由于该游乐场内没有隔离设施，导致场内电动玩具车辆...,1643904625,36.142.179.*,已办理,已办理,未交办,0,0,甘肃省委书记尹弘,投诉,旅游,PC浏览器,,,,,0,1,,,,,,,0,0,1644028812, 北京市,False,2022-02-03
6,12813712,5612726,741,6,6.0,0,m***,请对小营路奥兴汽车维修站门前道路加强修补,现在的问题是当时修补的路面靠近马路中间隔离栏的地方已经被汽车轧出了大坑，该处每过一辆车仍咯噔一声，没之前钢板声音大，但仍不胜其扰，再次...,1643894423,120.244.142.*,已办理,已办理,未交办,0,0,朝阳区委书记王灏,求助,交通,手机浏览器,,,,,0,1,,,,,,,0,0,1644028812, 北京市,False,2022-02-03
7,12813081,5669771,1260,5,7.0,0,潘***,建议在城光俊景小区出口设置交通隔离栏,因此，为避免发生交通事故，建议在城光俊景小区出口左右两侧50米内设置交通隔离栏杆，防止车辆违规停放。,1643883407,116.252.3.*,已办理,已办理,线下交办,0,0,南宁市市长廖立勇,建言,城建,PC浏览器,,,,,0,1,,,,,,,0,0,1644027212, 广西壮族自治区 南宁市,False,2022-02-03
8,12813049,2822271,1367,2,1.0,0,d***,融鑫路流浪狗扰民,近来，也会从工地南边与电信小区的隔离栏杆钻入电信小区，对小区居民进行扑咬，造成较大危险。请尽快安排捕捉，并进行常态化巡查，以免到夏天对...,1643882961,222.91.198.*,已办理,已一次评价,未交办,0,0,西安市委书记方红卫,投诉,治安,客户端,,,,,0,1,0.0,,5.0,5.0,5.0,5.0,0,1,1643962535, 陕西省 宝鸡市,False,2022-02-03
9,12812671,3892187,1574,1,2.0,0,W***,咨询疫情防控政策及隔离措施,2、烦请告知姚安县的涉疫隔离措施，集中隔离点所在地，以及什么情况下需...,1643875900,180.130.10.*,已办理,已办理,未交办,0,1,楚雄彝族自治州党委书记刘勇,咨询,政务,微信小程序,,,,,0,1,,,,,,,0,0,1643961040, 云南省 玉溪市,False,2022-02-03
0,12812127,5669388,1367,6,12.0,129,1***,西安一码通行程信息填写错误 导致行程码为红色,求助各方无果，后被隔离劝返，不能经过西安市，只得从别的路线返乡。目前开学在即，本人需要经西安到达广东，但西安一码通仍为红色，无法在西安...,1643864684,117.136.87.*,已办理,已办理,未交办,0,0,西安市委书记方红卫,求助,医疗,手机浏览器,,,,,0,1,0.0,,,,,,0,1,1643875504, 北京市,False,2022-02-03
1,12812008,5656704,540,2,4.0,0,W***,久敬佳园管理,我小区有居家隔离的，物业不给及时清理垃圾，是对其他业主不负责任。小区垃圾也无人清理，保安对进出小区人员也不管量体温。请领导来解决一下现...,1643862541,120.244.186.*,已办理,已办理,线下交办,0,0,北京市市长陈吉宁,投诉,企业,微信小程序,,,,,0,1,,,,,,,0,0,1643959874, 北京市,False,2022-02-03
2,12810490,1230730,849,5,7.0,0,内***,回民区巴彦淖尔路与新华西街交叉路口安装指示灯,回民区巴彦淖尔路高架桥新华西街段已经建设完成，巴彦淖尔路（桥下）已经进行通车，但巴彦淖尔路与新华西街交叉路口目前尚未安装指示灯，新华西街（巴彦淖尔路东西侧）路中间有<label style='colo...,1643818587,39.154.6.*,已办理,已办理,线上交办,0,0,呼和浩特市委书记包钢,建言,城建,PC浏览器,,,,,0,1,,,,,,,0,0,1643875015, 北京市,False,2022-02-02
3,12809034,5668352,753,1,12.0,0,陈***,低风险区高铁回京再去通州需要隔离吗,再回通州的话需不需要隔离？谢谢。,1643795104,112.224.1.*,已办理,已办理,线下交办,0,0,通州区委书记赵磊,咨询,医疗,客户端,,,,,0,1,,,,,,,0,0,1643941076, 山东省 青岛市,False,2022-02-02
4,12808167,2530207,2301,2,7.0,0,B***,青草镇的几个道路隔离墩,桐城青草镇通往源潭镇的道路隔离墩设置的不合理且过窄，容易剐蹭轿车，车多的时候也容易引起堵车，望领导能督促青草镇铲除这几个道路障碍，起码...,1643779349,36.63.100.*,已办理,已办理,未交办,0,0,桐城市委书记,投诉,城建,客户端,,,,,0,1,0.0,,,,,,0,1,1643808396, 安徽省 合肥市,False,2022-02-02
5,12807942,2732728,3433,6,12.0,0,d***,回家,29号早上7点到集安，在家居家隔离14天。想提前回杭州。问下可以走不，杭州上城区是低风险。自驾车走,1643775846,122.141.219.*,已办理,已一次评价,未交办,0,0,集安市委书记,求助,医疗,客户端,,,,,0,1,,,5.0,5.0,5.0,5.0,0,0,1643808396, 吉林省 通化市,False,2022-02-02
6,12805626,5666917,3482,1,12.0,0,叶***,新冠的时空伴随者需要被隔离吗？,领导您好，我想要咨询一下低风险地区返庄的时空伴随者需要被集中隔离吗，隔离</labe...,1643717436,113.226.9.*,已办理,已办理,未交办,0,0,庄河市委书记,咨询,医疗,微信小程序,,,,,0,1,,,,,,,0,0,1643784403, 辽宁省 大连市,False,2022-02-01
7,12804103,5666732,873,2,12.0,0,派***,健康码不更新,21号本人杭州回沈 主动报备 未去中高风险地区 28号集中隔离 29核酸阴性后低烧 送去了四院北院 全程配合检查 只是普通感冒 31号...,1643688448,36.129.80.*,已办理,已办理,未交办,0,1,沈阳市委书记王新伟,投诉,医疗,手机浏览器,,,,,0,1,0.0,,,,,,0,1,1643695994, 北京市,False,2022-02-01
8,12804083,5666266,1623,1,1.0,0,W***,低风险地区回乡防疫政策咨询,我在天津市津南区双港镇1月30号回刘备寨乡城子村，请问是否需要隔离?,1643688048,183.197.171.*,已办理,已办理,线下交办,0,0,遵化市委书记,咨询,治安,微信小程序,,,,,0,1,,,,,,,0,0,1643696094, 河北省 承德市,False,2022-02-01
9,12803785,5666608,813,1,12.0,0,伟***,咨询,当天被集中隔离。后经自查叫：时空伴随者。    我想咨询一下，时空伴随者的密接是否需要集中<label style='color:re...,1643682535,183.196.181.*,已办理,已办理,未交办,0,0,邢台市委书记钱三雄,咨询,医疗,手机浏览器,,,,,0,1,,,,,,,0,0,1643695994, 河北省,False,2022-02-01
0,12803246,4796308,1469,6,1.0,0,d***,投诉,"尊敬的各位领导您们好：
        为了缓解拥堵，防止违停行为， 江北区郭家沱街道望江文化广场和望江车站广场周边在政府部门、交通管理部门和社区的大力支持下，花了不少的心思，采取了一系列的措施，比如...",1643671188,183.226.14.*,已办理,已办理,线上交办,0,0,江北区委书记滕宏伟,求助,治安,客户端,,,,,0,1,,,,,,,0,0,1643679363, 山西省,False,2022-01-31
1,12801829,5650951,2829,9,2.0,0,小***,感谢街道工作人员对隔离人员的关怀以及节日问候,本人1月29号从香港回深圳，在深圳龙岗布吉世纪皇廷酒店进行为期14天的隔离。,1643625555,113.110.184.*,已办理,已一次评价,未交办,0,0,龙岗区委书记,感谢,政务,PC浏览器,,,,,0,1,0.0,,5.0,5.0,5.0,5.0,0,1,1643678822, 广东省 深圳市,False,2022-01-31
2,12799099,5664991,1161,1,12.0,0,y***,关于杭州返回商丘的政策,从浙江省杭州市萧山区返回商丘有什么新的政策，萧山区是低风险地区，需要集中隔离吗？还是居家隔谢谢,1643583649,182.118.236.*,已办理,已办理,线上交办,0,0,商丘市委书记李国胜,咨询,医疗,手机浏览器,,,,,0,1,,,,,,,0,0,1643614903, 河南省 郑州市,False,2022-01-30
3,12798716,5662602,591,2,2.0,0,w***,问题反映,领导您好，疫情隔离期间生活困难无收入！滞留人员申请的现金救助显示已发放未到帐！别人申请的已发放都到帐800了！我的已发放一直未到帐，望...,1643563238,140.243.203.*,办理中,待回复,线下交办,0,0,陕西省委书记刘国中,投诉,政务,客户端,,,,,0,1,0.0,,,,,,0,1,1643623475, 福建省 福州市,False,2022-01-30
4,12798507,5650366,2484,6,6.0,0,读***,返永政策,想咨询一下目前安阳市北关区返永政策，现在返永是否还要集中隔离。,1643558291,123.161.38.*,已办理,已办理,未交办,0,0,永城市委书记高大立,求助,交通,手机浏览器,,,,,0,1,,,,,,,0,0,1643601266, 河南省 安阳市,False,2022-01-30
5,12798199,4426079,1596,2,7.0,0,W***,金鹏金岭段绿化提升保留有违立的地面停车标志牌,1.请拆除原来的违立的地面停车牌标志2.修有孩童玩耍的地方依然停车严重，后续开放后孩童多，安全隐患巨大，建议把路口只允许步行进去绿化区和孩童玩耍区3.新修的离金鹏集团那边绿化应设计<label sty...,1643555434,183.69.222.*,已办理,已办理,未交办,0,0,两江新区管委会主任罗蔺,投诉,城建,微信小程序,,,,,0,1,0.0,,,,,,0,1,1643623375, 重庆市,False,2022-01-30
6,12798137,1657617,1395,1,12.0,116,W***,返甘来甘，回乡低风险,国家政务网公布得低风险来甘人员，持有✳得行程卡，需要集中隔离还是，居家隔离</lab...,1643555034,223.104.56.*,已办理,已办理,线上交办,0,0,天水市委书记张永霞,咨询,医疗,PC浏览器,,,,,0,1,0.0,,,,,,0,3,1643614731, 北京市,False,2022-01-30
7,12796875,5089524,811,1,12.0,0,桃***,邯郸春节外地返乡什么政策,保定不是中高风险地区，回去不用隔离吧？拿健康吗、48h核酸就可以吧？,1643544350,27.187.11.*,已办理,已办理,未交办,0,0,邯郸市委书记张维亮,咨询,医疗,客户端,,,,,0,1,,,,,,,0,0,1643614731, 河北省 保定市,False,2022-01-30
8,12795403,5663477,2093,2,5.0,0,T***,投诉厦门金瑞佳泰酒店,尊敬的领导，我于2022年1月13日入境厦门金瑞佳泰酒店隔离。,1643530614,218.85.130.*,已办理,已一次评价,未交办,0,0,思明区委书记,投诉,旅游,手机浏览器,,,,,0,1,0.0,,1.0,1.0,1.0,1.0,0,1,1643545775, 福建省 厦门市,False,2022-01-30
9,12794852,2301564,4140,1,5.0,0,W***,从河南商丘市永城市到大丰自驾,领导你好：自驾从盐城回去到河南商丘永城，在家呆几天然后自驾从商丘永城回来，不经过中高风险区来大丰回被集中隔离吗？还是集中<label ...,1643525311,117.93.88.*,已办理,已办理,未交办,0,1,大丰区委书记,咨询,旅游,微信小程序,,,,,0,1,,,,,,,0,0,1643545775, 江苏省 盐城市,False,2022-01-30
0,12794768,5663229,1136,2,14.0,0,W***,河南郑州望龙教育 与 正恩教育,尤其一个叫陈*的，还一直到处骗人，找他退款，他就说他被隔离了，各种借口。转眼又和别人说在正常上班。,1643524573,221.192.179.*,已办理,已办理,未交办,0,0,郑州市市长何雄（代）,投诉,教育,微信小程序,,,,,0,1,0.0,,,,,,0,1,1643545775, 河北省 石家庄市,False,2022-01-30
1,12794589,5649302,1852,6,12.0,116,A***,核酸检测,我想请问一下为什么永安卫生院隔离点同时做的双检核酸检测，一直查询不到结果，希望领导帮忙沟通一下。,1643522722,119.5.26.*,已办理,已办理,线下交办,0,0,高坪区委书记,求助,医疗,手机浏览器,,,,,0,1,,,,,,,0,0,1643545775, 四川省 南充市,False,2022-01-30
2,12794231,5662959,555,6,12.0,0,夜***,健康码异常6天求助,我在2022年01月03日从加拿大坐飞机到上海进行14+7隔离，于2022年01月24号解除<label style='color:r...,1643518913,112.50.89.*,已办理,已办理,未交办,0,0,上海市委书记李强,求助,医疗,客户端,,,,,0,1,0.0,,,,,,0,1,1643545775, 上海市,False,2022-01-30
3,12794177,5633700,814,1,1.0,116,l***,返乡防疫政策咨询,在国务院风险地区查询小程序上查询我所在的北京朝阳区酒仙桥街道属于低风险区，返回邢台市襄都区是否需要隔离？盼复。,1643518449,183.197.10.*,已办理,已办理,线下交办,0,0,邢台市市长宋华英,咨询,治安,手机浏览器,,,,,0,1,,,,,,,0,0,1643545775, 河北省 唐山市,False,2022-01-30
