,tid,userId,fid,typeId,domainId,topicId,nickName,subject,content,dateline,ip,stateInfo,traceInfo,processInfo,hasReported,favNum,forumName,typeName,domainName,sourceName,answerId,answerContent,answerDateline,answerOrganization,userType,threadState,publicAttachment,userFavStatus,grade,gradeLevel,gradeManner,gradeSpeed,trashRecheckState,attachment,threadsCheckTime,from,mobile,tag,shisiwu,date
3,14571079,6765963,913,5,7.0,0,Z***,请求设立松原市研究生考试点,领导您好，由于松原市没有设立研究生考点，所以需要在松原市报考研究生的考生需要前往其他城市进行考试，在新冠疫情的大环境下，涉及到隔离等的...,1652061868,222.169.55.*,待回复,待回复,未交办,0,0,松原市委书记李晓杰,建言,城建,手机浏览器,,,,,0,1,,,,,,,0,0,1652230703, 吉林省 松原市,,,False,2022-05-09
4,14570347,1710665,1260,2,1.0,0,G***,长期堵路口违停,南宁市良庆区兴象路北段路中间长期大量车辆违停，影响市民出行，阻挡视线，有较大的安全隐患，过往车辆不方便掉头进入附近巷子（兴象路东一巷至东四巷），请采取实际有效的措施管控好，杜绝此类现象，建议在路中间增...,1652060088,223.104.90.*,办理中,待回复,线下交办,0,0,南宁市市长廖立勇,投诉,治安,微信小程序,,,,,0,1,,,,,,,0,0,1652229708, 北京市,,,False,2022-05-09
5,14566642,6764116,2374,6,7.0,0,W***,荥阳市民想享受国家政策,亲爱的荥阳市委书记你好，我是在郑州的打工人，我在远洋沁山水花园买了一套房，因为疫情原因我被集中隔离不能按时去收房，但是物业明确告知我就...,1652021758,182.118.238.*,已办理,已一次评价,线上交办,0,0,荥阳市委书记,求助,城建,微信小程序,,,,,0,1,,,1.3,1.0,1.0,2.0,0,0,1652193754, 河南省 郑州市,,,False,2022-05-08
6,14566451,6764041,591,5,14.0,0,十***,省考重启时间能否提前20天左右告知考生,感谢您百忙之中看到我的留言，最近疫情还没有完全稳定下来，省考的考生中有许多非本省生活工作的同学，考虑到各个地方疫情情况不一样，需要不同时长的隔离</l...,1652020665,223.72.43.*,待回复,待回复,未交办,0,1,陕西省委书记刘国中,建言,教育,PC浏览器,,,,,0,1,,,,,,,0,0,1652169062, 北京市,,,False,2022-05-08
7,14566103,6763743,574,1,14.0,0,墨***,2022年省考时间安排,主要有以下几点困惑：1.考试公告会提前多久发布；2.省外中高风险地区回湖南参加考试是否需要隔离；3.五月如果因为疫情比较难以组织考试，...,1652018951,113.220.44.*,已办理,已办理,未交办,0,0,湖南省省长毛伟明,咨询,教育,PC浏览器,,,,,0,1,,,,,,,0,0,1652081850, 湖南省 张家界市,,,False,2022-05-08
8,14563142,1993518,595,5,14.0,0,小***,关于教师资格证面试的建言,尊敬的领导，您好，5月14-15号将开展的教师资格证面试，考虑西宁目前疫情比较严重，像我们其他州县的考生将前往西宁考点时可能需要隔离，...,1652007754,117.136.29.*,已办理,已一次评价,线上交办,0,0,青海省委书记信长星,建言,教育,客户端,,,,,0,1,,,5.0,5.0,5.0,5.0,0,0,1652145257, 青海省 西宁市,,,False,2022-05-08
9,14562813,2236664,4498,2,7.0,0,热***,成汉南路社会车辆违法停靠,有关部门回复时提出会撤销隔离栏杆，半年后仍未见任何措施。希望有关部门制定有效措施，切实根治违停行为。,1652006192,112.45.97.*,已办理,已一次评价,未交办,0,0,高新区党工委书记,投诉,城建,PC浏览器,,,,,0,1,,,4.2,3.0,5.0,5.0,0,0,1652082980, 四川省,,,False,2022-05-08
0,14560193,3667221,1260,5,7.0,0,南***,明秀秀灵路口到西大东门沿线人行道望增设隔离墩,尊敬的领导：明秀秀灵路口——第六人民医院——广西工业职业技术学院——广西大学东门，沿线人行道希望能增设隔离墩防电驴违规。这一路的电驴违...,1651995902,117.181.147.*,办理中,待回复,线下交办,0,0,南宁市市长廖立勇,建言,城建,PC浏览器,,,,,0,1,,,,,,,0,0,1652173339, 北京市,,,False,2022-05-08
1,14558020,6758378,4733,1,2.0,116,Z***,关于雄安新区疫情防控政策,您好，请问一下，北京地区人员进入雄安新区建设工地工作，有什么政策，是否需要执行“14+7”隔离政策。,1651992374,106.121.10.*,已办理,已办理,未交办,0,0,雄安新区管委会主任张国华,咨询,政务,手机浏览器,,,,,0,1,,,,,,,0,0,1652020065, 北京市,,,False,2022-05-08
2,14554907,6699718,1033,5,7.0,0,W***(已注销),延安路路面提升改造、延安路隧道和东海大道隧道,对于东海大道以北的延安路路面的提升改造我建议要给路面材质满满填充海绵这样把东海大道以北的延安路提升改造成黑色沥青海绵道路，以及再给提升改造后的东海大道以北的延安路的路面画上智慧型的交通标线、安置各种各...,1651990702,114.106.24.*,已办理,已办理,未交办,0,0,蚌埠市委书记黄晓武,建言,城建,微信小程序,,,,,0,1,,,,,,,0,0,1652060625, 安徽省 滁州市,,,False,2022-05-08
3,14551688,4398830,741,6,2.0,0,h***,疫情期间居住证续签,目前是已预定5月中旬回京办理，但因为朝阳区疫情突然严重，我爱人办完居住证续签仍需去外地，外地政策北京过去的需要去酒店隔离，对工作生活都...,1651981342,123.117.183.*,已办理,已一次评价,线下交办,0,0,朝阳区委书记文献,求助,政务,PC浏览器,,,,,0,1,,,3.8,2.0,5.0,5.0,0,0,1652195409, 北京市,,,False,2022-05-08
4,14550941,6544137,5069,5,,0,Z***,关于疫情防控的建议,建议：国内疫情在外防输入同时(外防所有人员在工作期间单独居住)，做好跨省防控疫情至关重要，一是对重点疫情地区人员跨省流动，必须有24小时内的核酸阴性报告，到达各省后实施5天集中<label style...,1651978168,183.220.5.*,待回复,待回复,未交办,0,0,国家卫生健康委员会主任、党组书记马晓伟,建言,,客户端,,,,,0,1,,,,,,,0,0,1652141989, 四川省 成都市,,,False,2022-05-08
5,14550356,6752462,570,6,14.0,0,W***,关于新乡医学院三全学院（新乡校区）后勤,而且最近加装了隔离网，让本就不堪的后勤保障服务更加雪上加霜。三全学院作为从新乡校区始建，不应该只抓平原新区保障服务。,1651975709,39.144.21.*,待回复,待回复,未交办,0,0,河南省省长王凯,求助,教育,微信小程序,,,,,0,1,1.0,,,,,,0,1,1652229708, 北京市,,,False,2022-05-08
6,14550273,6699718,1033,5,7.0,0,W***(已注销),立刻将圈堤东路和凤阳路的路面提升改造,以及在给圈堤东路路面紧急抢修和提升改造的同时要给路面材质满满填充海绵这样把圈堤东路提升改造成黑色沥青海绵道路，以及再给提升改造后的圈堤东路的路面画上智慧型的交通标线、安置各种各样的地灯等照明设施、在双...,1651975323,223.246.192.*,已办理,已办理,未交办,0,0,蚌埠市委书记黄晓武,建言,城建,微信小程序,,,,,0,1,,,,,,,0,0,1652060625, 安徽省 合肥市,,,False,2022-05-08
7,14549056,4190900,541,2,7.0,0,平***,投诉东丽区万新街畅悦华庭物业破坏35号楼草坪建,"现在我们居民要求物业：
①要求物业清理35号楼停在楼下门前的所有车辆
②及时按装原有的路边隔离杆
③雨季已来，泥泞的门前及时补铺草坪植...",1651969262,211.94.235.*,已办理,已一次评价,线上交办,0,1,天津市委书记李鸿忠,投诉,城建,客户端,,,,,0,1,0.0,,3.3,3.0,4.0,3.0,0,1,1652238195, 天津市,,,False,2022-05-08
8,14547703,6751664,873,6,6.0,0,执***,希望在外求学的孩子 安全到家 ,尊敬的沈阳领导 你们好 我是一个来自农村的小老太婆 我的儿子在吉林师范博达学院求学  突然来的疫情让人措手不及 在学校隔离管控了两个多...,1651952709,39.188.220.*,已办理,已办理,未交办,0,0,沈阳市委书记王新伟,求助,交通,手机浏览器,,,,,0,1,,,,,,,0,0,1652145257, 浙江省 宁波市,,,False,2022-05-07
9,14545814,2876294,1008,1,12.0,0,巧***,咨询隔离政策,从安徽淮北（低风险地区）前往杭州需要隔离吗？,1651931410,39.144.35.*,已办理,已一次评价,未交办,0,0,杭州市市长刘忻,咨询,医疗,手机浏览器,,,,,0,1,,,5.0,5.0,5.0,5.0,0,0,1652145257, 北京市,,,False,2022-05-07
0,14545017,5602567,982,1,7.0,0,老***,五桥沿线隔离噪音尾气的措施何时落地？,五桥沿线噪音和尾气叠加，严重影响居民生活质量，2020年南京江北新区五桥沿线地区城市设计及控规调整中提出，五桥沿线不再新增居住用地，在已建居住用地与快速路之间设置商业等配套设施，<label styl...,1651927880,122.96.32.*,已办理,已办理,线上交办,0,0,南京市市长夏心旻,咨询,城建,客户端,,,,,0,1,,,,,,,0,0,1652002723, 江苏省 南京市,,,False,2022-05-07
1,14543222,5368405,805,5,6.0,0,石***,长安区石纺路北城国际步行街至沿西街段道路管理,石纺路北城国际步行街至沿西街段道路相对于相邻路段两边没有商超、没有绿化隔离带，明显宽阔很多。,1651920662,223.104.103.*,已办理,已办理,线上交办,0,1,石家庄市委书记张超超,建言,交通,客户端,,,,,0,1,,,,,,,0,0,1652145257, 北京市,,,False,2022-05-07
2,14542456,1876259,595,5,12.0,0,腾***,关于疫情防控的建议,建议在省、市交界的所有道路、车站、机场设置临时隔离检查点，对来往人员的双码、核酸报告、行程做主动问询，对符合防疫政策流动的人员就地进行...,1651917198,36.100.43.*,已办理,已办理,线上交办,0,0,青海省委书记信长星,建言,医疗,客户端,,,,,0,1,,,,,,,0,0,1652145257, 浙江省 杭州市,,,False,2022-05-07
3,14541620,6747762,1368,2,7.0,0,W***,举报违章建筑,中间没有栏杆隔离，其中27号楼以前为开发商自己的酒店用房，目前物业回复业主27号楼开发商整体卖给陕西七建！而七建在三栋楼共有的绿化地现...,1651914569,223.104.11.*,待回复,待回复,未交办,0,1,西安市市长李明远,投诉,城建,微信小程序,,,,,0,1,0.0,,,,,,0,1,1652023342, 陕西省 西安市,,,False,2022-05-07
4,14541163,6747587,1113,2,7.0,0,9***,碧桂园桃李东方小区出入口通行存在安全隐患,2.小区东门正对东方路绿化隔离带，进出小区需要先进入东方路辅道才能进入小区，非常不方便。建议自然资源和规划、城建、交警部门充分考虑协调...,1651913260,111.35.21.*,已办理,已办理,未交办,0,0,潍坊市委书记田庆盈,投诉,城建,手机浏览器,,,,,0,1,,,,,,,0,0,1652020432, 山东省 临沂市,,,False,2022-05-07
5,14541152,2243179,1786,5,6.0,0,怀***,乱停乱放，违规变道,双流区黄龙大道二段近牧华路口有一口子，左右两边分别为草坪小区和杰邦孵化谷二期，每天大量车辆违规变道，（查看该路段地面为双黄实线）经常造成路口拥堵，剐蹭事故偶有发生，请问领导该路口是否可以变道调头，如果...,1651913235,110.184.57.*,已办理,已一次评价,线下交办,0,0,双流区委书记,建言,交通,PC浏览器,,,,,0,1,,,1.6,1.0,1.0,3.0,0,0,1651930449, 四川省 成都市,,,False,2022-05-07
6,14541133,6747657,539,1,14.0,0,先***,低风险地区返京上学是否需要隔离14天？,"我与孩子从低风险地区自驾车返京，丰台某幼儿园称，教委要求居家隔离14天才能入园，请问是否有相关政策？

如果不是必须<label st...",1651913191,27.193.222.*,已办理,已办理,线下交办,0,0,北京市委书记蔡奇,咨询,教育,PC浏览器,,,,,0,1,,,,,,,0,0,1652144071, 山东省 青岛市,,,False,2022-05-07
7,14540905,1827057,557,1,11.0,0,天***,咨询2022江苏省考面试恢复时间,天发通知，按照江苏目前最低3+11防控要求时间量上非常紧张，其次一些辅导机构通过网络平台不断的预测面试时间也引起了广大考生的焦虑，我想咨询下我们的面试时间是否已经确定，是否会留出充足的时间方便外来考生...,1651912433,111.15.24.*,已办理,已一次评价,线上交办,0,3,江苏省委书记吴政隆,咨询,就业,客户端,,,,,0,1,,,5.0,5.0,5.0,5.0,0,0,1651984605, 山东省 日照市,,,False,2022-05-07
8,14536314,6744507,539,5,7.0,0,Z***,建议继续暂停家庭装修,目前北京疫情尚未完全控制，家庭装修施工无异于加大疫情传播风险，而丰台作为本轮疫情仅次于朝阳，房山等区的主要疫情发生地，又紧邻朝阳区，疫情还在继续发展，很多居民还属于弹窗或居家<label style=...,1651898051,223.72.81.*,办理中,待回复,线下交办,0,0,北京市委书记蔡奇,建言,城建,PC浏览器,,,,,0,1,,,,,,,0,0,1652144071, 北京市,,,False,2022-05-07
9,14535757,6744140,1368,2,7.0,0,W***,高科麓湾四期五号地公租房与商品房之间没有隔离,高科麓湾四期五号地商品房与政府公租房之间没有隔离区分开，公租房租住人员复杂，流动性大，对于商品房居住业主有安全隐患！,1651896397,117.136.50.*,待回复,待回复,未交办,0,1,西安市市长李明远,投诉,城建,微信小程序,,,,,0,1,,,,,,,0,0,1652023342, 北京市,,,False,2022-05-07
0,14534513,6743355,845,5,7.0,0,李***,二中路,"敬爱的闫书记：
   二中路道路拓宽之后，给人民生活带来了便利，随着尧贤街涝河大桥的开通，越来越多的人开车经过二中路，但是二中路双向车道中间一直没有设立中间<label style='color:re...",1651893309,60.221.63.*,待回复,待回复,未交办,0,0,临汾市委书记闫晨曦,建言,城建,手机浏览器,,,,,0,1,,,,,,,0,0,1652062201, 山西省 临汾市,,,False,2022-05-07
1,14534315,4570261,4669,5,2.0,0,江***,打造高效政府，提高执政服务效率,河南健康码 支付宝中转码，没有互动功能，只有审批结果，五一经过郑州，被赋黄码，核酸和隔离日期满足，提交审核完全问题很多。,1651892951,39.163.23.*,已办理,已一次评价,未交办,0,1,滑县县长陆志杰,建言,政务,PC浏览器,,,,,0,1,,,3.3,3.0,5.0,2.0,0,0,1652145257, 北京市,,,False,2022-05-07
2,14533817,6742883,591,2,7.0,0,W***,开发商私自将小区绿化面积出售,中间没有栏杆隔离，其中27号楼以前为开发商自己的酒店用房，目前物业回复业主27号楼开发商整体卖给陕西七建！而七建在三栋楼共有的绿化地现...,1651891891,117.136.87.*,待回复,待回复,未交办,0,0,陕西省委书记刘国中,投诉,城建,微信小程序,,,,,0,1,,,,,,,0,0,1652023342, 北京市,,,False,2022-05-07
3,14533522,6742757,1368,2,7.0,0,W***,陕七建没有施工许可证在公共绿化区违建,中间没有栏杆隔离，其中27号楼以前为开发商自己的酒店用房，目前物业回复业主27号楼开发商整体卖给陕西七建！而七建在三栋楼共有的绿化地现...,1651891140,111.18.93.*,待回复,待回复,未交办,0,0,西安市市长李明远,投诉,城建,微信小程序,,,,,0,1,,,,,,,0,0,1652023342, 北京市,,,False,2022-05-07
4,14533130,6738331,741,6,14.0,0,居***,关于2022年幼升小居住证问题,我丈夫的居住时间是符合要求的，但因为我的居住证有断，我说明一下情况：2021年9月份初因需出国学习，原居住证到期时间为10月15日，只能提前一个月办理，9月初无法续签，本应10月底回国，但因疫情原因导...,1651890224,1.203.100.*,已办理,已办理,线下交办,0,0,朝阳区委书记文献,求助,教育,PC浏览器,,,,,0,1,,,,,,,0,0,1652167436, 北京市,,,False,2022-05-07
5,14532531,6742183,1957,2,6.0,0,古***,长荣北路长期交通堵塞 天悦东都的人路边乱停车,解决措施：中央隔离栏杆应该延伸至灞业大境蜜雪冰城附近，这个问题就一劳永逸的解决了。,1651888751,111.18.142.*,已办理,已办理,未交办,0,0,灞桥区委书记,投诉,交通,手机浏览器,,,,,0,1,,,,,,,0,0,1651994065, 北京市,,,False,2022-05-07
6,14531966,5396836,1115,1,6.0,0,幽***,烟台回乳山,你好领导，我在烟台工作，五月中旬需要从烟台回威海举行婚礼，请问现在的防疫政策是什么，回来后需不需要隔离，谢谢,1651887165,112.224.154.*,已办理,已一次评价,未交办,0,0,威海市委书记张海波,咨询,交通,手机浏览器,,,,,0,1,,,5.0,5.0,5.0,5.0,0,0,1651994065, 山东省 青岛市,,,False,2022-05-07
7,14531147,6561315,742,6,2.0,0,h***,入境外省隔离入京政策,因得不到完整政策落地执行方案，各方都说等政策，只能请教咨询：5月3日入境厦门，具体到底隔离多少天才能回到北京？按照5月4日北京政策，是...,1651884747,111.31.53.*,已办理,已办理,未交办,0,0,朝阳区区长,求助,政务,客户端,,,,,0,1,,,,,,,0,0,1652167436, 天津市,,,False,2022-05-07
8,14529951,6741040,1682,5,1.0,0,天***,中高风险地区返定人员强制隔离14天,您好，鉴于各地疫情反复，均是外来人员自中高风险地区返回引发，建议中高风险人员返定，强制隔离14天。,1651879364,27.187.28.*,已办理,已办理,线下交办,0,0,定州市委书记张涛,建言,治安,手机浏览器,,,,,0,1,,,,,,,0,0,1651994065, 河北省 保定市,,,False,2022-05-06
9,14526863,6739413,2447,6,13.0,0,W***,疫情防控,我是秀水苑小区三号楼的业主，悦美酒店住的是隔离人员，酒店的后门在我们三号楼旁边，今天酒店的后门都开着呢，能不能锁上呀？我们离这门太近了...,1651845779,115.53.51.*,已办理,已办理,未交办,0,0,华龙区委书记,求助,环保,微信小程序,,,,,0,1,,,,,,,0,0,1651930449, 河南省 濮阳市,,,False,2022-05-06
0,14526683,6739327,554,1,2.0,0,W***,上海返回哈尔滨,本人多次拨打哈尔滨12345均未有准确的答复，我就想问下我从上海自驾回哈尔滨携带宠物猫一只，本人可以进行集中隔离但是宠物猫怎么办？是随...,1651845115,220.196.194.*,已办理,已办理,线上交办,0,1,黑龙江省省长胡昌升,咨询,政务,黑龙江省政府网站,,,,,0,1,,,,,,,0,0,1651929130, 江苏省 徐州市,,,False,2022-05-06
1,14526318,6429081,1223,2,1.0,0,W***,我们建议的珠江路往西是嵩山路，往东是庐山路，,我们是居住翠英庄的居民，就珠江路中往东是庐山路，往西是嵩山路，整段路都隔离栏拦截着，左右两边来往不方便，两边都有小学，中学，一到上学放...,1651843810,223.104.64.*,已办理,已办理,线下交办,0,0,汕头市委书记温湛滨,投诉,治安,微信小程序,,,,,0,1,,,,,,,0,0,1651930449, 山西省,,,False,2022-05-06
2,14524626,2035309,1290,2,6.0,0,绿***,违章停车,新都区大丰街道违章停车相当严重，如在不严加管理大丰违章车辆会一发不可收拾，如：方元路两侧非机动车道  赵家寺路  桂蕊街（建议方元路口至大成路口段设置中央<label style='color:red...,1651837759,223.104.216.*,已办理,已办理,线上交办,0,0,成都市市长王凤朝,投诉,交通,客户端,,,,,0,1,0.0,,,,,,0,1,1651930449, 北京市,,,False,2022-05-06
3,14522338,6736465,805,6,7.0,116,s***,住房公积金的政策建议,我人在北京上班， 在石家庄鹿泉区公积金贷款买房， 现在已经到了提交材料 ，到公积金那里办理贷款了， 必须得本人亲自办理 ，但是由于疫情也回不去 ，即便回去也得<label style='color:r...,1651829966,117.133.38.*,已办理,已办理,线上交办,0,0,石家庄市委书记张超超,求助,城建,PC浏览器,,,,,0,1,,,,,,,0,0,1651892112, 北京市,,,False,2022-05-06
4,14518913,6426007,541,6,11.0,0,W***,快递员工资一直无果,因为疫情在老家隔离，过段时间还要收小麦，现在我没有任何收入，正是需要钱的时候，信用卡即将面临逾期。,1651821577,112.36.49.*,已办理,已办理,线上交办,0,0,天津市委书记李鸿忠,求助,就业,微信小程序,,,,,0,1,0.0,,,,,,0,1,1652020065, 山东省 德州市,,,False,2022-05-06
5,14517946,4998285,757,6,4.0,0,赵***,不退款,我在某网站，购买了娇兰水隔离乳，口红，三个月了，不发货，我申请退款一个多月了，没有收到退款，请领导帮我督促退款，金额1695元谢谢,1651819203,223.104.96.*,已办理,已二次评价,未交办,0,0,昌平区委书记甘靖中,求助,企业,客户端,,,,,0,1,0.0,,1.0,1.0,1.0,1.0,0,1,1651928415, 山西省,,,False,2022-05-06
6,14516912,4778270,2432,2,12.0,0,求***,古固寨主动上报隔离每日核酸检测高价收费,我爱人五月3日晚上第一时间上报行程，居家隔离，被要求每日做核酸，然而高价收费单检24元，但是据我了解新乡此次因为去过郑州<label ...,1651816158,115.62.247.*,已办理,已办理,线下交办,0,0,新乡县委书记,投诉,医疗,客户端,,,,,0,1,,,,,,,0,0,1651930449, 河南省 新乡市,,,False,2022-05-06
7,14513753,6730802,2426,2,7.0,0,木***,天鹅城小区物业,小区二期水泥道路、隔离墩等损毁严重，造成多名儿童受伤，且垃圾清理不及时，与物业沟通多次，均以正在申请、需要报备、换了新领导等为理由，且...,1651807661,111.187.76.*,已办理,已办理,线下交办,0,0,卫滨区委书记,投诉,城建,PC浏览器,,,,,0,1,,,,,,,0,0,1651892112, 上海市,,,False,2022-05-06
8,14513406,4666922,1368,6,2.0,0,杜***,灞桥区永丰社区沟通进度问题,灞桥区辰宇世纪城1-6号楼安置房与7-10商品房存在不同物业管理，且中间无隔离带，导致管理不便、人员混乱。2021年灞桥区住建局、永丰...,1651806947,123.139.66.*,待回复,待回复,未交办,0,0,西安市市长李明远,求助,政务,PC浏览器,,,,,0,1,,,,,,,0,0,1651930449, 陕西省 西安市,,,False,2022-05-06
9,14511635,1752085,1957,2,7.0,0,萝***,建工清凉灞柳开发商小区内部非法进行隔离,近期发现小区开始围挡，对别墅区和高层进行隔离。从开发商处得到的消息是高层跟别墅期间隔...,1651803427,111.21.216.*,待回复,待回复,未交办,0,0,灞桥区委书记,投诉,城建,微信小程序,,,,,0,1,,,,,,,0,0,1651997520, 北京市,,,False,2022-05-06
0,14511197,6552692,1572,1,14.0,116,上***,关于疫情之下不能如期参加教师资格证面试的问题,今天打电话咨询了亳州市疫情防控问题，（之前一直没打通）说需要隔离七天，但是目前因为工作原因不能请一个星期假回去参加考试，而且就算可以，...,1651802520,39.144.38.*,已办理,已办理,未交办,0,0,亳州市委书记杜延安,咨询,教育,客户端,,,,,0,1,0.0,,,,,,0,1,1651814288, 北京市,,,False,2022-05-06
1,14506186,6726638,5103,6,11.0,0,W***,老板以疫情为由恶意拖欠工资一个多月,本人于2021年11月在铜锣湾写字楼美舍家居生活馆担任设计助理工作至3月21日后因疫情居家隔离，本因3月28日发放工资2800元，老板...,1651761997,223.104.10.*,已办理,已办理,未交办,0,0,红谷滩区委书记,求助,就业,微信小程序,,,,,0,1,1.0,,,,,,0,1,1652020065, 北京市,,,False,2022-05-05
2,14505789,6726646,805,2,7.0,0,W***,恒辉物业乱收费,1.延期违约金2.物业费高3.物业降低标准4.回迁不隔离5.至今园区大门未建成6.人车分流问题7.未按照购房承诺兑现相应配套设备（热水...,1651760284,106.119.58.*,已办理,已办理,未交办,0,1,石家庄市委书记张超超,投诉,城建,微信小程序,,,,,0,1,,,,,,,0,0,1651819406, 河北省,,,False,2022-05-05
3,14502202,6724426,539,6,1.0,0,等***,【急】北京市小客车指标管理信息系统审核不通过,由于系统并未注明审核什么时候能查询到审核结果，也不可能每天都登录系统进行查询结果，同时由于4月份疫情居家隔离，对于审核失败并不知情。审...,1651744789,123.123.44.*,办理中,待回复,线下交办,0,0,北京市委书记蔡奇,求助,治安,PC浏览器,,,,,0,1,,,,,,,0,0,1651810312, 北京市,,,False,2022-05-05
4,14501504,3617146,541,6,7.0,116,河***,多盏路灯不亮,2.四纬路马路中间隔离带（五经路至四纬路立交桥的桥口）上，有连续五盏路灯不亮，是那种分叉型灯杆上两个灯头的路灯杆，如上传的第三张图片所...,1651742603,111.163.123.*,办理中,待回复,线上交办,0,0,天津市委书记李鸿忠,求助,城建,PC浏览器,,,,,0,1,1.0,,,,,,0,1,1653292113, 天津市,,,False,2022-05-05
5,14501417,6558782,1135,6,6.0,0,陌***,驾驶证因为未体检，被锁,然后第二天又回了湖南怀化上班，然后没过几天又五一放假了，今天已经正常上班，但是还没给我解锁，由于去了一趟郑州，目前我都在宾馆隔离当中，...,1651742317,120.226.215.*,已办理,已一次评价,线下交办,0,1,郑州市委书记安伟,求助,交通,手机浏览器,,,,,0,1,,,1.0,1.0,1.0,1.0,0,0,1651813524, 河南省,,,False,2022-05-05
6,14501366,3204431,1343,6,7.0,0,c***,老人民医院东门人行道诉求,关于在保山市人民医院东大门 ，太保北路中心隔离栏上开设人行通道的请求。,1651742169,117.136.80.*,已办理,已办理,未交办,0,0,保山市委书记杨军,求助,城建,客户端,,,,,0,1,,,,,,,0,0,1651813524, 北京市,,,False,2022-05-05
7,14499365,3216102,2346,2,7.0,0,异***,舒城皖能燃气让群众多跑腿，服务态度差,说话声音小点她说让你大点声，你大点声她说你激动吼她，一个公文包靠在隔离台玻璃上她说我们玻璃不能靠，会摔碎吗，这都是什么人？,1651736994,112.31.169.*,已办理,已办理,未交办,0,1,舒城县委书记,投诉,城建,PC浏览器,,,,,0,1,,,,,,,0,0,1651882890, 上海市,,,False,2022-05-05
