,tid,userId,fid,typeId,domainId,topicId,nickName,subject,content,dateline,ip,stateInfo,traceInfo,processInfo,hasReported,favNum,forumName,typeName,domainName,sourceName,answerId,answerContent,answerDateline,answerOrganization,userType,threadState,publicAttachment,userFavStatus,grade,gradeLevel,gradeManner,gradeSpeed,trashRecheckState,attachment,threadsCheckTime,from,mobile,tag,shisiwu,date
6,14090895,6485950,2828,5,1.0,0,M***,西乡街道固戍规划一路和宝源路交叉路口违停问题,建议：恳请趁现在规划一路路口（海船大厦停车场出入口）疫情封闭期间，西乡街道办协调在规划一路路口位置，对规划一路的道路中间增设矮隔离桩，...,1649648041,113.110.165.*,已办理,已办理,未交办,0,0,宝安区委书记,建言,治安,PC浏览器,,,,,0,1,0.0,,,,,,0,1,1649725512, 广东省 深圳市,,,False,2022-04-11
7,14090812,6486130,2265,2,12.0,0,W***,肥西紫荆名都汤口路社区医院,我们入住两年了，周围配套设施还没有完善，我们拖家带口菜都买不到，没有等来社区医院和菜市场缺等来了酒店，在几千人口密集区建设隔离区，拿左...,1649647695,60.168.139.*,已办理,已办理,线下交办,0,0,肥西县委书记,投诉,医疗,微信小程序,,,,,0,1,0.0,,,,,,0,3,1649725512, 安徽省 合肥市,,,False,2022-04-11
8,14090184,6480963,567,6,11.0,0,满***,因疫情隔离二级建造师报名成功却无法缴费求挽回,却万万没想到从第二天因为疫情被隔离起来，都知道我们山东省滨州市疫情非常严重，一直处于...,1649645395,27.209.184.*,已办理,已办理,未交办,0,1,山东省委书记李干杰,求助,就业,PC浏览器,,,,,0,1,0.0,,,,,,0,1,1649768629, 山东省 滨州市,,,False,2022-04-11
9,14090105,5431203,2484,6,2.0,0,c***,民生物资配送,尊敬的领导您好，我是完达山奶粉永城市场负责人，因我市受疫情影响全民居家隔离，现有部分宝宝急需奶粉配送，恳请领导协调相关部门在疫情政策允...,1649644998,42.228.98.*,已办理,已办理,线下交办,0,0,永城市委书记高大立,求助,政务,客户端,,,,,0,1,,,,,,,0,0,1649768629, 河南省 郑州市,,,False,2022-04-11
0,14090075,6485780,5080,5,,116,Z***,未来的防疫建议,6、无症状轻症状感染者在家隔离，发放药品。7、鼓励所有人核酸自测三天一次。8、先采取几个大中小城市试点。,1649644882,223.101.64.*,待回复,待回复,未交办,0,0,国家医疗保障局党组书记、局长胡静林,建言,,手机浏览器,,,,,0,1,,,,,,,0,0,1649723915, 北京市,,,False,2022-04-11
1,14089935,5388525,1135,6,7.0,0,W***,建议郑开大道加装自行车道隔离护栏,建议从郑开大道与京港澳高速交叉口开始到郑开大道与前程大道交叉口之间的这段路(如图一所示黑色路段）加装自行车道隔离护栏。保障市民安全。,1649644294,182.118.236.*,已办理,已办理,线下交办,0,1,郑州市委书记安伟,求助,城建,微信小程序,,,,,0,1,0.0,,,,,,0,1,1649776926, 河南省 郑州市,,,False,2022-04-11
2,14089742,3298043,555,5,2.0,116,Z***,关于上海防疫的建议（先行重点应对外围5区）,疫情数据通报分为“隔离管控中发现的新增本土、新增本土无症状、”和“相关风险人群排查中发现的新增本土、新增本土无症状”其前者已被<lab...,1649643521,36.18.38.*,已办理,已一次评价,未交办,0,2,上海市委书记李强,建言,政务,PC浏览器,,,,,0,1,1.0,,3.6667,5.0,5.0,1.0,0,1,1649725512, 浙江省 杭州市,,,False,2022-04-11
3,14089706,6480894,539,6,6.0,0,m***,健康宝弹窗3无法消除 ,北京社区通知是就地隔离14天，才能消除。我在郑州住地隔离了14天之后...,1649643369,123.52.84.*,已办理,已办理,未交办,0,3,北京市委书记蔡奇,求助,交通,PC浏览器,,,,,0,1,0.0,,,,,,0,1,1649758255, 河南省 郑州市,,,False,2022-04-11
4,14089600,6485349,1149,5,6.0,0,子***,瓦店乡大朝村村民出行安全问题,村民短途出行多以电动车为主，恳请从实际出发，在村口两侧设置减速带、在村口两侧一百米道路上设置人行道隔离带，切实解决两千村民的出行问题！,1649642986,120.194.55.*,已办理,已办理,未交办,0,0,安阳市委书记袁家健,建言,交通,PC浏览器,,,,,0,1,,,,,,,0,0,1649739517, 河南省 驻马店市,,,False,2022-04-11
5,14088190,6395233,2366,2,6.0,0,我***,违停车辆,雅居车库出入口均设在兴华南街、淮南街，因淮南街、兴华南街车辆乱停乱放，造成业主车辆出行不便，加之兴华南街接送学生，基本上都是单车道通行，需要等上好几个红绿灯，加之道路没有设置机非<label styl...,1649635686,106.34.225.*,已办理,已办理,未交办,0,0,二七区委书记,投诉,交通,手机浏览器,,,,,0,1,0.0,,,,,,0,1,1649725512, 河南省 安阳市,,,False,2022-04-11
6,14087386,6484750,833,6,12.0,0,D***,低风险地区到长治被集中隔离，并承担高额费用,4月9日从保定到长治，出发前多次致电当地疫情防控部门，国务院客户端查询到保定市全域属于低风险地区，响应国家防疫政策居家隔离7天加3次核...,1649623786,218.26.55.*,已办理,已办理,未交办,0,0,长治市委书记杨勤荣,求助,医疗,客户端,,,,,0,1,0.0,,,,,,0,1,1649725512, 山西省 晋城市,,,False,2022-04-10
7,14087318,2135632,546,2,12.0,0,崔***,关于山西省代县王成商务酒店隔离费用，,本人家住山西省代县阳明堡镇大茹解村，现身边还带的个十六个月的小孩，现通过核酸检查轮回，是阴性，当时来代县洋成商务酒店，希望政府解决一下隔离</labe...,1649619358,1.71.241.*,办理中,待回复,线下交办,0,0,山西省省长蓝佛安,投诉,医疗,客户端,,,,,0,1,,,,,,,0,0,1649725512, 山西省 太原市,,,False,2022-04-10
8,14086984,6484536,539,6,6.0,0,双***,居住证过期影响小客车审核不通过,"我是新能源指标，排序算下来今年能得到指标，但不幸因为居住证过期3个月导致审核不通过
由于目前隔离在家，通过微信进行了居住证签注，并且立...",1649606932,61.149.74.*,已办理,已一次评价,未交办,0,5,北京市委书记蔡奇,求助,交通,手机浏览器,,,,,0,1,,,5.0,5.0,5.0,5.0,0,0,1649724845, 北京市,,,False,2022-04-10
9,14086076,6484048,1368,6,2.0,0,马***,因父亲住院需家属签字，现被隔离，需求助！,本人从北京大兴区回到杨陵区，现被隔离，因父亲在陕西省人民医院做手术（心脏大型手术）需提前解封前往陕西省人民医院签字，已给社区办杨陵防控...,1649599845,124.115.61.*,已办理,已一次评价,未交办,0,1,西安市市长李明远,求助,政务,客户端,,,,,0,1,,,4.3,4.0,5.0,4.0,0,0,1649850966, 陕西省 渭南市,,,False,2022-04-10
0,14085986,6358206,1219,2,11.0,0,苦***,深圳市技术大学虚假招聘-坪河雅苑幼儿园教职工,3、招聘信息 配的图，没有一张是 坪河雅苑小区的幼儿园；4、目前，坪河雅苑小区及其幼儿园被用作为隔离防疫酒店。但，本月4月1日，深圳外...,1649599355,223.213.138.*,已办理,已办理,未交办,0,6,深圳市委书记孟凡利,投诉,就业,PC浏览器,,,,,0,1,,,,,,,0,0,1649725512, 广东省 深圳市,,,False,2022-04-10
1,14085819,2379034,555,5,12.0,116,勇***,从吉林抗疫，为上海提点建议,阻断病毒传播，我们在不流动的人口中，找到病毒携带者和接触者，有效隔离医疗，找病毒携带者最重要手段就是核酸检测，但全员核酸检测，应该是分...,1649598399,39.144.100.*,已办理,已一次评价,未交办,0,2,上海市委书记李强,建言,医疗,客户端,,,,,0,1,,,5.0,5.0,5.0,5.0,0,0,1649642084, 北京市,,,False,2022-04-10
2,14085584,6483905,2814,2,12.0,0,小***,丘大叔门店料理区外有未戴口罩人员,8点35分左右，有1名未戴好口罩的女子进入丘大叔柠檬茶康王中路门店，员工劝喻该女子正确佩戴口罩，该女子戴好后不久把口罩拉开（未遮挡鼻子及嘴巴部位），期间一直在料理区与员工聊天，该店铺料理区内外未有挡板...,1649597252,220.198.221.*,已办理,已办理,未交办,0,1,荔湾区委书记,投诉,医疗,客户端,,,,,0,1,,,,,,,0,0,1649725512, 广东省 广州市,,,False,2022-04-10
3,14085491,2574916,1056,1,12.0,0,露***,新冠疫情防控问题,爱人是城南中心小学教师，4月3号疫情开始时就按照要求向社区报备，并居家隔离（住在市区）。我一直跟我爱人生活在一起，我本人也按照要求居家...,1649596681,36.57.9.*,已办理,已办理,未交办,0,1,六安市市长潘东旭,咨询,医疗,PC浏览器,,,,,0,1,,,,,,,0,0,1649725512, 安徽省 合肥市,,,False,2022-04-10
4,14085378,4143160,814,1,6.0,116,薛***,因疫情特殊情况，邢台有没有驾考延期政策,我是一个普通人，报驾驶证因为疫情反复无常，最后过年回来考驾驶证，有因为疫情最后驾考暂停，我这个4月19号到期，最近我们城市4月6号有确诊病列，14天居家<label style='color:red'...,1649595904,27.128.53.*,已办理,已办理,线下交办,0,0,邢台市市长宋华英,咨询,交通,手机浏览器,,,,,0,1,,,,,,,0,0,1649725512, 河北省 石家庄市,,,False,2022-04-10
5,14085018,6483656,546,6,14.0,0,丛***,请帮运城盐湖区东康中学外地学生尽快返校,"尊敬的省领导：
        2022年清明假期期间，按运城盐湖区东康中学安排，孩子在4月3日到5日上午离校未离运城，5日下午返回家中，随即居家隔离...",1649593596,118.73.10.*,已办理,已办理,线下交办,0,1,山西省省长蓝佛安,求助,教育,客户端,,,,,0,1,,,,,,,0,0,1649842994, 山西省 临汾市,,,False,2022-04-10
6,14084951,3460379,581,2,7.0,0,x***,移动隔离球何时更换为固定隔离桩？,2022年4月10日19时30分许，九龙坡中梁山田坝恒景天苑小区东门，三台小车堵住小区入口，没有留出一点空间给行人，过往行人只能在机动车道行走，严重影响居民步行安全进出小区，请领导关注，谢谢！,1649593097,106.87.27.*,已办理,已一次评价,线上交办,0,0,重庆市委书记陈敏尔,投诉,城建,手机浏览器,,,,,0,1,0.0,,5.0,5.0,5.0,5.0,0,1,1649776926, 重庆市,,,False,2022-04-10
7,14084214,6483263,576,5,11.0,0,秋***,建议广东事业单位统考现场笔试改为线上笔试,现在疫情感染扩散风险很高，各地交通管制等防疫措施加强，加上越来越多的封控区，考生交通出行住宿等极为不便，极易造成传染扩散，考生进入考区和返回老家都需要承担长期<label style='color:r...,1649587187,112.24.244.*,已办理,已办理,未交办,0,2,广东省省长王伟中,建言,就业,手机浏览器,,,,,0,1,,,,,,,0,0,1649725512, 江苏省 无锡市,,,False,2022-04-10
8,14084152,6483261,1151,2,5.0,0,y***,蓝宝石隔离点,领导你好:我想投诉蓝宝石隔离酒店，酒店每天配餐质量差，菜量少的可怜，每顿饭都吃不饱！,1649586757,117.158.52.*,办理中,待回复,线下交办,0,0,濮阳市委书记杨青玖,投诉,旅游,手机浏览器,,,,,0,1,0.0,,,,,,0,1,1649768629, 河南省 郑州市,,,False,2022-04-10
9,14083770,6483005,3746,6,2.0,0,W***,乌兰浩特市社区工作者薪酬待遇何时提高,社区工作繁重，防控责任大、风险高，工资低还没有任何补助，平时上班坐公交都舍不得还要经常打车到隔离酒店，加班订餐都是自己花钱，这样一来平...,1649583785,39.144.93.*,已办理,已办理,线下交办,0,0,乌兰浩特市委书记,求助,政务,微信小程序,,,,,0,1,,,,,,,0,0,1649842994, 北京市,,,False,2022-04-10
0,14083701,6483039,5055,5,,0,W***,关于疫情期间行程码是否可以精确到某市某区的建,带星人员到了当地要么被劝返，要么自费隔离，加大了生活成本。,1649583180,117.136.86.*,待回复,待回复,未交办,0,0,工业和信息化部党组书记、部长肖亚庆,建言,,微信小程序,,,,,0,1,,,,,,,0,0,1649636609, 北京市,,,False,2022-04-10
1,14083605,2460062,3768,1,1.0,0,w***,小店区非小店街道转码解封咨询,领导好，小店区全区已经隔离七天核酸三次。目前我们非小店街道的乡镇、街道等还都是黄码，请问什么时候可以转码解封？非常感谢！,1649582265,110.178.35.*,已办理,已办理,线下交办,0,0,小店区委书记,咨询,治安,客户端,,,,,0,1,,,,,,,0,0,1649725512, 山西省 太原市,,,False,2022-04-10
2,14083565,2704295,1044,6,7.0,0,W***,怡莱酒店损坏翡翠华庭西隔墙，占用小区内部通道,我是翡翠华庭小区业主之一，4.6号早晨，迎江区新冠隔离点—怡莱酒店，私自砸坏翡翠华庭小区西隔墙，说市政府下文通知，将此处围墙改造成酒店...,1649581847,120.242.209.*,已办理,已办理,线下交办,0,0,安庆市市长张君毅,求助,城建,微信小程序,,,,,0,1,0.0,,,,,,0,1,1649664494, 北京市,,,False,2022-04-10
3,14083197,6417314,1018,2,4.0,0,W***,投诉上虞区开元大酒店,我是3.28英国入境杭州至绍兴上虞区开元大酒店隔离的人员。以下是我对该酒店以及相关政府人员的投诉，表达我的不满以及合理诉求！,1649579209,36.18.165.*,已办理,已办理,未交办,0,0,绍兴市市长施惠芳,投诉,企业,客户端,,,,,0,1,0.0,,,,,,0,1,1649768893, 浙江省 杭州市,,,False,2022-04-10
4,14083155,3702061,1367,1,14.0,0,n***,高新cid教育焦虑问题,高新教育作为改革试验区，但是cid和非cid的教育又完全隔离，长安学籍和雁塔学籍，想问下，这种割裂的政策有没有解决的可能或者计划。,1649578942,219.145.5.*,已办理,已办理,未交办,0,1,西安市委书记方红卫,咨询,教育,客户端,,,,,0,1,,,,,,,0,0,1649725512, 陕西省 西安市,,,False,2022-04-10
5,14083094,6482744,741,2,2.0,0,钟***,情况反映,北京市朝阳区草场地居委会1.要求居民居家隔离但不给予开隔离证明2.居...,1649578589,123.123.130.*,已办理,已办理,线下交办,0,0,朝阳区委书记文献,投诉,政务,PC浏览器,,,,,0,1,,,,,,,0,0,1649724845, 北京市,,,False,2022-04-10
6,14082114,6482119,1018,1,4.0,0,e***,反映隔离期间餐饮问题,本人于2022年3月28日由境外入境杭州，并于上虞区”天玥开元名都大酒店”进行为期14天的集中隔离。,1649572034,124.160.219.*,已办理,已办理,未交办,0,0,绍兴市市长施惠芳,咨询,企业,客户端,,,,,0,1,,,,,,,0,0,1649725512, 浙江省 嘉兴市,,,False,2022-04-10
7,14081767,4919828,1786,2,7.0,0,刘***,小区活动空间被占用,蛟龙港欧香名苑小区因为历史原因，高层欧香名苑和低层欧香苑用防护网隔离开了，导致本就不大的小区业主活动地方就很少了，现在欧香名苑楼下的一...,1649569549,117.139.249.*,已办理,已办理,线下交办,0,0,双流区委书记,投诉,城建,客户端,,,,,0,1,,,,,,,0,0,1649662196, 四川省 成都市,,,False,2022-04-10
8,14081763,4966208,1326,6,5.0,0,b***,观山湖区御鹭皇冠酒店隔离餐质量缩水严重,1、御鹭皇冠酒店隔离费用不明确，住宿费和餐费收费标准不明确，只口头说住宿费280/天，餐费80/天，社区安排在此<label styl...,1649569523,58.16.56.*,已办理,已办理,未交办,0,0,贵阳市市长马宁宇,求助,旅游,客户端,,,,,0,1,0.0,,,,,,0,1,1649768629, 贵州省 贵阳市,,,False,2022-04-10
9,14081730,6481863,2820,2,1.0,0,天***,在东莞村被骗高价购买铁皮石斛,我又原路返回去找摊位老板退货，可他们已经离开了，后来我就询问了隔离摊的老板，说卖石斛的11点左右离开的，他们每个星期周日都换不同的人来...,1649569284,112.96.109.*,已办理,已办理,未交办,0,0,花都区委书记,投诉,治安,客户端,,,,,0,1,,,,,,,0,0,1649661939, 广东省 广州市,,,False,2022-04-10
0,14080751,6412172,1018,6,2.0,0,亲***,求助,尤其是今天的午饭，真的惹怒了大家，希望市长看看关心下我们隔离的学生们吧。打电话给酒店反应，态度极其恶劣。,1649562629,122.224.41.*,已办理,已办理,未交办,0,0,绍兴市市长施惠芳,求助,政务,客户端,,,,,0,1,0.0,,,,,,0,1,1649768629, 浙江省 绍兴市,,,False,2022-04-10
1,14080584,6419184,3036,1,12.0,0,热***,隔离政策,本人于26日从英国返华，28日抵达杭州并转运至绍兴进行14天集中隔离，4月11日将解除14天的<label style='color:...,1649561600,124.160.220.*,待回复,待回复,未交办,0,0,城东区委书记,咨询,医疗,客户端,,,,,0,1,,,,,,,0,0,1649725512, 浙江省 嘉兴市,,,False,2022-04-10
2,14080445,6481260,2824,5,10.0,0,星***,建议村委防疫广播勿一整天无间断播放,各地播放防疫广播对宣传防疫信息固然重要，但每天一整天都在播放属实扰民，希望能科学安排间断区间时间播放，村委应当通过多种方式宣传防疫工作，如积极指引来穗务工人员登记健康信息，微信及公众号指导村民做好居家...,1649560822,113.66.13.*,已办理,已办理,线下交办,0,0,从化区委书记,建言,文娱,手机浏览器,,,,,0,1,,,,,,,0,0,1649661939, 广东省 广州市,,,False,2022-04-10
3,14080444,6481202,1738,6,2.0,0,W***,求助,尊敬的领导，您好～我已入境28天，也已完成入境防疫隔离天数要求。但，由于北京市将我的等级风险定位“高风险”推送到国家政务平台，导致红码...,1649560822,112.224.161.*,已办理,已办理,线下交办,0,0,河间市委书记,求助,政务,微信小程序,,,,,0,1,0.0,,,,,,0,1,1649725512, 山东省 青岛市,,,False,2022-04-10
4,14079638,6480909,542,2,4.0,0,S***,情况反映,如图所示，邮件在天津邮政处理中心滞留已近15天，客服答复说天津这边全局投递员被隔离封控，造成邮件堆积。,1649556021,111.33.210.*,已办理,已办理,线上交办,0,0,天津市代理市长张工,投诉,企业,手机浏览器,,,,,0,1,0.0,,,,,,0,1,1649739517, 北京市,,,False,2022-04-10
5,14079608,6480878,1395,6,2.0,0,小***,为什么我没有补助,各位领导，你们好，我是甘肃省天水市清水县人，我在上海打工，因受疫情影响，我在上海这边已经隔离了25天了，突然之间看到补贴，我也给村上的...,1649555857,114.85.128.*,已办理,已办理,未交办,0,0,天水市委书记张永霞,求助,政务,手机浏览器,,,,,0,1,0.0,,,,,,0,1,1649768629, 上海市,,,False,2022-04-10
6,14079428,6218931,571,2,11.0,0,W***,投诉公司乱扣工资,现在因为疫情被隔离在外地，无法起诉。用小程序欠薪线索投诉，劳动监察帮忙讨要，至今未处理。现望要回工资。,1649554599,171.43.197.*,待回复,待回复,未交办,0,0,湖北省委书记王蒙徽,投诉,就业,微信小程序,,,,,0,1,0.0,,,,,,0,1,1649725512, 湖北省 武汉市,,,False,2022-04-10
7,14079215,6453440,815,2,12.0,0,杨***,我从未出行过，不清楚为何健康码变成黄码了,2022.4.5下午查询健康码变成黄码了，本人未离开过保定市区，目前居家隔离中每天做核酸检测，发现还有另外一个核酸检测结果也出现在我的...,1649553499,110.229.120.*,办理中,待回复,线下交办,0,0,保定市委书记党晓龙,投诉,医疗,PC浏览器,,,,,0,1,0.0,,,,,,0,1,1649659294, 河北省 保定市,,,False,2022-04-10
8,14079064,6480563,824,2,1.0,0,W***,廊坊市开发区桐柏村住宅区有人抽鞭子严重扰民！,疫情时期都居家隔离 ，听到这刺耳的抽鞭声，就很烦躁，希望相关部门严惩相关人员，禁止宅区抽鞭子这种不文明行为，还大家一个安静祥和的小区,1649552560,106.8.67.*,已办理,已办理,线下交办,0,0,廊坊市市长杨燕伟,投诉,治安,客户端,,,,,0,1,0.0,,,,,,0,2,1649768629, 河北省 廊坊市,,,False,2022-04-10
9,14079025,6480669,2747,1,6.0,0,武***,疫情流控问题,尊敬的领导，    本省外市来返天来返甘谷绿码低风险人员是否会被临时留观或隔离，高速回来是否会被劝返？,1649552281,115.85.252.*,已办理,已办理,未交办,0,0,甘谷县委书记,咨询,交通,手机浏览器,,,,,0,1,,,,,,,0,0,1649725512, 甘肃省 兰州市,,,False,2022-04-10
0,14079015,3544511,3801,1,6.0,0,正***,壶关新建路北关段还设置隔离栏吗,我看到最近壶关新建路安放了很多隔离栏，确实很好，车辆有序多了，就是想问下北关段海设置吗？,1649552190,1.68.41.*,已办理,已一次评价,线下交办,0,0,壶关县委书记,咨询,交通,PC浏览器,,,,,0,1,,,5.0,5.0,5.0,5.0,0,0,1649725512, 山西省 太原市,,,False,2022-04-10
1,14078686,3799836,3715,1,1.0,0,r***,是否需要隔离,在工作期间我一直在昌平区，从未去过高风险地区，请问领导我回到海拉尔还需要隔离吗？,1649549713,111.197.244.*,已办理,已一次评价,未交办,0,0,海拉尔区委书记,咨询,治安,客户端,,,,,0,1,,,5.0,5.0,5.0,5.0,0,0,1649739517, 北京市,,,False,2022-04-10
2,14078475,6480463,539,6,2.0,0,s***,北京小汽车摇号居住证过期审核失败问题咨询,领导好，由于疫情原因，前几个月居家隔离忘记了续签北京居住证，今年4月9日查询小客车申请审核状态为审核失败：失败原因为非本市居民且未持本...,1649547617,115.171.23.*,已办理,已一次评价,线下交办,0,2,北京市委书记蔡奇,求助,政务,客户端,,,,,0,1,,,5.0,5.0,5.0,5.0,0,0,1649558228, 北京市,,,False,2022-04-09
3,14077850,6480322,2843,6,12.0,0,躺***,隔离发票,领导您好，我是2022年2月24日在韶关曲江区集中隔离了7天，我就是想要开个发票报销，现在一个多月了还在处理不能开发票，恳求麻烦政府部...,1649528048,223.104.71.*,已办理,已办理,未交办,0,0,曲江区委书记,求助,医疗,手机浏览器,,,,,0,1,0.0,,,,,,0,1,1649642316, 北京市,,,False,2022-04-09
4,14077564,1814380,1337,5,7.0,0,m***,建议取消科新路滇缅大道至昌源北路段停车位,"取消泊位后的建议：
       首先 ：安装机、非隔离带，划出一条慢车道。消除机、非混行安全隐患，这样可以杜绝随意停车。其次，增加此...",1649520598,39.128.10.*,已办理,已办理,未交办,0,0,昆明市委书记刘洪建,建言,城建,PC浏览器,,,,,0,1,,,,,,,0,0,1649668108, 北京市,,,False,2022-04-09
5,14076429,6479728,2498,1,6.0,0,王***,外省低风险地区返回商城隔离政策咨询,领导好，请问从外省低风险地区回商城隔离政策是什么样的，我注意到河南省要求为三天两检即可。,1649511946,58.243.47.*,已办理,已办理,未交办,0,0,商城县委书记,咨询,交通,客户端,,,,,0,1,,,,,,,0,0,1649659294, 安徽省 合肥市,,,False,2022-04-09
6,14075234,1611627,3155,9,2.0,0,m***,社区的好干部，群众的贴心人,3月26日雅礼、中雅的师生及家属涉疫进行隔离。期间孩子转运至芙蓉区集中隔离</lab...,1649504161,222.247.96.*,已办理,已办理,未交办,0,0,芙蓉区委书记,感谢,政务,客户端,,,,,0,1,0.0,,,,,,0,1,1649558228, 湖南省 长沙市,,,False,2022-04-09
7,14074792,6359491,2371,6,7.0,0,l***,孔雀城16号楼被孤立在小区外,孔雀城欺骗业主，原来规划的东大门位置改了，改过以后，全小区只有16号楼独栋被隔离出来了，16号楼单元门口的绿植被开发商拔了以后，又一次...,1649500880,61.158.148.*,已办理,已一次评价,未交办,0,1,新郑市委书记,求助,城建,客户端,,,,,0,1,0.0,,1.0,1.0,1.0,1.0,0,3,1649585271, 河南省 开封市,,,False,2022-04-09
8,14074302,6478715,1956,2,4.0,0,南***,北三环大明宫建材市场北门保安私人威胁客户赔偿,本人父亲于2022年4月9日16：40分左右进入北三环大明宫建材市场（北门），小车碰撞到北门入口路障桩，其中一个隔离墩破碎。,1649497189,117.136.50.*,已办理,已办理,未交办,0,0,未央区委书记,投诉,企业,手机浏览器,,,,,0,1,1.0,,,,,,0,1,1649637790, 北京市,,,False,2022-04-09
9,14074270,6478725,1956,2,4.0,0,南***,大明宫建材市场北二环店乱收费,因进入大明宫市场，不小心挂到隔离墩。 大明宫建材市场保安直接张口要赔300元，因有事比较着急，经过一番讨论后赔了200块钱。没有提供任...,1649496922,116.30.121.*,已办理,已办理,未交办,0,0,未央区委书记,投诉,企业,PC浏览器,,,,,0,1,0.0,,,,,,0,1,1649578705, 广东省 深圳市,,,False,2022-04-09
0,14072868,6478027,1688,1,1.0,0,啊***,易县对博野县反易县人员隔离多长时间,各位领导你好我是一名货车司机3月31号去博野县小店镇送货自己开车去的6.30左右到的8点从厂子出来的，11.30左右到的家，1号接到通知让居家隔离</...,1649487899,223.104.103.*,已办理,已一次评价,线下交办,0,0,易县县委书记,咨询,治安,手机浏览器,,,,,0,1,,,5.0,5.0,5.0,5.0,0,0,1649578705, 北京市,,,False,2022-04-09
1,14072697,4321237,1136,5,6.0,0,z***,黄河路为何不设置中间隔离护栏？,"但因为没有硬隔离，行人 非机动车随意横穿，机动车随意调头，路两侧违停严重，极大影响城市形象。
建议尽快合理设置<label style...",1649486734,39.148.224.*,已办理,已办理,未交办,0,0,郑州市市长何雄,建言,交通,客户端,,,,,0,1,,,,,,,0,0,1649578705, 北京市,,,False,2022-04-09
2,14072309,4867716,815,1,13.0,0,W***,万枫酒店是否成为隔离点？是否符合要求,上林风景小区的商业楼万枫酒店是否成为隔离点？如果是做为隔离点。酒店紧...,1649484398,110.229.124.*,已办理,已办理,线上交办,0,0,保定市委书记党晓龙,咨询,环保,微信小程序,,,,,0,1,0.0,,,,,,0,1,1649578705, 河北省 保定市,,,False,2022-04-09
