,tid,userId,fid,typeId,domainId,topicId,nickName,subject,content,dateline,ip,stateInfo,traceInfo,processInfo,hasReported,favNum,forumName,typeName,domainName,sourceName,answerId,answerContent,answerDateline,answerOrganization,userType,threadState,publicAttachment,userFavStatus,grade,gradeLevel,gradeManner,gradeSpeed,trashRecheckState,attachment,threadsCheckTime,from,shisiwu,date
8,13840952,5022534,3562,1,7.0,0,W***,关于保利冠江墅已被认定的违章围墙拆除执行何时,保利领秀前城冠江墅地块去年经投诉，已被认定将高层与多层直接隔离的围墙、铁门以及多处院墙为违规建设，不在整个小区批准的建设范围，并告知我...,1647684293,111.58.46.*,办理中,待回复,线下交办,0,0,青秀区委书记,咨询,城建,微信小程序,,,,,0,1,0.0,,,,,,0,1,1647749359, 广西壮族自治区 南宁市,False,2022-03-19
9,13840422,6355453,1219,2,2.0,0,猩***,关于罗湖区东门街道疫情民生保障问题,"1.严查相关街道社区人员，是否存在玩忽职守的现象，为什么疫情到现在已经过去三天相关的保障力度没有跟上
2.建立常态化的民生保障机制，保障隔离</lab...",1647680593,61.141.100.*,待回复,待回复,未交办,0,0,深圳市委书记王伟中,投诉,政务,PC浏览器,,,,,0,1,,,,,,,0,0,1647829210, 广东省 深圳市,False,2022-03-19
0,13840208,6026168,1681,5,1.0,0,W***,云杉宾馆集中隔离点消防隐患,1.隔离房间全部从门外反锁，消防通道阻塞，如遇地震、火灾等紧急情况，有关人员不可能第一时间为几十个房间打开救生通道。,1647679025,60.6.202.*,已办理,已办理,未交办,0,0,信都区委书记,建言,治安,微信小程序,,,,,0,1,,,,,,,0,0,1647749359, 河北省 邢台市,False,2022-03-19
1,13839946,6355228,2441,6,1.0,0,3***,解除隔离返回户籍居住地不接收,我3.20日在南京解除集中隔离，现要返回安阳，安阳是我的户籍地及居住地。南京这边告诉我说不知道为什么安阳不接收我。不接收我将无处可去，...,1647677382,121.237.203.*,已办理,已一次评价,未交办,0,0,龙安区委书记,求助,治安,手机浏览器,,,,,0,1,,,5.0,5.0,5.0,5.0,0,0,1647829368, 江苏省 南京市,False,2022-03-19
2,13839855,6353398,595,6,1.0,0,小***,关于3.26日省考报备渠道不畅，寻求帮助,王书记好，我是报名了3.26日青海省公务员考试的考生，为了如期参加考试，3.12从广东东莞茶山镇出发，当天到达机场就被海东市互助集中隔离</label...,1647676760,39.144.215.*,已办理,已办理,线上交办,0,2,青海省委书记信长星,求助,治安,手机浏览器,,,,,0,1,0.0,,,,,,0,1,1647697510, 北京市,False,2022-03-19
3,13839715,6349999,1041,1,14.0,0,快***,专升本考试,您好，请问一下书记，因为我家这栋楼有确诊病例，导致我们这栋楼必须转移去隔离，我今天被拉去<label style='color:red...,1647675907,39.144.162.*,已办理,已一次评价,线下交办,0,0,铜陵市委书记丁纯,咨询,教育,客户端,,,,,0,1,,,5.0,5.0,5.0,5.0,0,0,1647791436, 北京市,False,2022-03-19
4,13839632,6355000,3767,6,6.0,0,悦***,旱西关桃园路口护栏太影响门店生意,再者，路上还有机动车隔离护栏，汽车不会在自行车道和人行道上行驶，不会影响交通秩序。,1647675281,171.117.155.*,办理中,待回复,线下交办,0,0,杏花岭区委书记,求助,交通,手机浏览器,,,,,0,1,,,,,,,0,0,1647876239, 山西省 太原市,False,2022-03-19
5,13839576,5264155,903,9,2.0,0,S***,给吉林省吉林市万昌镇政府和社区的感谢信！,当时由于疫情突然来袭，再加上隔离在家多日，期盼解封的心情迫切，所以我的情绪有些激动，一时间不理解为什么每天都要做检测。这些天我平静下来...,1647674973,222.162.166.*,已办理,已办理,未交办,0,0,吉林市委书记贺志亮,感谢,政务,PC浏览器,,,,,0,1,,,,,,,0,0,1647831225, 吉林省 吉林市,False,2022-03-19
6,13839524,1205232,1367,2,7.0,0,海***,老百姓权益损害没人管,书记您好，我在西影路海伦国际居住，由于海伦物业维护不到位，设置的隔离护栏破损，我车后轮胎被地面钉子划烂报废，反映近3个月，没有人管。老...,1647674558,117.39.198.*,已办理,已一次评价,未交办,0,0,西安市委书记方红卫,投诉,城建,客户端,,,,,0,1,,,1.0,1.0,1.0,1.0,0,0,1647918288, 陕西省 西安市,False,2022-03-19
7,13839250,6354823,3887,5,14.0,0,陈***,要求高校放假开展线上教学,我是山东某院校的学生，前天我们学校内的家属楼发现密切接触者，我们学生不允许出学校被封闭式管理 可教职工则可以自由出入，我要求可以给高校学生分批次放假，能回家的回家，不能回家的留校单独<label st...,1647672523,112.229.81.*,已办理,已办理,未交办,0,0,历下区委书记,建言,教育,客户端,,,,,0,1,,,,,,,0,0,1647876239, 山东省 济南市,False,2022-03-19
8,13839213,6354762,549,6,2.0,0,l***,辽事通健康码隔离解除迟迟不变绿,尊敬的市领导：      经疾控部门沟通，得知本人因于3月10日与新冠密接者同一时空而成为次密接者，于沈阳市铁西区沈辽路万方酒店进行了集中隔离</la...,1647672282,113.225.47.*,办理中,待回复,线下交办,0,0,辽宁省委书记张国清,求助,政务,PC浏览器,,,,,0,1,,,,,,,0,0,1647829840, 辽宁省 沈阳市,False,2022-03-19
9,13839081,3632513,873,6,7.0,0,W***,封闭小区生活物资保障问题反映,尊敬的书记您好：我是大东区中体花园新城的一名业主，由于疫情原因本小区已经封闭6天，目前我家属于居家隔离不让下楼状态，只有做核酸检测时可...,1647671413,113.233.67.*,已办理,已办理,未交办,0,0,沈阳市委书记王新伟,求助,城建,微信小程序,,,,,0,1,0.0,,,,,,0,1,1647790681, 辽宁省 沈阳市,False,2022-03-19
0,13838894,6354514,2955,5,6.0,0,W***,拆除辅路隔离栏取消停车场,领导好，建议：把建国北路工人市场这条辅路地上隔离桩和停车场取消，严重影响行人通行安全。,1647670467,223.114.17.*,待回复,待回复,未交办,0,0,伊州区委书记,建言,交通,微信小程序,,,,,0,1,0.0,,,,,,0,1,1647788896, 北京市,False,2022-03-19
1,13838426,6354294,1338,6,6.0,0,安***,占道停车，交通拥堵,希望交通部门划一下机动车和非机动车车道，并使用隔离栏，清理一下占道停车的车辆，非常感谢,1647667388,106.61.147.*,已办理,已办理,未交办,0,1,昆明市市长刘佳晨,求助,交通,手机浏览器,,,,,0,1,,,,,,,0,0,1647829497, 云南省 昆明市,False,2022-03-19
2,13838165,1723337,828,5,7.0,0,妖***,请尽快对老旧小区改造复工,据了解，我们的施工队工人大部分都是山西省的，山西省目前没有新增，希望可以先对工人做好隔离，进行核酸检测，正常后进行施工。,1647665630,221.204.75.*,已办理,已办理,未交办,0,0,太原市市长张新伟,建言,城建,微信小程序,,,,,0,1,,,,,,,0,0,1647749359, 山西省 太原市,False,2022-03-19
3,13837653,6345713,1219,6,1.0,0,l***,酒店太贵,本人于3月13日从日本返深圳，飞机落地之后被集中隔离于**酒店(深圳南山科技园店)，一天要650元的费用。14天加押金700要9800...,1647662075,116.30.219.*,已办理,已办理,未交办,0,0,深圳市委书记王伟中,求助,治安,客户端,,,,,0,1,0.0,,,,,,0,3,1647697510, 广东省 深圳市,False,2022-03-19
4,13837615,1333092,1139,5,6.0,0,l***,太原路车道与红绿灯设置有待提高,建议把路口东北角带道牙的隔离带铲平因为没有任何意义，非机动车从南向北过路口太不方便，骑过来迎头对着的是最东边的机动车道，汽车迎面驶来，...,1647661821,117.158.181.*,已办理,已办理,线下交办,0,0,洛阳市委书记江凌,建言,交通,PC浏览器,,,,,0,1,,,,,,,0,0,1647749359, 河南省,False,2022-03-19
5,13837577,6353670,1396,1,12.0,0,耍***,关于长控医院医护人员本次集中隔离费用问题,本次疫情遵守联防联控要求进行集中隔离。现即将隔离期末为何酒店要收取<...,1647661556,42.94.142.*,已办理,已办理,未交办,0,0,天水市市长王国先,咨询,医疗,手机浏览器,,,,,0,1,,,,,,,0,0,1647749359, 甘肃省 兰州市,False,2022-03-19
6,13837398,6353661,4437,1,1.0,0,j***,疫情宠物安置,目前沈阳市疫情越来越严重，被隔离的人也多了，做为家有宠物的人特别焦虑，不知道我们浑南区遇到宠主被<label style='color...,1647660400,113.232.141.*,已办理,已办理,线下交办,0,1,浑南区委书记,咨询,治安,手机浏览器,,,,,0,1,,,,,,,0,0,1647749359, 辽宁省 沈阳市,False,2022-03-19
7,13837220,6353300,595,1,14.0,0,梅***,关于2022年青海省考是否推迟,此次联考中，已经有很多省份为了不得不在外隔离的考生延期考试（如湖北省等）。况且疫情反复，低风险地区的考生也不能够保障直到回乡前自己所在...,1647659413,111.44.140.*,已办理,已办理,线上交办,0,10,青海省委书记信长星,咨询,教育,PC浏览器,,,,,0,1,,,,,,,0,0,1647705940, 北京市,False,2022-03-19
8,13837046,6353499,1982,1,12.0,0,星***,回国人员异地隔离14天完成后返咸最新政策,"我3月上旬已从非洲肯尼亚飞到长沙，目前正在长沙进行集中隔离14天。
请问14天隔离<...",1647658514,36.158.146.*,已办理,已一次评价,未交办,0,0,秦都区委书记,咨询,医疗,PC浏览器,,,,,0,1,,,2.8,1.0,3.0,5.0,0,0,1647749359, 北京市,False,2022-03-19
9,13836790,3581270,873,2,12.0,0,南***,关于进出大东区防疫政策,但是在我跟社区报备的时候，社区人员说没有接到上级通知，让我居家隔离。到就在此时上汽通用正在生产，许多人每天出入大东区，为什么这些没有报...,1647657149,223.101.87.*,已办理,已办理,未交办,0,0,沈阳市委书记王新伟,投诉,医疗,客户端,,,,,0,1,,,,,,,0,0,1647705621, 北京市,False,2022-03-19
0,13836778,6324414,3407,2,7.0,0,W***,求温度,我就想知道供暖是不是不烧了温度达到什么样是达标的这金域华府也太冷了冻手冻脚的这疫情期间都自觉隔离不给政府添乱能不能别让供热站给我们老百...,1647657058,42.97.250.*,已办理,已办理,未交办,0,0,德惠市委书记,投诉,城建,微信小程序,,,,,0,1,,,,,,,0,0,1647698388, 吉林省 吉林市,False,2022-03-19
1,13836668,6353329,953,6,1.0,116,Z***,普陀区志丹路500弄疫情封闭小区电梯坏无人修,普陀区志丹路500弄小区自3月16日下午起封闭管理，3月18日“上海发布”已公告小区有无症状感染者，1、截止目前居委未公告具体管控时间，无法出具居家隔...,1647656360,120.204.249.*,待回复,待回复,未交办,0,0,普陀区委书记姜冬冬,求助,治安,手机浏览器,,,,,0,1,,,,,,,0,0,1647706042, 上海市,False,2022-03-19
2,13836646,5326303,1654,1,12.0,0,见***,疫情管控程序,本人没去过中高风险地区，健康码绿码，行程卡无*号，并因工作需要还持有48小时以内核酸阴性结果检测，这种情况用不用居家隔离，是不是持续做...,1647656214,120.9.160.*,已办理,已一次评价,线下交办,0,0,鸡泽县委书记,咨询,医疗,客户端,,,,,0,1,0.0,,5.0,5.0,5.0,5.0,0,1,1647749359, 河北省 邯郸市,False,2022-03-19
3,13836638,4890853,1037,6,12.0,0,和***,和县妇幼没有医生做检查,本人妻子是和县二院的一名护士，她们医院因为缺人，不允许职工去市区，因为回来需要居家隔离三天，健康检测11天，还要单位开证明，单位现在不...,1647656187,39.144.161.*,已办理,已办理,未交办,0,0,马鞍山市委书记张岳峰,求助,医疗,客户端,,,,,0,1,,,,,,,0,0,1647749359, 北京市,False,2022-03-19
4,13836436,6353198,1760,6,5.0,0,W***,求助,本人来自重庆，出差到廊坊，暂住芊丽酒店隔离，点外卖送物资，无人接单，外卖一直显示排期已满。,1647655162,39.144.87.*,待回复,待回复,未交办,0,0,广阳区委书记,求助,旅游,微信小程序,,,,,0,1,,,,,,,0,0,1647749359, 北京市,False,2022-03-19
5,13836392,5078722,748,9,7.0,0,g***,感谢苹果园街道和西黄村北里居委会,尤其是苹果园街道办事处、西黄村北里居委会，在提供各项保障服务的同时，还暖心地为本楼居民发放了免费的牛奶和鸡蛋，在精神和物质上都给予大家无微不至的关爱，让我们平安度过了4天<label style='c...,1647654978,111.192.223.*,已办理,已办理,未交办,0,0,石景山区区长李新,感谢,城建,手机浏览器,,,,,0,1,1.0,,,,,,0,1,1647830978, 北京市,False,2022-03-19
6,13836152,6352868,787,1,4.0,0,水***,居家做核酸公司扣工资没人解决，带薪休假做假,今年疫情严重经常在家隔离做核酸，公司都以要么扣钱要么补班的方式解决。很多员工提出可 以用年薪补居家核算的工时，均被公司一一驳回，并扬言...,1647653523,117.10.206.*,已办理,已办理,未交办,0,0,东丽区委书记谢元,咨询,企业,客户端,,,,,0,1,0.0,,,,,,0,1,1647749359, 天津市,False,2022-03-19
7,13836130,3348061,1260,6,2.0,0,独***,昆仑苑,领导您好，我是南宁市兴宁区金川路（惠民安居昆仑苑）居民，受疫情影响我们小区自16日晚至今已封闭管控第四天，小区所有人员居家隔离，因为事...,1647653428,116.252.170.*,办理中,待回复,线下交办,0,1,南宁市市长廖立勇,求助,政务,微信小程序,,,,,0,1,0.0,,,,,,0,1,1647790505, 广西壮族自治区 南宁市,False,2022-03-19
8,13835461,3856733,1115,1,12.0,0,威***,集中隔离点的问题,我现在在文登格瑞特酒店集中隔离 ，条件是好一点  可房间太冷  。 盼望领导在百忙之中关注一下,1647648822,112.224.164.*,已办理,已办理,未交办,0,0,威海市委书记张海波,咨询,医疗,客户端,,,,,0,1,,,,,,,0,0,1647749359, 山东省 青岛市,False,2022-03-19
9,13835296,6352722,821,6,7.0,0,拓***,沧州市海棠名居小区提前停暖,领导您好，我是沧州市海棠名居小区的一名业主，现在沧州疫情还没有结束，我们都响应政府的管理安排居家隔离。,1647647050,221.193.35.*,已办理,已办理,线上交办,0,0,沧州市委书记康彦民,求助,城建,手机浏览器,,,,,0,1,,,,,,,0,0,1647749359, 河北省 沧州市,False,2022-03-18
0,13834907,6346166,1746,6,12.0,0,s***,求助,我们是吴桥县沟店铺乡大庙新村民，我父亲心脏手术，在沧州市人民医院住院一个多月了，同一个吴桥县，病友有医院证明已经回到自己的家，我们沟店铺乡不让回，希望领导百忙之中关注一下在外就医人员返乡问题，返乡后，...,1647640194,223.104.104.*,已办理,已一次评价,线下交办,0,0,吴桥县委书记,求助,医疗,客户端,,,,,0,1,0.0,,5.0,5.0,5.0,5.0,0,1,1647749359, 北京市,False,2022-03-18
1,13834736,6352578,5069,5,,116,Z***,疫情期间隔离在家活集中隔离民众心理疏导,大家抗击疫情的心态有些疲软无力，集中隔离和居家隔离人群的心理卫生健康...,1647629784,211.94.252.*,待回复,待回复,未交办,0,0,国家卫生健康委员会主任、党组书记马晓伟,建言,,手机浏览器,,,,,0,1,,,,,,,0,0,1647677161, 天津市,False,2022-03-18
2,13834550,6352355,1170,6,14.0,0,w***,一高三学生请求复课,我判定你点外卖了，违反了学校疫情防控规定，现在就回去居家隔离七天。”女儿准备解释，刘副校长吼她，说她不服管，她便未再作声。20年赶上疫...,1647621133,171.113.105.*,已办理,已办理,未交办,0,0,武汉市市长程用文,求助,教育,手机浏览器,,,,,0,1,,,,,,,0,0,1647918288, 湖北省 武汉市,False,2022-03-18
3,13834450,6352388,3559,6,1.0,0,鱼***,求助,本人在大连，近日有疫情，父亲病重，想回去，咨询政策说回去要集中隔离14天，本人在甘井子区属于低风险地区，恳请领导给予帮助。,1647619632,113.235.138.*,已办理,已办理,未交办,0,0,绥中县委书记,求助,治安,手机浏览器,,,,,0,1,,,,,,,0,0,1647749889, 辽宁省 大连市,False,2022-03-18
4,13833505,6328298,1086,2,12.0,0,浔***,问题反映,浔阳区如家酒店三中店隔离点，两边是一墙之隔的居民房，后面是大型小区裕民小区，对面是九江市三中。与国家规定强制性文件完全不符，现在疫情这...,1647612636,39.168.138.*,待回复,待回复,未交办,0,0,九江市市长杨文斌,投诉,医疗,PC浏览器,,,,,0,1,0.0,,,,,,0,1,1647790505, 北京市,False,2022-03-18
5,13833427,5454523,827,9,7.0,0,W***,感谢市委书记百忙之中体察解决民生问题,在第2次留言后，迎泽住建局在3月7日通知去局里沟通，由于被赋黄码，在3月16日解除隔离后到住建局，告知可以选房，楼层是2层、3层、18...,1647612225,1.68.177.*,待回复,待回复,未交办,0,0,太原市委书记韦韬,感谢,城建,微信小程序,,,,,0,1,,,,,,,0,0,1647748632, 山西省 太原市,False,2022-03-18
6,13833314,6322871,1136,6,6.0,0,匿***,求助郑州市交通运输局，郑州市公路事业发展中心,求助郑州市交通运输局，郑州市公路事业发展中心，环翠路与郑密路交汇处硬隔离石墩能否拆除，实现环翠路东西向贯通，方便市民出行。,1647611640,61.52.63.*,已办理,已办理,未交办,0,0,郑州市市长何雄（代）,求助,交通,手机浏览器,,,,,0,1,0.0,,,,,,0,1,1647684401, 河南省 郑州市,False,2022-03-18
7,13832997,4649434,1066,2,13.0,0,懒***,超市的喇叭播报,又最近疫情居家隔离几天，实在深受其扰不得已又向您反映。,1647609887,27.154.252.*,已办理,已办理,未交办,0,0,厦门市市长黄文辉,投诉,环保,手机浏览器,,,,,0,1,,,,,,,0,0,1647749359, 福建省 厦门市,False,2022-03-18
8,13832606,6351322,551,5,2.0,0,c***,关于防疫的建议,所以，能否考虑人群不聚集，做到大家居家隔离检测或者单元门口检测，至少全部室外检测，然后对重点人群单独复核检测，避免在普筛中传染。,1647607689,139.214.213.*,已办理,已办理,线上交办,0,0,吉林省委书记景俊海,建言,政务,PC浏览器,,,,,0,1,,,,,,,0,0,1647683889, 吉林省 吉林市,False,2022-03-18
9,13832000,2011055,1954,6,6.0,0,渭***,前进东路何时能修,前进路整条路都翻新重修了，路中间也设置了隔离带，唯独润天路以东这段不修，也没有中间隔...,1647604487,111.19.99.*,已办理,已办理,未交办,0,2,阎良区委书记,求助,交通,微信小程序,,,,,0,1,,,,,,,0,0,1647864558, 陕西省,False,2022-03-18
0,13831449,5372921,1367,6,2.0,0,W***,密接隔离问题,3月16日1点接到防疫人员电话说我一家人因做核酸时同一试管中有初筛阳性的病例，需要集中隔离，同天4点被拉到酒店<label style...,1647601322,117.22.113.*,已办理,已办理,未交办,0,0,西安市委书记方红卫,求助,政务,微信小程序,,,,,0,1,,,,,,,0,0,1647833756, 陕西省 西安市,False,2022-03-18
1,13831350,5703933,1338,1,2.0,0,x***,被隔离无法取消考试,因工作中疫情处置原因被居家隔离七日，无法参加21日科目二考试，也无法本人到车管所办理取消业务，请帮忙取消为盼,1647600719,39.128.7.*,已办理,已办理,未交办,0,0,昆明市市长刘佳晨,咨询,政务,客户端,,,,,0,1,0.0,,,,,,0,1,1647830513, 北京市,False,2022-03-18
2,13830768,6350378,3280,2,7.0,0,茉***,供暖温度不达标,家里现在处于居家隔离，有80岁的老人和在家网课的孩子，屋里冷冰冰的。每年都是到三月份基本就不给多少热量了，今年更早了。希望领导能体察我...,1647597121,111.41.137.*,已办理,已办理,未交办,0,0,道里区委书记,投诉,城建,客户端,,,,,0,1,,,,,,,0,0,1647745391, 北京市,False,2022-03-18
3,13830395,3516911,539,5,7.0,0,南***,关于大兴中西医结合医院的事宜,尊敬的领导：1、旧忠路大兴区中西医结合医院西侧主路段，由于两侧一直处于围挡状态，致使双向通行的车道变窄，加上两侧无路灯，中间没有隔离设...,1647595117,223.104.3.*,已办理,已办理,线下交办,0,2,北京市委书记蔡奇,建言,城建,客户端,,,,,0,1,,,,,,,0,0,1647682836, 北京市,False,2022-03-18
4,13830039,6350029,5069,5,,0,9***,提供疫情期间双城生活家庭正常生活保障,近日多地疫情陆续爆发，很多市出台疫情防控政策，要求非必要不离市，确需离开需要提供48小时内核酸检测阴性证明，不仅如此还要进行居家隔离或...,1647593318,180.110.29.*,待回复,待回复,未交办,0,2,国家卫生健康委员会主任、党组书记马晓伟,建言,,PC浏览器,,,,,0,1,,,,,,,0,0,1647673075, 江苏省 南京市,False,2022-03-18
5,13829031,6349468,4081,5,12.0,0,易***,密接隔离政策能否微调,1.目前无锡密接隔离是14+14，为了让大家能早点回归正常的生活轨道，密接隔离</l...,1647588085,39.144.154.*,已办理,已办理,未交办,0,0,锡山区委书记,建言,医疗,手机浏览器,,,,,0,1,,,,,,,0,0,1647832102, 北京市,False,2022-03-18
6,13828979,4123647,542,2,6.0,0,老***,噪声扰民，苦不堪言,福升园社区包含贻彩新苑和福升园小区，入住居民较多，社区南面大约100米处为京山铁路，每当有货运列车通过时，震动声音特别大，建议在铁路靠近社区方向加装噪音<label style='color:red'...,1647587762,218.69.254.*,办理中,待回复,线上交办,0,0,天津市市长廖国勋,投诉,交通,PC浏览器,,,,,0,1,,,,,,,0,0,1647854829, 天津市,False,2022-03-18
7,13828703,6349309,815,5,7.0,0,相***,涞水县府前街道路设施设置问题,我是保定市涞水县的一位司机朋友，近期看到涞水县府前街再进行交通设施升级改造，道路中间安装了隔离护栏，道路也重新画了线，但是有一个问题就...,1647586479,221.192.179.*,已办理,已一次评价,线上交办,0,0,保定市委书记党晓龙,建言,城建,手机浏览器,,,,,0,1,,,5.0,5.0,5.0,5.0,0,0,1647745391, 河北省 石家庄市,False,2022-03-18
8,13828038,6348803,873,2,12.0,0,s***,伙食问题反映,孩子留学回来3.17日在和平区IU酒店隔离28天，350元/天。但几次传回的照片，餐食太差，与他同学在于洪<label style='...,1647582962,220.178.64.*,已办理,已办理,未交办,0,1,沈阳市委书记王新伟,投诉,医疗,PC浏览器,,,,,0,1,1.0,,,,,,0,1,1647937587, 安徽省 合肥市,False,2022-03-18
9,13827953,3404937,2503,5,6.0,0,吴***,关于G311国道安罗高速口至扶沟交界,尊敬的领导您好，311国道安罗高速口至鄢扶交界，能加宽这区间的道路，实行机动车与非机动隔离。,1647582495,61.158.149.*,已办理,已办理,未交办,0,0,扶沟县委书记,建言,交通,客户端,,,,,0,1,,,,,,,0,0,1647660826, 河南省 开封市,False,2022-03-18
0,13827911,6348853,1085,1,6.0,0,f***,关于外省到九江,外省低风险，有病例，行程码无星号，到九江需要隔离吗，如果隔离需要自费...,1647582311,49.86.150.*,已办理,已办理,未交办,0,0,九江市委书记谢来发,咨询,交通,手机浏览器,,,,,0,1,,,,,,,0,0,1647857501, 江苏省 扬州市,False,2022-03-18
1,13827639,6348254,1071,6,14.0,0,k***,学校防疫措施,尊敬的市委书记我朋友的舍友是密切接触者，但因为密切接触者核酸检测阴性，学校领导说，不用隔离，这种做法是否存在安全隐患，希望领导能帮帮我...,1647580743,59.60.88.*,待回复,待回复,未交办,0,0,泉州市委书记刘建洋,求助,教育,手机浏览器,,,,,0,1,,,,,,,0,0,1647833756, 福建省 宁德市,False,2022-03-18
2,13827615,6348610,967,1,5.0,0,t***,隔离酒店+7阶段,7领导您好，我想咨询一下关于集中隔离人员在完成14天隔离后的“+7”...,1647580611,111.186.80.*,待回复,待回复,未交办,0,0,浦东新区区委书记朱芝松,咨询,旅游,PC浏览器,,,,,0,1,,,,,,,0,0,1647852138, 上海市,False,2022-03-18
3,13827375,6278479,1079,2,11.0,0,W***,隔离未能提供工作劳动，企业不想支付劳动报酬,3月17日新建区因为疫情防控隔离封区，没有办法回公司工作。老板没有让我居家办公，要求我请假，后我提出<label style='col...,1647579240,182.104.123.*,办理中,待回复,线上交办,0,0,南昌市委书记李红军,投诉,就业,微信小程序,,,,,0,1,0.0,,,,,,0,1,1647833756, 江西省 南昌市,False,2022-03-18
4,13827278,3315590,3193,1,2.0,0,慎***,近期外地返乡人员疫情防控政策,现在返乡后是否需要强制隔离？我所在北京海淀区属于低风险区，疫苗早打完第三针了，当然回乡之前和回乡之后我都会做核酸检测，请问我能否顺利返...,1647578644,221.216.116.*,已办理,已办理,未交办,0,0,洞口县委书记,咨询,政务,客户端,,,,,0,1,,,,,,,0,0,1647833756, 北京市,False,2022-03-18
5,13827239,6348326,575,6,4.0,0,卡***,初创高技术企业生存,疫情发生后积极响应及配合隔离政策，团队非必要不离深，现居家办公。热盼扶持高层次人才创立的高科技企业，能提供研发资助及创业补贴。解决企业...,1647578448,113.90.36.*,办理中,待回复,线下交办,0,0,广东省委书记李希,求助,企业,手机浏览器,,,,,0,1,,,,,,,0,0,1647706042, 广东省 深圳市,False,2022-03-18
6,13827164,5209757,1717,1,6.0,0,好***,北京返回涿鹿政策了解,我想知道现在从北京返回涿鹿有什么政策，北京行程卡带星，回来需要自费隔离还是什么？,1647578101,120.1.215.*,已办理,已办理,线下交办,0,0,涿鹿县委书记,咨询,交通,手机浏览器,,,,,0,1,,,,,,,0,0,1647744788, 河北省 石家庄市,False,2022-03-18
