,tid,userId,fid,typeId,domainId,topicId,nickName,subject,content,dateline,ip,stateInfo,traceInfo,processInfo,hasReported,favNum,forumName,typeName,domainName,sourceName,answerId,answerContent,answerDateline,answerOrganization,userType,threadState,publicAttachment,userFavStatus,grade,gradeLevel,gradeManner,gradeSpeed,trashRecheckState,attachment,threadsCheckTime,from,shisiwu,date
0,14091060,6486378,5069,5,,116,Z***,关于疫情防控常态化的一点建议,特别是对于北上广深等大城市而言，远郊的备用方舱医院不仅可以快速应付突发本土疫情，还可以用于境外输入病例的隔离，防止其在市区内造成疫情传...,1649648762,49.93.166.*,待回复,待回复,未交办,0,0,国家卫生健康委员会主任、党组书记马晓伟,建言,,手机浏览器,,,,,0,1,,,,,,,0,0,1649668674, 江苏省 南京市,False,2022-04-11
1,14085819,2379034,555,5,12.0,116,勇***,从吉林抗疫，为上海提点建议,阻断病毒传播，我们在不流动的人口中，找到病毒携带者和接触者，有效隔离医疗，找病毒携带者最重要手段就是核酸检测，但全员核酸检测，应该是分...,1649598399,39.144.100.*,待回复,待回复,未交办,0,0,上海市委书记李强,建言,医疗,客户端,,,,,0,1,,,,,,,0,0,1649642084, 北京市,False,2022-04-10
2,14083701,6483039,5055,5,,0,W***,关于疫情期间行程码是否可以精确到某市某区的建,带星人员到了当地要么被劝返，要么自费隔离，加大了生活成本。,1649583180,117.136.86.*,待回复,待回复,未交办,0,0,工业和信息化部部长、党组书记肖亚庆,建言,,微信小程序,,,,,0,1,,,,,,,0,0,1649636609, 北京市,False,2022-04-10
3,14083565,2704295,1044,6,7.0,0,W***,怡莱酒店损坏翡翠华庭西隔墙，占用小区内部通道,我是翡翠华庭小区业主之一，4.6号早晨，迎江区新冠隔离点—怡莱酒店，私自砸坏翡翠华庭小区西隔墙，说市政府下文通知，将此处围墙改造成酒店...,1649581847,120.242.209.*,办理中,待回复,线下交办,0,0,安庆市市长张君毅,求助,城建,微信小程序,,,,,0,1,0.0,,,,,,0,1,1649664494, 北京市,False,2022-04-10
4,14081767,4919828,1786,2,7.0,0,刘***,小区活动空间被占用,蛟龙港欧香名苑小区因为历史原因，高层欧香名苑和低层欧香苑用防护网隔离开了，导致本就不大的小区业主活动地方就很少了，现在欧香名苑楼下的一...,1649569549,117.139.249.*,办理中,待回复,线下交办,0,0,双流区委书记,投诉,城建,客户端,,,,,0,1,,,,,,,0,0,1649662196, 四川省 成都市,False,2022-04-10
5,14081730,6481863,2820,2,1.0,0,天***,在东莞村被骗高价购买铁皮石斛,我又原路返回去找摊位老板退货，可他们已经离开了，后来我就询问了隔离摊的老板，说卖石斛的11点左右离开的，他们每个星期周日都换不同的人来...,1649569284,112.96.109.*,待回复,待回复,未交办,0,0,花都区委书记,投诉,治安,客户端,,,,,0,1,,,,,,,0,0,1649661939, 广东省 广州市,False,2022-04-10
6,14080445,6481260,2824,5,10.0,0,星***,建议村委防疫广播勿一整天无间断播放,各地播放防疫广播对宣传防疫信息固然重要，但每天一整天都在播放属实扰民，希望能科学安排间断区间时间播放，村委应当通过多种方式宣传防疫工作，如积极指引来穗务工人员登记健康信息，微信及公众号指导村民做好居家...,1649560822,113.66.13.*,办理中,待回复,线下交办,0,0,从化区委书记,建言,文娱,手机浏览器,,,,,0,1,,,,,,,0,0,1649661939, 广东省 广州市,False,2022-04-10
7,14079215,6453440,815,2,12.0,0,杨***,我从未出行过，不清楚为何健康码变成黄码了,2022.4.5下午查询健康码变成黄码了，本人未离开过保定市区，目前居家隔离中每天做核酸检测，发现还有另外一个核酸检测结果也出现在我的...,1649553499,110.229.120.*,办理中,待回复,线下交办,0,0,保定市委书记党晓龙,投诉,医疗,PC浏览器,,,,,0,1,0.0,,,,,,0,1,1649659294, 河北省 保定市,False,2022-04-10
8,14078475,6480463,539,6,2.0,0,s***,北京小汽车摇号居住证过期审核失败问题咨询,领导好，由于疫情原因，前几个月居家隔离忘记了续签北京居住证，今年4月9日查询小客车申请审核状态为审核失败：失败原因为非本市居民且未持本...,1649547617,115.171.23.*,办理中,待回复,线下交办,0,0,北京市委书记蔡奇,求助,政务,客户端,,,,,0,1,,,,,,,0,0,1649558228, 北京市,False,2022-04-09
9,14077850,6480322,2843,6,12.0,0,躺***,隔离发票,领导您好，我是2022年2月24日在韶关曲江区集中隔离了7天，我就是想要开个发票报销，现在一个多月了还在处理不能开发票，恳求麻烦政府部...,1649528048,223.104.71.*,待回复,待回复,未交办,0,0,曲江区委书记,求助,医疗,手机浏览器,,,,,0,1,0.0,,,,,,0,1,1649642316, 北京市,False,2022-04-09
0,14077564,1814380,1337,5,7.0,0,m***,建议取消科新路滇缅大道至昌源北路段停车位,"取消泊位后的建议：
       首先 ：安装机、非隔离带，划出一条慢车道。消除机、非混行安全隐患，这样可以杜绝随意停车。其次，增加此...",1649520598,39.128.10.*,待回复,待回复,未交办,0,0,昆明市委书记刘洪建,建言,城建,PC浏览器,,,,,0,1,,,,,,,0,0,1649668108, 北京市,False,2022-04-09
1,14076429,6479728,2498,1,6.0,0,王***,外省低风险地区返回商城隔离政策咨询,领导好，请问从外省低风险地区回商城隔离政策是什么样的，我注意到河南省要求为三天两检即可。,1649511946,58.243.47.*,待回复,待回复,未交办,0,0,商城县委书记,咨询,交通,客户端,,,,,0,1,,,,,,,0,0,1649659294, 安徽省 合肥市,False,2022-04-09
2,14075234,1611627,3155,9,2.0,0,m***,社区的好干部，群众的贴心人,3月26日雅礼、中雅的师生及家属涉疫进行隔离。期间孩子转运至芙蓉区集中隔离</lab...,1649504161,222.247.96.*,待回复,待回复,未交办,0,0,芙蓉区委书记,感谢,政务,客户端,,,,,0,1,0.0,,,,,,0,1,1649558228, 湖南省 长沙市,False,2022-04-09
3,14074792,6359491,2371,6,7.0,0,l***,孔雀城16号楼被孤立在小区外,孔雀城欺骗业主，原来规划的东大门位置改了，改过以后，全小区只有16号楼独栋被隔离出来了，16号楼单元门口的绿植被开发商拔了以后，又一次...,1649500880,61.158.148.*,待回复,待回复,未交办,0,0,新郑市委书记,求助,城建,客户端,,,,,0,1,0.0,,,,,,0,3,1649585271, 河南省 开封市,False,2022-04-09
4,14074302,6478715,1956,2,4.0,0,南***,北三环大明宫建材市场北门保安私人威胁客户赔偿,本人父亲于2022年4月9日16：40分左右进入北三环大明宫建材市场（北门），小车碰撞到北门入口路障桩，其中一个隔离墩破碎。,1649497189,117.136.50.*,待回复,待回复,未交办,0,0,未央区委书记,投诉,企业,手机浏览器,,,,,0,1,1.0,,,,,,0,1,1649637790, 北京市,False,2022-04-09
5,14074270,6478725,1956,2,4.0,0,南***,大明宫建材市场北二环店乱收费,因进入大明宫市场，不小心挂到隔离墩。 大明宫建材市场保安直接张口要赔300元，因有事比较着急，经过一番讨论后赔了200块钱。没有提供任...,1649496922,116.30.121.*,待回复,待回复,未交办,0,0,未央区委书记,投诉,企业,PC浏览器,,,,,0,1,0.0,,,,,,0,1,1649578705, 广东省 深圳市,False,2022-04-09
6,14072868,6478027,1688,1,1.0,0,啊***,易县对博野县反易县人员隔离多长时间,各位领导你好我是一名货车司机3月31号去博野县小店镇送货自己开车去的6.30左右到的8点从厂子出来的，11.30左右到的家，1号接到通知让居家隔离</...,1649487899,223.104.103.*,办理中,待回复,线下交办,0,0,易县县委书记,咨询,治安,手机浏览器,,,,,0,1,,,,,,,0,0,1649578705, 北京市,False,2022-04-09
7,14072769,5521247,3000,1,2.0,0,W***,关于国家政务服务平台健康码异常问题,是主动联系集中隔离？还是在家里等待？谢谢！,1649487197,116.178.220.*,待回复,待回复,未交办,0,0,昌吉市委书记,咨询,政务,微信小程序,,,,,0,1,0.0,,,,,,0,1,1649561362, 辽宁省 朝阳市,False,2022-04-09
8,14072697,4321237,1136,5,6.0,0,z***,黄河路为何不设置中间隔离护栏？,"但因为没有硬隔离，行人 非机动车随意横穿，机动车随意调头，路两侧违停严重，极大影响城市形象。
建议尽快合理设置<label style...",1649486734,39.148.224.*,待回复,待回复,未交办,0,0,郑州市市长何雄（代）,建言,交通,客户端,,,,,0,1,,,,,,,0,0,1649578705, 北京市,False,2022-04-09
9,14072309,4867716,815,1,13.0,0,W***,万枫酒店是否成为隔离点？是否符合要求,上林风景小区的商业楼万枫酒店是否成为隔离点？如果是做为隔离点。酒店紧...,1649484398,110.229.124.*,办理中,待回复,线上交办,0,0,保定市委书记党晓龙,咨询,环保,微信小程序,,,,,0,1,0.0,,,,,,0,1,1649578705, 河北省 保定市,False,2022-04-09
0,14072274,6462204,5069,5,,0,W***,疫情之下，社区“人”“物”预防工作的薄弱点,(2）除医务和防疫人员，相关的特殊人员和社区在岗人员有没有接受过正确穿脱防护服和消毒隔离手卫生的培训？不能忽视上述人员，在本社区和社区...,1649484196,39.144.40.*,待回复,待回复,未交办,0,0,国家卫生健康委员会主任、党组书记马晓伟,建言,,微信小程序,,,,,0,1,,,,,,,0,0,1649489059, 北京市,False,2022-04-09
1,14071454,6477296,4705,1,14.0,0,草***,低风险区家人返回新区后幼儿园要求幼儿隔离七天,4月8号家人从低风险区路过兰州返回新区后，幼儿园要求幼儿在家隔离七天后再上学。家人健康码，行程码物为绿码不带星号。请问是否合理？,1649478806,223.104.27.*,待回复,待回复,未交办,0,0,兰州新区党工委书记,咨询,教育,手机浏览器,,,,,0,1,,,,,,,0,0,1649558228, 北京市,False,2022-04-09
2,14071337,6477244,5069,5,,116,W***,建议建立抗原初筛核酸复核制度,"并将初筛阳性的人员的及时隔离管控。最快15分钟即可有结果。
4，初筛阳性的人员再次核酸采样复核阳性后，转运至<label style=...",1649478029,14.122.130.*,待回复,待回复,未交办,0,0,国家卫生健康委员会主任、党组书记马晓伟,建言,,手机浏览器,,,,,0,1,,,,,,,0,0,1649510618, 广东省 湛江市,False,2022-04-09
3,14071135,6310973,981,6,7.0,0,新***,南工大片区被快速路阻隔出行不便,且快速路北侧的南工大区域无任何地铁规划，被严重隔离，路南侧有10号线和13号线很多站点，路北侧无任何地铁。,1649476653,117.136.45.*,办理中,待回复,线上交办,0,0,南京市委书记韩立明,求助,城建,客户端,,,,,0,1,,,,,,,0,0,1649583013, 江苏省 南京市,False,2022-04-09
4,14071072,3250884,2022,6,12.0,0,聆***,集中隔离问题反馈,尊敬的领导您好，本人于3月26和妻子从上海乘坐高铁返回老家洋县养伤，出站现场登记做核酸检测，被集中隔离到湖光轩酒店，原定7天集中<la...,1649476331,1.81.148.*,待回复,待回复,未交办,0,0,洋县县委书记,求助,医疗,手机浏览器,,,,,0,1,0.0,,,,,,0,1,1649578705, 陕西省 汉中市,False,2022-04-09
5,14070686,5144755,1775,9,12.0,0,W***,感谢领导,隔离费用问题已经得到街道社区的帮助解决了，谢谢领导关注，谢谢街道社区帮助！谢谢政府！成都人民不排外！,1649474305,221.237.23.*,已办理,已办理,未交办,0,0,武侯区委书记,感谢,医疗,微信小程序,,,,,0,1,,,,,,,0,0,1649558228, 四川省 成都市,False,2022-04-09
6,14070640,6284750,1135,5,7.0,0,E***,建议取消民航路中州大道入口,中州大道与金水路交叉口的拥堵，很大程度上是民航路车辆横穿中州大道到最内侧去金水路导致的，此处设计非常不合理，包括有些公交车也要横穿4个车道到最内侧车道去金水路，导致后方拥堵，建议取消民航路入口，或者在...,1649474040,115.60.196.*,办理中,待回复,线下交办,0,0,郑州市委书记安伟,建言,城建,客户端,,,,,0,1,,,,,,,0,0,1649582787, 河南省 郑州市,False,2022-04-09
7,14070519,6476863,751,2,7.0,0,W***,拆除开发商在保障房小区内违建栏杆,现要求长阳镇人民政府强制拆除清苑嘉园小区内的隔离设施（铁栅栏、铁艺门、施工围挡、绿植）。,1649473313,112.13.166.*,待回复,待回复,未交办,0,0,房山区委书记陈清,投诉,城建,微信小程序,,,,,0,1,,,,,,,0,0,1649560900, 浙江省 湖州市,False,2022-04-09
8,14070494,6284750,1135,2,6.0,0,E***,郑新快速路南四环辅路残破不堪,郑新快速路南四环快修5年了，现在还没法通行，辅路交通状况非常差，坑洼不平，下雨存水，辅路弯道过多，离隔离铁皮太近，非常危险，什么时候下...,1649473156,115.60.196.*,办理中,待回复,线下交办,0,1,郑州市委书记安伟,投诉,交通,客户端,,,,,0,1,,,,,,,0,0,1649578705, 河南省 郑州市,False,2022-04-09
9,14070165,6476698,3902,2,7.0,0,W***,华润海洋智慧小镇道路不通,小区出行的唯一道路与琅琊台路交汇的位置一直被隔离带堵着。咨询物业说是道路验收问题，已经持续半年多了，严重影响出行，想问一下政府这个道路...,1649471147,117.136.95.*,待回复,待回复,未交办,0,0,黄岛区委书记,投诉,城建,微信小程序,,,,,0,1,,,,,,,0,0,1649582787, 北京市,False,2022-04-09
0,14069794,6476482,5178,6,12.0,116,l***,就医求助,我姐是肺癌晚期，现住在汽车产业开发区兴顺东区，急需住院治疗，但是肿瘤医院的疗区不接收封控小区病人，封控小区的病人只能先在黄码区隔离观察...,1649469049,139.214.246.*,待回复,待回复,未交办,0,0,长春汽车经济技术开发区党工委书记,求助,医疗,客户端,,,,,0,1,,,,,,,0,0,1649489789, 吉林省 吉林市,False,2022-04-09
1,14069395,3715730,1136,5,6.0,0,史***,基于郑州市情不建议发展共享汽车产业,综上观察，产业园区道路因机动车和非机动车道硬隔离，没可能在非机动车道临停成第二排，所有找不到正规路边停车位的车主都是就近在附近道路或人...,1649466444,222.137.18.*,待回复,待回复,未交办,0,0,郑州市市长何雄（代）,建言,交通,PC浏览器,,,,,0,1,0.0,,,,,,0,1,1649637790, 河南省 郑州市,False,2022-04-09
2,14069173,6429936,539,6,14.0,0,张***,请帮助解决非京户口孩子在京高考,尊敬的领导您好，我们是一个三口之家，2001年开始在北京工作，孩子出生后一直在北京上学，很快要上高中，目前非北京户口不能报考大学政策让我们很尴尬，如果回户籍地上学，一旦出现疫情，和现在在国外上学的孩子...,1649464943,111.31.211.*,办理中,待回复,线下交办,0,1,北京市委书记蔡奇,求助,教育,手机浏览器,,,,,0,1,,,,,,,0,0,1649558228, 天津市,False,2022-04-09
3,14069055,5199593,1491,5,7.0,0,W***,寿城水岸二号门这条公路希望加装隔离栅栏,寿城水岸二号门这条公路路窄，本来就只有两车道，还要过公交车，两边路上经常乱停乱放大车小车，每天交通堵塞不下十次！希望路中间加装栅栏，分离左右车道，杜绝乱停乱放，还大家一个通畅的交通环境！,1649464023,119.86.141.*,办理中,待回复,线上交办,0,0,长寿区委书记刘小强,建言,城建,微信小程序,,,,,0,1,,,,,,,0,0,1649583013, 重庆市,False,2022-04-09
4,14068786,6475267,555,6,12.0,116,胡***,上海求医，请求将随申办黄码调整为绿码,28号接到九院住院部关闭通知，医生建议返回江苏淮安（全市低风险）等候入院通知，经申报后返淮，至今已13天，一直处于隔离中，每日核酸报告...,1649461507,36.152.75.*,待回复,待回复,未交办,0,0,上海市委书记李强,求助,医疗,手机浏览器,,,,,0,1,0.0,,,,,,0,1,1649489789, 北京市,False,2022-04-08
5,14068451,5470284,910,6,2.0,116,风***,返乡春耕问题,但柳河县姜家店乡要求返乡后居家隔离14天，期间不允许到地里干活。,1649458210,36.104.224.*,办理中,待回复,线下交办,0,0,通化市市长高山,求助,政务,客户端,,,,,0,1,,,,,,,0,0,1649489789, 浙江省 杭州市,False,2022-04-08
6,14067563,6325993,1338,6,12.0,0,W***,隔离费用过高,本人是3月30日从上海回昆明，一下飞机就被带到石林酒店隔离，下飞机时工作人员告诉我们...,1649432612,112.115.174.*,待回复,待回复,未交办,0,0,昆明市市长刘佳晨,求助,医疗,微信小程序,,,,,0,1,,,,,,,0,0,1649578705, 云南省 昆明市,False,2022-04-08
7,14067327,6475530,1161,2,12.0,133,Z***,东方兰亭苑日月枫华酒店集中隔离点设置问题,李书记您好，根据《集中隔离医学观察点设置标准及管理技术指引》(第七版)中关于集中隔离...,1649430667,123.13.12.*,办理中,待回复,线上交办,0,0,商丘市委书记李国胜,投诉,医疗,PC浏览器,,,,,0,1,,,,,,,0,0,1649578705, 河南省 商丘市,False,2022-04-08
8,14067103,6475387,1160,1,14.0,0,杜***,高考体检,我从郑州回老家参加高考体检，但到家后隔离7天， 因为隔离错过了高考体...,1649428861,115.52.178.*,办理中,待回复,线上交办,0,0,南阳市市长王智慧,咨询,教育,手机浏览器,,,,,0,1,,,,,,,0,0,1649637790, 河南省 南阳市,False,2022-04-08
9,14067016,1277215,1167,5,14.0,0,L***,关注疫情下孩子的健康,全国疫情都在上升期，我县疫情也很大影响了孩子的煅炼、居家隔离中给孩子们造成极大的身心健康，关键是还有一段时间解封，即使解封不知道能否正...,1649428205,223.89.148.*,待回复,待回复,未交办,0,0,驻马店市委书记鲍常勇,建言,教育,手机浏览器,,,,,0,1,0.0,,,,,,0,1,1649637790, 河南省 洛阳市,False,2022-04-08
0,14066324,6474914,3376,6,9.0,0,W***,着急回家水稻育苗,我是汤原镇种植水稻的农民，开春一直在地里的大棚里干活，26号回家一趟就被隔离在了清华c区6号楼，没有密接没有次密接，已经<label ...,1649424056,111.41.246.*,待回复,待回复,未交办,0,1,汤原县委书记,求助,三农,微信小程序,,,,,0,1,,,,,,,0,0,1649511842, 北京市,False,2022-04-08
1,14066210,6474874,1414,5,14.0,0,赟***,外地低风险地区返乐人员影响家中孩子上学。,当老师知道家里有外省返乐人员后必须要学生隔离。但是我舅未回家。未与学生本人接触。,1649423419,117.136.29.*,办理中,待回复,线上交办,0,0,海东市市长王华杰,建言,教育,手机浏览器,,,,,0,1,,,,,,,0,0,1649511842, 青海省 西宁市,False,2022-04-08
2,14065449,4716245,541,5,2.0,116,瘾***,防疫期间，居民和居委会联系渠道相关建议,群里有一个住在同一小区的居委会负责劳动保障的姐姐（非网格员）总给大家热心解答问题，但不是网格员，有些事她也不太清楚，本身还有自己的工作要做，居民们难免有问题没法得到解答，尤其涉及外省市回津报备，甚至居...,1649418984,117.9.91.*,办理中,待回复,线上交办,0,0,天津市委书记李鸿忠,建言,政务,手机浏览器,,,,,0,1,0.0,,,,,,0,1,1649637790, 天津市,False,2022-04-08
3,14064529,6468552,2825,6,11.0,0,W***,求助！！被拒绝支付本人该得工资！,三月一日当天做完诊所工作，晚上便到了抗疫前线，一直工作到26号，并于3月27日至4月2日于酒店隔离，之后逢清明假期，到6日诊所开业复工...,1649413202,202.60.135.*,待回复,待回复,未交办,0,0,福田区委书记,求助,就业,微信小程序,,,,,0,1,0.0,,,,,,0,1,1649511842, 福建省,False,2022-04-08
4,14064135,6439642,5194,2,12.0,0,小***,核酸结果太慢,我从外地过来隔离，隔离期满，等核酸结果出来我才好回去。昨天做的核酸，...,1649411176,112.17.238.*,待回复,待回复,未交办,0,0,钱塘区委书记,投诉,医疗,手机浏览器,,,,,0,1,,,,,,,0,0,1649637790, 浙江省,False,2022-04-08
5,14063541,6473045,873,6,12.0,116,W***,居家隔离癌症患者急需化疗,领导，我是一名癌症晚期患者，二次化疗时间应为4月4日，现已超期四天，由于我4月1日在陆军总院中医科就过诊，就将我列为居家隔离黄码人员，...,1649408057,113.232.116.*,待回复,待回复,未交办,0,0,沈阳市委书记王新伟,求助,医疗,微信小程序,,,,,0,1,,,,,,,0,0,1649489789, 辽宁省 沈阳市,False,2022-04-08
6,14063222,1339018,1135,2,6.0,0,清***,郑州市中原区百花路229号宏江瀚苑群众出行难,主要原因是百花路硬隔离做的不彻底，中间没有钢管隔离，百花路两边到处都...,1649406513,222.143.29.*,办理中,待回复,线上交办,0,0,郑州市委书记安伟,投诉,交通,PC浏览器,,,,,0,1,,,,,,,0,0,1649489789, 河南省 郑州市,False,2022-04-08
7,14063140,6472183,551,1,9.0,116,Z***,返乡种地,您好，我叫李**，现居住地址是长春市新区隆西社区兴华园B区，现在想返回公主岭杨大城子镇种地，但是返乡地通知需要集中隔离7天，自费，32...,1649406133,139.214.244.*,办理中,待回复,线下交办,0,0,吉林省委书记景俊海,咨询,三农,客户端,,,,,0,1,,,,,,,0,0,1649468003, 吉林省 吉林市,False,2022-04-08
8,14062957,6472958,3768,2,7.0,116,一***,投诉富力尚悦居物业用垃圾桶堵窗户,现在疫情严重，被隔离在家中的人的垃圾也扔在这，严重影响我们健康。现在防疫形势严峻，我们每天都消毒。因为垃圾桶阻塞，没办法开窗通风。该垃...,1649405411,117.61.246.*,待回复,待回复,未交办,0,1,小店区委书记,投诉,城建,客户端,,,,,0,1,1.0,,,,,,0,3,1649489789, 江苏省 宿迁市,False,2022-04-08
9,14061696,6429058,1223,2,6.0,0,W***,汕头市龙湖区珠江路中段,本人是住在珠江路龙都丽园的居民，自从门前马路修好后，中间的隔离栏没设置路口，给两边的居民日常生活带来了极大的不便！,1649399398,59.35.86.*,办理中,待回复,线下交办,0,0,汕头市委书记温湛滨,投诉,交通,微信小程序,,,,,0,1,0.0,,,,,,0,1,1649491692, 广东省 汕头市,False,2022-04-08
0,14060999,6465233,2478,1,9.0,0,Z***,返乡是不是必须报备+集中隔离,我处于郑州市 带有农民工在这边干活，马上该农忙时刻，现农民工关注：返乡之后是否要执行14天集中隔离，如果因为<label style=...,1649395707,1.192.165.*,待回复,待回复,未交办,0,0,内乡县委书记,咨询,三农,PC浏览器,,,,,0,1,,,,,,,0,0,1649491460, 河南省 郑州市,False,2022-04-08
1,14060995,6471784,760,5,6.0,0,宫***,黄亦路瀛海镇南海家园路段道路中央隔离护栏损坏,大兴区黄亦路瀛海镇南海家园段道路中央隔离护栏年久失修，部分护栏基座已经锈蚀不堪，护栏片也大面积的锈蚀且摇摇欲坠，存在较大的安全隐患。,1649395674,114.247.189.*,办理中,待回复,线下交办,0,1,大兴区区长刘学亮,建言,交通,PC浏览器,,,,,0,1,,,,,,,0,0,1649491460, 北京市,False,2022-04-08
2,14060588,6471560,1368,5,2.0,116,Z***,4月9号西安事业单位考试是否延期,有在外地上学西安户籍的应届生和还有在外地工作的，还有很多外省的同学，大家为了这次的考试都准备了很久，昨天西安突发疫情肯定给政府部门也带来了很大的负担和困扰，同学们今天在群里面也是各种忐忑，去考试面临回...,1649393654,61.158.149.*,待回复,待回复,未交办,0,0,西安市市长李明远,建言,政务,手机浏览器,,,,,0,1,,,,,,,0,0,1649491460, 河南省 开封市,False,2022-04-08
3,14059945,4623136,2365,5,7.0,0,g***,道路通行问题,1、保利海德公园与碧桂园国控天誉之间被绿化带隔离，未来海德公园居民在东南方向上班的下班回来需从中州大道绕行6公里才能到小区。非常不方便...,1649390180,1.198.30.*,待回复,待回复,未交办,0,0,金水区委书记,建言,城建,客户端,,,,,0,1,0.0,,,,,,0,1,1649491460, 河南省 郑州市,False,2022-04-08
4,14059789,6470889,1252,6,6.0,0,一***,中开高速君华新城段隔离墙设计规划情况,"尊敬的肖市长：
         我是中山市居民，清楚“中开高速-深中通道”的重要性，也支持建设，同时我也是，火炬区君华新城的业主，中开高速高架桥从阳台边通过，目测距离不到30米，请问：关于君华新城段...",1649389571,113.110.201.*,待回复,待回复,未交办,0,0,中山市市长肖展欣,求助,交通,PC浏览器,,,,,0,1,,,,,,,0,0,1649491460, 广东省 深圳市,False,2022-04-08
5,14059690,5270272,1219,5,12.0,0,我***,请组织能给抗疫医务人员学习提升网平台,我们是外省来深新冠医学观察隔离点抗疫医务人员，希望组织能考虑给我们这些医务人员网络学习平台，如全科医学，流行病学，传染病学并能颁发证书...,1649389133,219.133.64.*,待回复,待回复,未交办,0,0,深圳市委书记王伟中,建言,医疗,PC浏览器,,,,,0,1,0.0,,,,,,0,1,1649491460, 广东省 深圳市,False,2022-04-08
6,14058168,5129124,1368,2,1.0,0,蚂***,西安市碑林区仁厚庄小学周边经常有违停车辆,西安市碑林区仁厚庄小学周边经常有违停车辆，原本狭窄的道路，由于违停车辆导致接送孩子存在安全隐患，建议学校周边道牙以下安装禁停隔离桩，并...,1649383648,117.136.87.*,待回复,待回复,未交办,0,0,西安市市长李明远,投诉,治安,手机浏览器,,,,,0,1,,,,,,,0,0,1649491022, 北京市,False,2022-04-08
