,tid,userId,fid,typeId,domainId,topicId,nickName,subject,content,dateline,ip,stateInfo,traceInfo,processInfo,hasReported,favNum,forumName,typeName,domainName,sourceName,answerId,answerContent,answerDateline,answerOrganization,userType,threadState,publicAttachment,userFavStatus,grade,gradeLevel,gradeManner,gradeSpeed,trashRecheckState,attachment,threadsCheckTime,from,mobile,tag,shisiwu,date
5,13884447,1418397,1289,6,7.0,0,黄***,双流区高家路 路面破烂严重,你好，双流区高家路 路面破烂严重，特别是新碧园停车场入口哪里，都凹陷进去好大了，并且那里违停的车子特别多，开车骑车这些特别麻烦 ，建议维修保养下路面，并且像阳光地中海一样门口哪里整段路都设置<labe...,1648016741,125.70.76.*,已办理,已二次解释,线上交办,0,1,成都市委书记施小琳,求助,城建,PC浏览器,,,,,0,1,0.0,,1.0,1.0,1.0,1.0,0,1,1648101114, 四川省 成都市,,,False,2022-03-23
6,13883809,2734497,3464,2,1.0,0,1***,疫情期间聚众装修,防疫隔离期，皇姑区庐山路湘江街13号3**，装修声音巨大，个人协商不了，找社区，社区不管，让找物业，物业只有一个志愿者，也说不管！为啥...,1648013060,182.204.32.*,已办理,已办理,线下交办,0,0,皇姑区委书记,投诉,治安,客户端,,,,,0,1,,,,,,,0,0,1648108610, 辽宁省 沈阳市,,,False,2022-03-23
7,13883762,5535816,2942,5,7.0,0,Z***,关于道路改造,2.旁边隔离栅栏也有很多年了，年久失修，锈蚀严重，影响市容3.隔离栏...,1648012837,49.118.246.*,已办理,已办理,线下交办,0,0,新市区委书记,建言,城建,微信小程序,,,,,0,1,,,,,,,0,0,1648023388, 新疆维吾尔自治区,,,False,2022-03-23
8,13883742,6377845,1220,5,12.0,0,热***,新冠防疫艰巨，还从细节抓起,2、问题：管控小区做核酸还需要现场签名，笔整个小区的人都拿都接触，隔离的意义就被这些小细节打破了；建议：居民一人一证核实身份，医护工作...,1648012744,183.54.43.*,待回复,待回复,未交办,0,0,深圳市市长覃伟中,建言,医疗,PC浏览器,,,,,0,1,,,,,,,0,0,1648022087, 广东省 深圳市,,,False,2022-03-23
9,13883050,6375847,2366,1,12.0,133,Z***,居家隔离幼童流鼻血且有鼻炎怎样可以申请非鼻试,20日去过省图书馆，按要求23到29居家隔离，共同居住人有6岁儿童，因近期多次流鼻血，求助有没有其他替代方式鼻拭子检测。,1648009362,39.144.177.*,已办理,已办理,未交办,0,0,二七区委书记,咨询,医疗,手机浏览器,,,,,0,1,,,,,,,0,0,1648108610, 北京市,,,False,2022-03-23
0,13882767,1761835,1104,5,7.0,0,h***,建议增设禁停设施,李沧区重庆中路(滨河路与书院路区间)高架桥下禁止停车，但由于没有明显的禁停标志、隔离设施，仍有不少车主停车。我曾经建议交警部门施画禁停...,1648008090,223.104.193.*,已办理,已一次评价,未交办,0,0,青岛市市长赵豪志,建言,城建,手机浏览器,,,,,0,1,,,2.4,3.0,3.0,1.0,0,0,1648028659, 北京市,,,False,2022-03-23
1,13881925,6375665,5199,6,2.0,0,小***,申请昌通码转码 没人处理,领导您好  ，我于3月8号来南昌看病，就住于章豫街道七天连锁酒店，回去后发现赣通码和昌通码都黄了  ，于是我到家做了核酸  在家隔离 ...,1648004504,39.144.137.*,已办理,已办理,未交办,0,0,豫章街道党工委书记,求助,政务,客户端,,,,,0,1,0.0,,,,,,0,1,1648090311, 北京市,,,False,2022-03-23
2,13881666,2624139,2751,2,2.0,0,0***,古浪镇人民政府对疫情防控落实不到位一事,到家就及时报备古浪镇人民政府，在上报县防疫办时说要集中隔离，那我只能听从党的指挥，服从党的安排。,1648003384,42.90.201.*,已办理,已办理,未交办,0,0,古浪县委书记,投诉,政务,客户端,,,,,0,1,0.0,,,,,,0,1,1648102292, 甘肃省 兰州市,,,False,2022-03-23
3,13881132,3674405,2371,5,6.0,0,城***,关于新郑龙湖滨湖路北段交通拥堵、环境恶劣的建,希望滨湖路北段（祥云路以北）和富田兴和湾南门口道路中间加装隔离栏（现在附近小区车辆都从沙窝李小学门口和兴和湾门口的小路上紫荆山路），一...,1648001152,39.162.132.*,已办理,已办理,未交办,0,1,新郑市委书记,建言,交通,客户端,,,,,0,1,1.0,,,,,,0,1,1648083546, 北京市,,,False,2022-03-23
4,13879840,3482092,2783,6,1.0,0,W***,领导你好，我妈妈在兰州做完手术，准备出院可以,本不想给政府添乱，不给领导们添乱，可我妈后期恢复很重要，外面买的不能吃，必须每天要子女按时做饭照顾，无奈以这种方式打扰您们，希望能开一条绿色通道，出院后顺利回家，我们在医院每天都做核酸，一直正常，回家...,1647995079,111.11.186.*,已办理,已办理,未交办,0,0,临洮县委书记,求助,治安,微信小程序,,,,,0,1,,,,,,,0,0,1648022087, 甘肃省 兰州市,,,False,2022-03-23
5,13879756,1394872,2424,1,12.0,0,新***,濮阳低风险地区来浚需要集中隔离吗？,（健康码及行程码均为绿色）由于我在浚县自来水公司上班，需要回浚返岗，请问我这样的是否需要14日集中隔离？,1647994551,39.144.178.*,已办理,已一次评价,线下交办,0,0,浚县县委书记,咨询,医疗,客户端,,,,,0,1,,,5.0,5.0,5.0,5.0,0,0,1648108107, 北京市,,,False,2022-03-23
6,13879641,4167631,1780,2,7.0,0,h***,关于五洞桥路和凤溪大道南段交界口占道修建,希望有关部门对比进行优化，单独隔离出行人和非机动车通道。,1647993853,171.218.119.*,已办理,已办理,线下交办,0,1,温江区委书记,投诉,城建,手机浏览器,,,,,0,1,,,,,,,0,0,1648019670, 四川省 成都市,,,False,2022-03-23
7,13879422,6376070,555,6,12.0,0,l***,随申码申诉,3月8号到上海完成14天集中隔离，但按照最新政策没有收到绿码。22号下午到23号拨打几十次12345 均无进展，无法入住酒店无法离开上...,1647992385,220.196.192.*,待回复,待回复,未交办,0,0,上海市委书记李强,求助,医疗,手机浏览器,,,,,0,1,0.0,,,,,,0,1,1648018214, 江苏省 徐州市,,,False,2022-03-22
8,13878998,6114085,5069,5,,0,a***,建议在全国范围内更加精准的实施动态清零,二是建议从国家层面出台统一的标准防控政策，制止各地出现防疫层层加码的情况，例如一刀切的非必要不出市、对低风险地区群众查验核酸检测证明、对低风险地区人员进行集中<label style='color:r...,1647987336,116.138.182.*,待回复,待回复,未交办,0,1,国家卫生健康委员会主任、党组书记马晓伟,建言,,手机浏览器,,,,,0,1,,,,,,,0,0,1648176327, 辽宁省 朝阳市,,,False,2022-03-22
9,13878974,1133194,2365,2,7.0,0,木***,金水区天伦路乱停车,另外，黄家庵东路（琥珀名城东边）整天路全部是车，晚上还有摆地摊的（占道经营），严重影响通行，请在路上设置隔离水泥墩或者其他措施，清理车...,1647986873,223.88.11.*,已办理,已一次评价,未交办,0,0,金水区委书记,投诉,城建,微信小程序,,,,,0,1,,,1.0,1.0,1.0,1.0,0,0,1648108982, 河南省 郑州市,,,False,2022-03-22
0,13878957,1133194,2365,2,7.0,0,木***,中州大道人行道乱停车,中州大道的三全路至北三环段，非机动车道上到处停车，隔离桩破坏无人维护，白天大量停车。,1647986380,223.88.11.*,已办理,已一次评价,未交办,0,0,金水区委书记,投诉,城建,微信小程序,,,,,0,1,0.0,,1.0,1.0,1.0,1.0,0,1,1648102035, 河南省 郑州市,,,False,2022-03-22
1,13878853,5162906,551,5,12.0,0,l***,高层住单元电梯区分使用，加强防疫手段,"同时，一旦本单元出现阳性患者，能减少一倍的流调工作量和隔离数字。
最不应该的是，有个别单元关停一部电梯，在下楼核酸检测时，人员交叉感染...",1647982181,222.34.25.*,已办理,已办理,未交办,0,0,吉林省委书记景俊海,建言,医疗,客户端,,,,,0,1,,,,,,,0,0,1648017025, 吉林省 吉林市,,,False,2022-03-22
2,13878784,6375929,1111,6,12.0,0,k***,疫情居家隔离,领导您好，3月11日自芝罘区海港路振华商厦返回牟平区居所后，一直按照规定居家隔离，期间进行过4次核酸检测均为阴性，3月21日被牟平宁海...,1647977017,123.130.45.*,已办理,已一次评价,未交办,0,0,烟台市委书记傅明先,求助,医疗,PC浏览器,,,,,0,1,,,5.0,5.0,5.0,5.0,0,0,1648005491, 山东省 烟台市,,,False,2022-03-22
3,13878640,6375847,2366,6,12.0,133,Z***,共同居住儿童，居家隔离能否咽拭子,本人家住二七区，于20号去过省图书馆，于明日开始居家隔离，6岁儿童作为公共居住人，因年幼且鼻子常流鼻血有鼻炎，能否不用鼻拭子用咽拭子检...,1647968307,223.88.60.*,已办理,已办理,未交办,0,0,二七区委书记,求助,医疗,手机浏览器,,,,,0,1,,,,,,,0,0,1648108982, 河南省 郑州市,,,False,2022-03-22
4,13878563,2167085,539,2,14.0,0,b***,因家长出差返京幼儿居家隔离，幼儿园不予退费。,因家长出差自沈阳返京后当地出现确诊病例，在返京后第5天接到社区通知，要求全家居家隔离，共计<label style='color:re...,1647966228,123.116.181.*,已办理,已办理,线下交办,0,0,北京市委书记蔡奇,投诉,教育,PC浏览器,,,,,0,1,,,,,,,0,0,1648108107, 北京市,,,False,2022-03-22
5,13878525,6375734,969,2,14.0,0,c***,学校不批准真正迫切需要回家的上海学生居家隔离,华东政法大学目前已进入第二个7天隔离期，准许有需求的部分上海学生回家隔离</labe...,1647965774,140.206.95.*,已办理,已办理,未交办,0,0,松江区委书记程向民,投诉,教育,手机浏览器,,,,,0,1,0.0,,,,,,0,1,1648018074, 上海市,,,False,2022-03-22
6,13878436,6375700,5069,5,,0,赵***,疫情防控意见和建议,措施：1、一定让疫情点不动，全市人民居家不动隔离一周。2、前提每家发每人一盒检测盒。3、一周内，有发烧感冒的自测，是否阳性。上报定点清...,1647964593,111.25.22.*,待回复,待回复,未交办,0,0,国家卫生健康委员会主任、党组书记马晓伟,建言,,手机浏览器,,,,,0,1,,,,,,,0,0,1648176327, 北京市,,,False,2022-03-22
7,13878422,2371394,594,6,7.0,0,W***,解决周家庄小区67-72号楼生活用水问题,近些年供水一直处于时断时续的状态，特别是近几个月来，由于白天停水，被迫只能半夜囤水度日，小区经常出现下水堵塞，排水不畅的现象，导致污水常年流入给水井中，造成生活用水二次污染，饮用水存在重大安全隐患，当...,1647964477,42.92.141.*,待回复,待回复,未交办,0,1,甘肃省省长任振鹤,求助,城建,PC浏览器,,,,,0,1,0.0,,,,,,0,1,1648022087, 甘肃省 兰州市,,,False,2022-03-22
8,13878144,6375550,566,5,11.0,0,今***,关于2022江西教师招聘考试延期建议,尊敬的省长您好，我是一名参加2022年4.9号江西教师招聘的考生，由于外地各省疫情严峻，在外学生处于隔离状态。南昌疫情也还在防控中。为...,1647962257,117.167.229.*,已办理,已办理,线下交办,0,1,江西省省长叶建春,建言,就业,PC浏览器,,,,,0,1,,,,,,,0,0,1648003824, 北京市,,,False,2022-03-22
9,13877992,5703933,1338,2,2.0,0,x***,投诉安宁第二机动车考场,因隔离无法参加考试，也已经提前向考场说明，但还是算我缺考，还要让我出补考费,1647961267,39.128.7.*,已办理,已办理,未交办,0,0,昆明市市长刘佳晨,投诉,政务,客户端,,,,,0,1,,,,,,,0,0,1648019670, 北京市,,,False,2022-03-22
0,13877570,6375358,873,5,7.0,116,Z***,疫情期间希望经开区工程项目暂停生产,疫情期间希望经开区工程项目暂停生产，目前半封闭管理，人员流动性大，工程项目人员不能回家，没有换洗衣服等一系列问题，建议暂停生产，皆按政府要求非城市民生保障型企业居家<label style='colo...,1647958897,223.101.55.*,已办理,已办理,未交办,0,0,沈阳市委书记王新伟,建言,城建,手机浏览器,,,,,0,1,,,,,,,0,0,1648022087, 北京市,,,False,2022-03-22
1,13876739,4385749,1290,2,7.0,0,月***,招商时代公园楼盘虚假宣传欺骗业主,"宣传商住分离，实际住宅和公寓地下停车场未隔离，公寓人员能进入住宅。
2. 小区绿化造价低廉、儿童区异味严重，与宣传的绿化景观相差甚远。...",1647954710,171.88.190.*,已办理,已办理,线上交办,0,0,成都市市长王凤朝,投诉,城建,客户端,,,,,0,1,,,,,,,0,0,1648019167, 四川省 成都市,,,False,2022-03-22
2,13876699,4502914,1736,1,11.0,0,莫***,请问任丘何时考虑出台原籍公务员返乡政策,父母年事的增加，越来越担心父母和其他亲人的身体状况，尤其近期国内多地疫情频发，我又是独子，家中父母自我隔离，无人照料。打赢疫情防控这场...,1647954488,180.212.145.*,已办理,已办理,线下交办,0,0,任丘市委书记,咨询,就业,PC浏览器,,,,,0,1,,,,,,,0,0,1648005491, 天津市,,,False,2022-03-22
3,13876640,6374862,995,6,2.0,0,二***,淮安4月16事业单位考试是否会延迟？,"因为考试是否延期和隔离政策影响到备考的规划以及酒店预订问题，望领导能为学生答疑解惑。
致此
感谢",1647954193,111.1.204.*,已办理,已一次评价,线上交办,0,0,淮安市委书记陈之常,求助,政务,PC浏览器,,,,,0,1,,,5.0,5.0,5.0,5.0,0,0,1648022948, 浙江省 温州市,,,False,2022-03-22
4,13875056,4627979,2828,2,7.0,0,农***,隔离护栏拆除后地面钢筋未及时拆除存在安全隐患,坪洲A出口过红绿灯后，之前因为小摊贩太多设立了护栏，是地面插钢筋来固定的，今天发现路中间护栏移除了一块，刚刚钢筋没有及时拆除，因为那条路人流量大，早上上班匆忙，不小心摔倒很可能被钢筋刺穿，希望有关部门...,1647946668,183.46.167.*,已办理,已办理,未交办,0,0,宝安区委书记,投诉,城建,微信小程序,,,,,0,1,0.0,,,,,,0,1,1648018214, 广东省 汕头市,,,False,2022-03-22
5,13874774,6373709,2237,2,11.0,0,W***,万达味蜀吾拖欠工资不给,2022年2月19日我和同伴在万达味蜀吾店兼职一天工资为一人一天100我和同伴被拖欠一共200元（因为学校疫情在校隔离之后并没有去兼职...,1647944995,171.82.130.*,已办理,已办理,线下交办,0,0,黄州区委书记,投诉,就业,微信小程序,,,,,0,1,0.0,,,,,,0,1,1648090311, 湖北省 武汉市,,,False,2022-03-22
6,13874637,5166920,3404,5,4.0,0,曾***,非常时期，物业人员的休息与家庭关系,让她们居家隔离，一是可以好好的休息，二来可以陪陪家人。,1647944241,117.61.17.*,已办理,已办理,未交办,0,1,二道区委书记,建言,企业,手机浏览器,,,,,0,1,,,,,,,0,0,1648022087, 江苏省 南京市,,,False,2022-03-22
7,13874631,3201310,1395,1,6.0,0,W***,天水市交通局,交通局政务大厅业务电话一直处于无人接听状态，因为疫情现在处于隔离状态，本人因为证件到期需要办理审验手续，想咨询一下可否延期办理审验手续...,1647944159,117.136.27.*,已办理,已办理,未交办,0,0,天水市委书记张永霞,咨询,交通,客户端,,,,,0,1,0.0,,,,,,0,1,1648022087, 甘肃省 兰州市,,,False,2022-03-22
8,13874334,6373561,3414,6,12.0,0,我***,隔离社区药品食物保障,领导们好 我爷爷目前住在丰满区江东移民小区 小区隔离但是没有卖菜饭药品的措施 我爷爷现在一个人在家<label style='colo...,1647942403,114.240.56.*,已办理,已一次评价,未交办,0,0,丰满区委书记,求助,医疗,手机浏览器,,,,,0,1,,,5.0,5.0,5.0,5.0,0,0,1648029239, 北京市,,,False,2022-03-22
9,13873551,6347167,549,6,12.0,0,马***,境外回国人员离连求助,本人于2022年2月24日从境外飞抵成都，进行为期14天集中隔离，于2022年3月10日解除<label style='color:r...,1647938624,113.235.0.*,已办理,已办理,线下交办,0,0,辽宁省委书记张国清,求助,医疗,PC浏览器,,,,,0,1,,,,,,,0,0,1648017543, 辽宁省 大连市,,,False,2022-03-22
0,13873324,5443401,1135,2,7.0,0,W***,东城半岛小区到处都是隔离桩地锁问题,新密市新华路街道办事处东城半岛小区很多商户私装地锁隔离桩问题前期投诉，无法得到解决。1.商铺私加地锁、<label style='co...,1647937329,223.104.111.*,已办理,已办理,线上交办,0,0,郑州市委书记安伟,投诉,城建,客户端,,,,,0,1,1.0,,,,,,0,1,1648100728, 山西省,,,False,2022-03-22
1,13873118,4511438,551,2,7.0,0,苦***,社区,归属双阳区云山街道石桥社区、该社区从疫情开始不通知居民任何有关疫情密流调信息、核酸检测信息发布不及时、社区对外公开电话打不通、社区网格员电话不接、微信不回、居民群内不发布信息、居民只能靠其它小区居民得...,1647936334,39.144.100.*,已办理,已二次评价,线上交办,0,0,吉林省委书记景俊海,投诉,城建,手机浏览器,,,,,0,1,,,5.0,5.0,5.0,5.0,0,0,1647957275, 北京市,,,False,2022-03-22
2,13872394,6372524,569,5,4.0,133,Z***,关于河南省22日0时起入豫健康码问题,我们建议凡事从低风险地区过来的还是要按照过去的提供48小时核酸检测阴性报告即可，而不是进行变相的隔离。当然也可以在核酸检测过期后，在我...,1647932914,106.33.170.*,已办理,已办理,未交办,0,0,河南省委书记楼阳生,建言,企业,手机浏览器,,,,,0,1,,,,,,,0,0,1648090549, 河南省,,,False,2022-03-22
3,13872171,4531471,1227,6,6.0,0,v***,建议在海五西路建设公交站和公交线路,海五路西延线连接南海和禅城，是禅桂一体化的重要交通要道，是盘活扶西、叠南、叠北等隔离区块，进一步完善南海路网格局，突破佛山水道的阻隔，...,1647931816,125.94.193.*,已办理,已办理,未交办,0,0,佛山市委书记郑轲,求助,交通,PC浏览器,,,,,0,1,,,,,,,0,0,1648029049, 广东省 广州市,,,False,2022-03-22
4,13871999,3976892,880,1,1.0,0,暖***,咨询船员回抚隔离问题,之前咨询过船员回来隔离问题http://liuyan.people.com.cn/threads/content?tid=130778...,1647930943,123.186.114.*,已办理,已办理,未交办,0,0,抚顺市市长高键,咨询,治安,客户端,,,,,0,1,,,,,,,0,0,1648004388, 辽宁省 抚顺市,,,False,2022-03-22
5,13871563,6371992,550,6,12.0,0,l***,居家隔离核酸到底收不收费,安波地区居家隔离核酸收费，一人一次40元第一次免费，第二次40，第三次又是每人10元，普兰店区别的街道就不收费，集中<label st...,1647928570,223.102.67.*,已办理,已办理,线下交办,0,0,辽宁省省长李乐成,求助,医疗,手机浏览器,,,,,0,1,0.0,,,,,,0,1,1648004388, 辽宁省,,,False,2022-03-22
6,13871543,2598991,758,5,2.0,0,l***,昌平石坊院小区卡口应开尽开,拆除不必要的物理隔离，做到所有卡口应开尽开，以便居民出行。,1647928440,210.12.157.*,已办理,已一次评价,未交办,0,1,昌平区区长支现伟,建言,政务,PC浏览器,,,,,0,1,,,1.6,1.0,3.0,1.0,0,0,1647996744, 山东省 泰安市,,,False,2022-03-22
7,13871300,4822087,539,2,7.0,0,0***,在城市绿化隔离带无证违法施工,"1.违法地点，海淀区四季青镇巨山路_燕西台高尔夫中心练习场南侧
2举报内容: 在无任何建设施工许可的情况下，在城市绿化隔离带用地上，已...",1647927089,223.72.41.*,已办理,已办理,线下交办,0,0,北京市委书记蔡奇,投诉,城建,客户端,,,,,0,1,1.0,,,,,,0,1,1647996744, 北京市,,,False,2022-03-22
8,13871269,5476018,1220,6,7.0,0,考***,用不了气因为街道办外包工头把我的燃气表装歪了,黑心肝的工头几天前说工人不在这边，工具不在这边，今天说工人疫情被隔离。一个大工头沦落到只有一个工人？2个星期了，看不到头，不知道我因为...,1647926983,113.90.235.*,已办理,已办理,未交办,0,0,深圳市市长覃伟中,求助,城建,PC浏览器,,,,,0,1,,,,,,,0,0,1648022087, 广东省 深圳市,,,False,2022-03-22
9,13870539,6310297,1103,6,12.0,0,W***,希望到医院和母亲陪护隔离,我3月9日从美国到达上海入境，现在在上海黄浦区锦江之星酒店隔离，明天(3月23日)乘火车去青岛。我家住在市北区华阳路，但我母亲现在在市...,1647923093,140.207.173.*,已办理,已办理,未交办,0,0,青岛市委书记陆治原,求助,医疗,微信小程序,,,,,0,1,0.0,,,,,,0,1,1647957275, 上海市,,,False,2022-03-22
0,13870432,5616206,1437,5,7.0,0,Z***,拆除人行道墩子，百姓走不了人行道,加上人行道隔离球、隔离装的拆除，驾驶人都想在人行道免费停车，那我们百...,1647922519,117.190.247.*,办理中,待回复,线上交办,0,0,乌鲁木齐市委书记杨发森,建言,城建,微信小程序,,,,,0,1,0.0,,,,,,0,1,1647953227, 新疆维吾尔自治区,,,False,2022-03-22
1,13870356,3642862,874,2,2.0,0,天***,被隔离不给出证明,按照防疫提级要求对我进行居家隔离，做为热爱家乡的市民，我完全理解防疫的要求，并且可以按照要求去做。单位要求我提交被<label sty...,1647922114,211.137.1.*,已办理,已办理,未交办,0,0,沈阳市市长吕志成,投诉,政务,微信小程序,,,,,0,1,,,,,,,0,0,1648019450, 辽宁省 沈阳市,,,False,2022-03-22
2,13870059,6371002,899,1,2.0,0,H***,关于防疫政策,"2.居家隔离14天健康观测是否需要核酸检测，如核酸检测费用是自费还是免费？
3.如是出差人员到葫芦岛什么政策，是否和回乡人员一致？",1647920815,120.244.8.*,已办理,已一次评价,未交办,0,0,葫芦岛市委书记杨军生,咨询,政务,PC浏览器,,,,,0,1,,,4.0,4.0,4.0,4.0,0,0,1647957742, 北京市,,,False,2022-03-22
3,13869973,5462155,569,1,12.0,0,x***,咨询外省低风险地区人员前往郑州市的防疫政策,需要隔离吗？要准备些什么？,1647920382,60.15.135.*,待回复,待回复,未交办,0,0,河南省委书记楼阳生,咨询,医疗,客户端,,,,,0,1,,,,,,,0,0,1647957275, 黑龙江省 绥化市,,,False,2022-03-22
4,13869756,6371060,883,1,2.0,116,Z***,快递服务,沈阳全域已经居家隔离了，也避免了人员流动，作为丹东的上一级中转沈阳，丹东所有快递都停了，生活真的很不方便,1647919440,42.84.226.*,已办理,已办理,未交办,0,1,丹东市委书记裴伟东,咨询,政务,手机浏览器,,,,,0,1,0.0,,,,,,0,1,1647957742, 辽宁省 沈阳市,,,False,2022-03-22
5,13869634,6371006,5066,5,,116,Z***,协调生鲜个体户产滞销问题,而很多隔离在家的人物资缺不充足。建议在防疫工作正常开展的同时，由社区或村委进行统计协调物资，减少个体户的损失。手停口停的生活太难了,1647918973,163.125.221.*,待回复,待回复,未交办,0,0,农业农村部党组书记、部长唐仁健,建言,,手机浏览器,,,,,0,1,,,,,,,0,0,1647937795, 广东省 深圳市,,,False,2022-03-22
6,13869204,3549920,1136,6,1.0,0,W***,亚星锦绣山河南彩路通行难,现在每天早晚被违法停车变成1车道，路两侧台阶之上也是停满车，个别地方真的是婴儿车都无法通过，只能在马路中间剩余的一车道穿行，每天早上再加上路边乱停等客的出租车，会车就会堵很久，实在苦不堪言，希望可以从...,1647917234,171.8.145.*,已办理,已一次评价,未交办,0,0,郑州市市长何雄,求助,治安,微信小程序,,,,,0,1,,,3.8,2.0,5.0,5.0,0,0,1647957275, 河南省 郑州市,,,False,2022-03-22
7,13869023,4083180,539,5,12.0,116,皮***,返京防疫政策14日内无病例的更细化,很多地市目前早已实现多日内社会面动态清零，但是由于集中隔离人员、甚至治疗的病例复发阳性，导致当地出现新增病例，这种情况说明当地区县已经...,1647916505,124.64.19.*,已办理,已办理,未交办,0,0,北京市委书记蔡奇,建言,医疗,PC浏览器,,,,,0,1,,,,,,,0,0,1647996744, 北京市,,,False,2022-03-22
8,13868770,5087925,991,2,12.0,0,陈***,防疫,准备要回海门，但是这两天网格员发了一个图片显示所有深圳龙岗区回去的人都要集中隔离。我想问一下是不是这样？,1647915461,61.147.200.*,已办理,已一次评价,线上交办,0,0,南通市委书记王晖,投诉,医疗,PC浏览器,,,,,0,1,,,5.0,5.0,5.0,5.0,0,0,1647957275, 江苏省 南通市,,,False,2022-03-22
9,13868326,6370084,1091,2,12.0,0,F***,赣通码被误改成黄码无人处理,3月18日本人户籍所在地上犹县疫情防控中心致电我，说我3月16日因乘坐G485次列车，从而导致成为了密接人员，让我及时和社区做好联系并做好隔离</la...,1647913709,182.97.64.*,已办理,已办理,未交办,0,0,赣州市委书记吴忠琼,投诉,医疗,客户端,,,,,0,1,0.0,,,,,,0,1,1648004388, 江西省 南昌市,,,False,2022-03-22
0,13868277,6343631,594,5,12.0,0,沙***,平凉防疫通行政策,天水市无疫情，也不是中高风险区，平凉防疫文件天水来的要7+7集中隔离7天，居家隔离<...,1647913514,36.142.155.*,已办理,已办理,线上交办,0,1,甘肃省省长任振鹤,建言,医疗,手机浏览器,,,,,0,1,0.0,,,,,,0,1,1648001599, 北京市,,,False,2022-03-22
1,13867886,3855484,734,6,2.0,0,劉***,光明中街一号楼疫情防控问题求助,"1.自2022.3.20日封楼以来，至今无人对四单元楼道公共区域进行消杀
2.到目前为止，居民没有接到任何通知，我们到底要隔离几天，就...",1647911942,120.245.16.*,已办理,已一次评价,线下交办,0,0,东城区区长周金星,求助,政务,客户端,,,,,0,1,,,1.0,1.0,1.0,1.0,0,0,1647996744, 北京市,,,False,2022-03-22
