,tid,userId,fid,typeId,domainId,topicId,nickName,subject,content,dateline,ip,stateInfo,traceInfo,processInfo,hasReported,favNum,forumName,typeName,domainName,sourceName,answerId,answerContent,answerDateline,answerOrganization,userType,threadState,publicAttachment,userFavStatus,grade,gradeLevel,gradeManner,gradeSpeed,trashRecheckState,attachment,threadsCheckTime,from,shisiwu,date
8,12739767,5637574,2484,1,6.0,0,s***,过年返乡,居住在上海嘉定；嘉定区目前没有任何疫情；但是行程码上带星；目前核酸也为阴性。请问是否可以返乡，返乡的政策是什么？,1643014155,116.228.68.*,已办理,已办理,线下交办,0,0,永城市委书记高大立,咨询,交通,PC浏览器,,,,,0,1,,,,,,,0,0,1643061450, 上海市,False,2022-01-24
9,12739273,3097620,795,1,2.0,0,斜***,关于疫情期间“离津证明”,尊敬的书记：我家居住在武清区东蒲洼街道金都花园，现在上海工作。春节期间计划返乡探亲，防疫需要，想咨询返津离津政策，联系官方公布电话02...,1643011583,223.104.213.*,已办理,已办理,未交办,0,0,武清区委书记王力军,咨询,政务,客户端,,,,,0,1,,,,,,,0,0,1643097465, 北京市,False,2022-01-24
0,12739223,5611214,1179,1,12.0,0,y***,宜昌市医保局把贝达喹啉踢出医保范围,所以国家对这个疾病才有很大的重视，全国各地政府对这个疾病在医保政策都很优惠，他们把特效药贝达奎林和利奈挫胺都纳入了医保范围，（不仅是北京、上海</la...,1643011361,171.114.49.*,已办理,已办理,未交办,0,0,宜昌市委书记王立,咨询,医疗,客户端,,,,,0,1,,,,,,,0,0,1643026745, 湖北省 武汉市,False,2022-01-24
1,12739018,5636911,2742,1,12.0,0,什***,返乡政策,梳理一下我的情况：人在上海浦东，疫苗接种2针，第三针在预约。健康码行程码都是绿色，但是因为是在<label style='color:...,1643010244,61.170.224.*,已办理,已办理,未交办,0,0,靖远县委书记,咨询,医疗,PC浏览器,,,,,0,1,,,,,,,0,0,1643025998, 上海市,False,2022-01-24
2,12738928,5567004,1681,6,20.0,0,W***,邢台市信都区美的国宾府上海全筑公司欠薪18.5万,2021年7月10号到邢台市信都区美的国宾府上海全筑公司打工，12月11号离开美的国宾府<label style='color:red...,1643009815,221.192.179.*,已办理,已一次评价,未交办,0,1,信都区委书记,求助,金融,客户端,,,,,0,1,0.0,,1.6,1.0,2.0,2.0,0,1,1643280740, 河北省 石家庄市,False,2022-01-24
3,12738056,5636506,575,5,7.0,0,柠***,建议广州早日实现商业贷款转公积金贷款,"当今社会，高房价已经压垮多少年轻人奋斗的心，由于买不起房子很多不人得已去二线城市或选择去资源就业环境相对好的一线，
广州左有佛山右有深圳，纵向对比北京...",1643005655,113.87.160.*,待回复,待回复,未交办,0,0,广东省委书记李希,建言,城建,PC浏览器,,,,,0,1,,,,,,,0,0,1643118418, 广东省 深圳市,False,2022-01-24
4,12736516,2964539,2828,1,13.0,0,x***,海雅缤纷城商业顶楼噪音污染严重扰民,海雅缤纷城商业6楼楼顶的风机没有经过降噪处理，风机一开，噪音污染非常严重，对6楼以上海雅君誉的住宅住户的正常生活和学习环境影响极大，已...,1642996828,120.229.94.*,已办理,已一次评价,未交办,0,0,宝安区委书记,咨询,环保,客户端,,,,,0,1,0.0,,3.6,3.0,5.0,3.0,0,3,1643118127,热心网友,False,2022-01-24
5,12735871,5634898,949,6,11.0,0,徐***,拖欠工资,你好，我是一名从安徽来上海打工从事油漆工，我位于上海市长宁区新华路2...,1642993842,112.65.48.*,已办理,已办理,未交办,0,1,长宁区委书记王岚,求助,就业,客户端,,,,,0,1,0.0,,,,,,0,1,1643202502, 上海市,False,2022-01-24
6,12734529,5634772,1161,1,12.0,133,我***,返乡相关问题咨询,请问北京、天津、上海、重庆四个直辖市按照什么算，按照行政划分，直辖市下辖区县应与地级市同级（正厅局级），那么从直辖市返乡按照什么政策实...,1642987570,124.71.93.*,已办理,已一次评价,线上交办,0,1,商丘市委书记李国胜,咨询,医疗,PC浏览器,,,,,0,1,,,5.0,5.0,5.0,5.0,0,0,1643095604, 北京市,False,2022-01-24
7,12730658,5165317,2826,6,7.0,0,W***,工地完工一年多，工资还没有拿齐,本人在2019年12月1日至2021年1月30日在罗湖区莲塘街道，由上海建工四建集团有限公司承包的罗湖区市政排水管网查漏补缺建设工程工...,1642938227,14.220.240.*,已办理,已一次评价,未交办,0,0,罗湖区委书记,求助,城建,PC浏览器,,,,,0,1,0.0,,1.6,1.0,3.0,1.0,0,1,1643172694, 广东省 东莞市,False,2022-01-23
8,12730318,4088146,1007,6,6.0,0,山***,拖欠工资,2020年在同协路上海隧道公司地铁四号线项目部干的活到现在一直拿不钱，公司一直不给解决，望领导关注一下,1642935716,124.160.220.*,已办理,已一次评价,未交办,0,0,杭州市委书记刘捷,求助,交通,客户端,,,,,0,1,0.0,,5.0,5.0,5.0,5.0,0,1,1643114200, 浙江省 嘉兴市,False,2022-01-23
9,12730175,4915780,2270,1,11.0,0,小***,老板拖欠孕妇工资一直不给,因公司(上海田震电子商务)从2020年一直拖欠我工资6500元找各种理由不支付给我，现在怀孕的我没工作，大着肚子找他们不方便，也影响情...,1642934557,120.242.121.*,已办理,已办理,未交办,0,0,湾沚区委书记,咨询,就业,客户端,,,,,0,1,0.0,,,,,,0,1,1643060498, 北京市,False,2022-01-23
0,12729616,4912388,1218,5,6.0,0,p***,广州地铁21号线高峰越来越多乘客自带板凳问题,建议参考上海地铁 11 号线，由于 21 号线的特点，可以选择在早高峰期增加相应的广播，提示乘客不用小板凳。,1642929646,120.230.90.*,办理中,待回复,线下交办,0,1,广州市市长郭永航,建言,交通,PC浏览器,,,,,0,1,0.0,,,,,,0,1,1643113740, 广东省,False,2022-01-23
1,12729223,5632496,745,1,6.0,0,海***,海上海花园小区门口道路是否能贯通？,我是丰台区海上海花园小区一名小业主，小区门口东西走向的马路头顶木材厂，持续多年不能东西贯通，上下班门口堵车很严重；此外，薄薄一墙之隔大...,1642926842,223.104.41.*,已办理,已办理,未交办,0,0,丰台区委书记徐贱云,咨询,交通,PC浏览器,,,,,0,1,,,,,,,0,0,1643010334, 山西省,False,2022-01-23
2,12729033,5632287,557,2,11.0,0,被***,公司一直拖欠工资，多次催讨仍然不发。急急急！,尊敬的领导，此次留言是关于南京市江宁区汤山镇绿城桃花源项目中，上海广域建筑装饰工程有限公司拖欠工人工资一事。,1642925497,122.194.60.*,办理中,待回复,线下交办,0,0,江苏省委书记吴政隆,投诉,就业,PC浏览器,,,,,0,1,0.0,,,,,,0,1,1643113740, 江苏省 镇江市,False,2022-01-23
3,12728283,5631746,555,6,4.0,0,董***,求助,合同规定30个工作日内办理车辆过户，但现已2个多月了，仍没办理车辆过户，我的上海机动车牌照额度就一直不能用。其间我多次向人人车平台投诉...,1642919918,101.80.184.*,已办理,已办理,未交办,0,0,上海市委书记李强,求助,企业,手机浏览器,,,,,0,1,,,,,,,0,0,1643113740, 上海市,False,2022-01-23
4,12728234,5631902,556,2,14.0,0,环***,上海3周岁以下每年五天育儿假企业不执行,苹果贸易（上海）有限公司，目前企业给我们申请育儿假设置各种门槛，首先我们要提早四周申请，且需要证明家里无人带小孩才可以申请，且单位解释...,1642919448,17.93.76.*,已办理,已办理,未交办,0,0,上海市市长龚正,投诉,教育,PC浏览器,,,,,0,1,,,,,,,0,0,1643171907,热心网友,False,2022-01-23
5,12726075,5630851,1035,5,12.0,0,出***,寿县医疗保障系统更新太慢,2，第一次申报时，工作人员说，12月份下来；第二次，去上海就医后（异地医保系统已经正常用了），回来问，工作人员说，一月底。两个月了，外...,1642904479,36.161.40.*,已办理,已一次评价,未交办,0,0,淮南市委书记任泽锋,建言,医疗,手机浏览器,,,,,0,1,,,3.6667,3.0,5.0,3.0,0,0,1643016086, 北京市,False,2022-01-23
6,12725782,5630511,1774,6,11.0,0,聂***,上海国际影城瑞安城中汇店,上海国际影城瑞安城中汇店装修于2018年5月开工2018年10月正式完工开业，装修由四川正晨装饰工程有限公司总包，水电项目由王*分包(...,1642902188,117.176.222.*,已办理,已办理,未交办,0,0,金牛区委书记,求助,就业,客户端,,,,,0,1,,,,,,,0,0,1643184130, 四川省 成都市,False,2022-01-23
7,12723689,5629766,968,1,6.0,0,一***,关于上海市插电混合汽车申领新能源牌照额度的问,您好领导，我是一名从外地迁户口到上海的新上海人。工作在<label ...,1642864709,116.237.70.*,已办理,已办理,未交办,0,0,浦东新区区长杭迎伟,咨询,交通,客户端,,,,,0,1,,,,,,,0,0,1643014552, 上海市,False,2022-01-22
8,12722224,5257240,555,5,6.0,0,敢***,建议对4号线或6号线的浦电路站改名,书记您好，上海地铁4号线和6号线和都有一个浦电路站，不过这两个站距离较远，也不能像有些车站一样虚拟换乘，压根就是两个不同的车站，却叫着...,1642855260,171.219.111.*,已办理,已一次评价,未交办,0,0,上海市委书记李强,建言,交通,手机浏览器,,,,,0,1,,,4.6667,5.0,5.0,4.0,0,0,1643098707, 四川省 绵阳市,False,2022-01-22
9,12722209,2894726,3807,1,2.0,0,杨***,返乡政策咨询,本人在上海浦东新区工作，询问返回晋城响水坡村是否需要隔离？盼复。,1642855203,120.208.142.*,已办理,已办理,线下交办,0,0,高平市委书记,咨询,政务,微信小程序,,,,,0,1,,,,,,,0,0,1643023549, 山西省 临汾市,False,2022-01-22
0,12722031,4933577,558,6,4.0,0,国***,家中老人卧床，防褥疮床垫无法使用，请帮帮我,3、商家提出退货要出具北京或上海专业机构质量鉴定报告，无论是经济成本还是时间成本都远远超出了商品本身的价格，根本就是无理要求，推卸责任...,1642854025,211.94.245.*,办理中,待回复,线下交办,0,0,江苏省省长许昆林,求助,企业,手机浏览器,,,,,0,1,0.0,,,,,,0,1,1643020568, 天津市,False,2022-01-22
1,12720819,2437705,833,5,6.0,0,向***,关于长治到南京无锡等苏南地区无直达高铁的建议,或者，把上海至郑州的线路延长至长治境内，或者能不能协调郑州绕行石家庄到太原的车走太焦线停靠长治东站。,1642846021,61.152.193.*,已办理,已办理,未交办,0,0,长治市委书记杨勤荣,建言,交通,微信小程序,,,,,0,1,,,,,,,0,0,1643023180, 上海市,False,2022-01-22
2,12720701,4688285,555,5,6.0,0,W***,建议加大上海限行力度和暂停部分新能源牌照发放,尊敬的领导：目前上海市私家车的保有量非常巨大，每天这个数量还都在不断新增，每月都有上万张<label style='color:red...,1642845310,117.143.106.*,已办理,已办理,未交办,0,0,上海市委书记李强,建言,交通,微信小程序,,,,,0,1,,,,,,,0,0,1643098707, 上海市,False,2022-01-22
3,12720295,2821983,1072,5,7.0,0,h***,东海片区生活配套急需改善,但是到万科、海上海及碧桂园等已交房一段时间点小区低商逛了一圈，连一家餐饮店都不能开，咨询附近中介才知道说这些在规划的时候就是不能做餐饮...,1642842554,117.24.189.*,已办理,已办理,未交办,0,2,泉州市市长蔡战胜,建言,城建,客户端,,,,,0,1,,,,,,,0,0,1643098707, 福建省 泉州市,False,2022-01-22
4,12719706,4295551,3512,2,1.0,0,W***,道路变成停车场,矿山街解封路至上海路段。路口违停车辆占道，严重影响出行。,1642838741,182.204.40.*,已办理,已一次评价,线下交办,0,0,凌河区委书记,投诉,治安,微信小程序,,,,,0,1,0.0,,4.6,4.0,5.0,5.0,0,2,1643012882, 辽宁省 沈阳市,False,2022-01-22
5,12719426,5603935,971,6,7.0,0,钢***,农民工讨薪,我们在上海临港二期工程工作结束至今未拿到工资，请给予帮助！   本人与2020年3月份进入位于<label style='color:...,1642836545,124.64.16.*,已办理,已办理,未交办,0,0,金山区委书记刘健,求助,城建,手机浏览器,,,,,0,1,,,,,,,0,0,1642862367, 北京市,False,2022-01-22
6,12719185,5627649,555,6,12.0,0,j***,健康码颜色问题,寻找随申码申诉后，上海一网通办要求上传信息给ssm@shanghai.gov.cn邮箱，但我的邮件被拒收退回且理由为对方邮箱已满。目前...,1642834760,101.80.79.*,已办理,已办理,未交办,0,0,上海市委书记李强,求助,医疗,客户端,,,,,0,1,0.0,,,,,,0,1,1642911962, 上海市,False,2022-01-22
7,12718090,5627045,2392,5,7.0,100,Z***,上海花园暖气流量太小,"尊敬的领导您好：
      我们上海花园家里温度15 16°，最高的地方18°。之前领导来过小区一次，家里最高达到了20°，就两天，...",1642827242,117.136.36.*,已办理,已办理,未交办,0,0,偃师市委书记,建言,城建,手机浏览器,,,,,0,1,,,,,,,0,0,1642910035, 河南省 新乡市,False,2022-01-22
8,12717963,2185582,1079,1,20.0,0,特***,南昌市什么时候开始试点数字人民币？,2020年正式开始试点数字人民币，截至到目前为止，已经有数百万个试点场景得到应用，目前湖南的长沙，上海，广东的深圳都已经开始使用数字人...,1642826528,182.97.53.*,已办理,已办理,未交办,0,0,南昌市委书记李红军,咨询,金融,微信小程序,,,,,0,1,,,,,,,0,0,1642902647, 江西省 南昌市,False,2022-01-22
9,12717787,5610079,2399,1,6.0,0,中***,行程上海带星号但未涉足公布中高风险区，可返？,上海行程卡带星号，但未涉足中高风险区，持48H小时核酸  可由上海返...,1642825298,101.228.201.*,已办理,已一次评价,线下交办,0,0,新安县委书记,咨询,交通,PC浏览器,,,,,0,1,,,2.8,1.0,4.0,4.0,0,0,1642922927, 上海市,False,2022-01-22
0,12717502,2795925,539,5,6.0,0,W***,请领导重视北京朝阳南北向地铁建设,2.消费是作为经济发展的三驾马车其地位非常重要，朝阳消费经济也引领了全市经济发展，朝阳不能仅仅与全市各区比，也要与上海广州深圳苏州等一...,1642823343,219.141.246.*,已办理,已办理,线下交办,0,0,北京市委书记蔡奇,建言,交通,PC浏览器,,,,,0,1,,,,,,,0,0,1642910438, 北京市,False,2022-01-22
1,12716107,3717127,1170,1,7.0,0,局***,公积金互认互贷,我看政府工作报告中要加快推动公积金互认互贷，我老家湖北武汉的，在上海工作缴纳公积金，想回武汉置业买房子，武汉啥时候能用<label s...,1642815134,117.136.23.*,已办理,已办理,未交办,0,0,武汉市市长程用文,咨询,城建,客户端,,,,,0,1,,,,,,,0,0,1643001609, 湖北省 武汉市,False,2022-01-22
2,12715333,5625628,827,6,12.0,0,田***,跨省住院报销比例,尊敬的领导您好，我小孩户口在万柏林区去年8月份在上海住院做手术因为这个手术全国只有上...,1642809077,223.11.182.*,已办理,已办理,未交办,0,0,太原市委书记韦韬,求助,医疗,手机浏览器,,,,,0,1,,,,,,,0,0,1643183566, 山西省 太原市,False,2022-01-21
3,12714872,4329387,979,6,11.0,0,向***,疫情影响工资拖欠，紧急寻求帮助,本人于2021年6月28日在上海市崇明区仁建路江南船厂（上海丁盈建设...,1642802127,39.144.140.*,已办理,已一次评价,未交办,0,0,崇明区委书记李政,求助,就业,客户端,,,,,0,1,1.0,,5.0,5.0,5.0,5.0,0,1,1642912383, 北京市,False,2022-01-21
4,12714530,5591313,560,6,11.0,0,机***,请求政府帮我们农民工讨要血汗钱,我们是缙云**国际酒店分包单位上海**公司 的水电班组。我们多次上门划云讨要工资 一直推脱说业主没有给钱  实在没有办法，只好麻烦政府...,1642786314,223.104.158.*,已办理,已一次评价,未交办,0,0,浙江省省长王浩,求助,就业,客户端,,,,,0,1,0.0,,5.0,5.0,5.0,5.0,0,1,1643001609, 北京市,False,2022-01-21
5,12713592,3228848,1036,5,12.0,0,张***,建议增设核酸检测点，干部进行拉网式巡查,2022年虎年春节即将来临，新一轮的春运也开始了几天，大批外出返乡的游子也回归寿县，但在国内新冠疫情还在处于严峻形式，陕西西安、河南、天津、广东珠海、...,1642775962,183.165.140.*,已办理,已办理,线下交办,0,0,淮南市市长张孝成,建言,医疗,手机浏览器,,,,,0,1,,,,,,,0,0,1642904569, 安徽省 六安市,False,2022-01-21
6,12712603,4988406,1051,5,6.0,0,胡***,宿州东站公交车运营时间,上海方向到宿州东的高铁班次，晚上九点到十点左右到宿州东站的，根本没有公交车可以坐(到市区的)。站外大多数是私营黑车载客，车费很高，而且...,1642769925,117.136.67.*,已办理,已一次评价,未交办,0,2,宿州市委书记杨军,建言,交通,客户端,,,,,0,1,,,5.0,5.0,5.0,5.0,0,0,1642912099, 北京市,False,2022-01-21
7,12711952,5623224,961,2,11.0,0,W***,上海利柏特克扣工资,上海利柏特在金山化工园区承建英威达二期，我在10月26日离职，工资算清未结账，还克扣了工作服劳保等费用，12月15到账工资比结算工资还...,1642765901,27.200.181.*,已办理,已一次评价,未交办,0,0,宝山区委书记陈杰,投诉,就业,微信小程序,,,,,0,1,0.0,,3.2,2.0,4.0,4.0,0,1,1642912729, 山东省 滨州市,False,2022-01-21
8,12711750,5623847,556,6,11.0,0,风***,我等13名农民工工资一直被拖欠不还。,本人名叫张**，是一名从南通来上海务工的农民工。,1642764602,101.231.126.*,已办理,已办理,未交办,0,0,上海市市长龚正,求助,就业,PC浏览器,,,,,0,1,,,,,,,0,0,1642912561, 上海市,False,2022-01-21
9,12710824,5623428,2474,1,2.0,0,z***,行程码带星，回淅川需要集中隔离吗,在你百忙之中，打扰你下，我现在工作地方是上海市嘉定区安亭镇，准备回家过年。但是行程码带星号，回家需要7+7（七天集中隔离和七天居家隔离...,1642758424,180.162.136.*,已办理,已办理,未交办,0,0,淅川县委书记,咨询,政务,客户端,,,,,0,1,0.0,,,,,,0,1,1642922927, 上海市,False,2022-01-21
0,12710674,5623312,555,2,6.0,0,五***,上海转杭州区域牌，四个月未受理,本人上海沪C牌照，现转杭州区域牌，12123上面四个月未受理，麻烦尊敬的领导看一下是为什么？什么时候可以解决。与当初的三个工作日内受理...,1642757506,117.147.33.*,已办理,已办理,未交办,0,0,上海市委书记李强,投诉,交通,手机浏览器,,,,,0,1,0.0,,,,,,0,1,1642912886, 浙江省 温州市,False,2022-01-21
1,12709751,5622478,1219,2,7.0,0,s***,深圳市华测实验室技术服务有限公司拖欠工程款,本人系武汉易企筑商贸有限公司员工，2018年6月1日我公司与深圳市华测实验室技术服务有限公司“下称深圳华测”签订了上海科建化工有限公司...,1642752303,171.113.196.*,待回复,待回复,未交办,0,0,深圳市委书记王伟中,投诉,城建,PC浏览器,,,,,0,1,0.0,,,,,,0,1,1642862104, 湖北省 武汉市,False,2022-01-21
2,12709674,5622030,4732,2,11.0,0,W***,讨要农民工工资,本人范**于2021年11月12日至2021年12月28日在上海某项目部项目部，上海...,1642751981,221.192.178.*,已办理,已办理,未交办,0,0,雄安新区党工委书记张国华,投诉,就业,微信小程序,,,,,0,1,0.0,,,,,,0,1,1642824347, 河北省 石家庄市,False,2022-01-21
3,12709356,5612068,1371,6,9.0,0,朝***,拖欠农民工工资,我是一群农民工的代表，我们于2020年4月份至2020年11月份在陕西省宝鸡市金台区蟠龙镇西坪大道绿地康阳谷南区工地从事外架工和混泥土工作，该项目是由绿地控股集团投资，青岛海骊挂名承包后转包给<lab...,1642750429,222.90.206.*,已办理,已一次评价,未交办,0,0,宝鸡市委书记杨广亭,求助,三农,PC浏览器,,,,,0,1,0.0,,1.6,1.0,3.0,1.0,0,1,1642812534, 陕西省 西安市,False,2022-01-21
4,12709008,5622229,555,2,7.0,0,W***,嘉定区南安德路湖语森林物业高收费低服务,尊敬的领导你好，目前我居住在上海市嘉定区安亭镇南安德路680弄湖语森林二期小区，业主目前和物业有极大的矛盾。目前我居住的房屋服务收费为...,1642748787,180.167.146.*,已办理,已办理,未交办,0,0,上海市委书记李强,投诉,城建,微信小程序,,,,,0,1,,,,,,,0,0,1643000271, 上海市,False,2022-01-21
5,12708434,5621905,4732,2,11.0,0,W***,拖欠农民工,本人邓x险于2021年11月12日至12月28日在上海宝冶雄东片区项目工作，上海</...,1642746051,36.98.171.*,已办理,已办理,未交办,0,0,雄安新区党工委书记张国华,投诉,就业,微信小程序,,,,,0,1,0.0,,,,,,0,1,1642939040, 浙江省 杭州市,False,2022-01-21
6,12707717,5621561,555,6,1.0,0,汤***,网约车押金,在上海闵行区都会路亿站创业园叫做君利汽车租聘的租了一台车跑网约车，车退了，都过去几个月了，3000千压金一直没退我，现在要过年了，过年...,1642742085,101.80.142.*,已办理,已办理,未交办,0,0,上海市委书记李强,求助,治安,手机浏览器,,,,,0,1,0.0,,,,,,0,1,1642999757, 上海市,False,2022-01-21
7,12707699,5621573,1962,6,6.0,0,随***,上海徐汇区春节归鄠问题,在上海徐汇区工作，女朋友家在鄠邑区，春节想回鄠邑区。28号早上到西安火车站，想询问下进入鄠邑区目前有哪些限制以及政策？并且，目前西安市...,1642742005,180.156.139.*,已办理,已办理,未交办,0,0,鄠邑区委书记,求助,交通,PC浏览器,,,,,0,1,,,,,,,0,0,1642839859, 上海市,False,2022-01-21
8,12707488,5372006,567,2,11.0,0,L***,拖欠农民工资,我们2020年10月在济宁**项目干水电工，跟着总包上海**集团有限公司干活，做6号楼水电活，共计4万多工资，有项目经理签字，施工水印...,1642740732,36.1.75.*,已办理,已办理,未交办,0,1,山东省委书记李干杰,投诉,就业,手机浏览器,,,,,0,1,0.0,,,,,,0,1,1643028339, 海南省 海口市,False,2022-01-21
9,12706588,5620750,2302,5,6.0,0,独***,安庆西没有方便怀宁人出行,高铁安庆西站已建成通车，原本指望建成后方便怀宁人出行及回家，可是现在出省经安庆西停靠的只有上海方向一趟车和温州方向一趟车，合肥到深圳方...,1642735594,220.179.28.*,已办理,已办理,未交办,0,1,怀宁县委书记,建言,交通,PC浏览器,,,,,0,1,,,,,,,0,0,1642912099, 安徽省 安庆市,False,2022-01-21
0,12706491,4720060,1029,5,7.0,0,武***,东部新中心启动区安装公司老旧小区拆迁建议,后期就算拆迁地块较小也不好规划会给东部新中心启动区造成形象不好 2.目前幸福村上市地块北临规划天井湖路难至规划旌德路都是支路不适合做小区主干道，唯一东边幸福路还是断头路如规划小区出入口车辆需绕行至枞阳...,1642735203,112.122.237.*,已办理,已办理,未交办,0,0,合肥市委书记虞爱华,建言,城建,PC浏览器,,,,,0,1,0.0,,,,,,0,1,1642912099, 安徽省 合肥市,False,2022-01-21
1,12706402,1173526,583,1,6.0,0,七***,咨询国家对于地铁等轨道交通建设规划的最新政策,去年10月份，南昌召开南昌轨道交通建设规划影响分析会，去年12月份，上海的上海</l...,1642734855,125.69.22.*,已办理,已办理,线上交办,0,0,四川省委书记彭清华,咨询,交通,PC浏览器,,,,,0,1,0.0,,,,,,0,1,1642840322, 四川省 成都市,False,2022-01-21
2,12706318,5561305,1037,1,1.0,0,y***,春节上海返乡安徽是否需要隔离,上海市目前健康码显示是中风险地区（带*），但本人实际未去过中风险区域且健康码为绿色。想咨询下领导春节前回马鞍山市含山县是否需做隔离。,1642734476,116.228.184.*,已办理,已办理,未交办,0,6,马鞍山市委书记张岳峰,咨询,治安,客户端,,,,,0,1,0.0,,,,,,0,1,1642904569, 上海市,False,2022-01-21
3,12705821,5620334,1702,1,12.0,0,小***,春节返乡防疫政策,目前上海静安区有中风险地区，本人在上海其他区，属于低风险区域，但行程...,1642732079,114.87.116.*,已办理,已一次评价,线下交办,0,0,博野县委书记,咨询,医疗,客户端,,,,,0,1,,,5.0,5.0,5.0,5.0,0,0,1642994095, 上海市,False,2022-01-21
4,12705627,5620298,2399,1,12.0,0,W***,返乡,上海行程卡带星星，但是没有去过中风险地区，回到下辖镇必须要集中隔离么。目前是什么情况的呢？,1642731134,117.136.119.*,已办理,已办理,线下交办,0,0,新安县委书记,咨询,医疗,微信小程序,,,,,0,1,,,,,,,0,0,1642836344, 北京市,False,2022-01-21
5,12698399,5616727,815,1,2.0,0,一***,春节返乡人员隔离政策,领导您好，我的家人在上海市工作，因为疫情，已经好2年没回过家了。春节将近，家人们今年想回家过年，从<label style='colo...,1642665918,110.229.60.*,已办理,已一次评价,线上交办,0,0,保定市委书记党晓龙,咨询,政务,PC浏览器,,,,,0,1,,,5.0,5.0,5.0,5.0,0,0,1642836786, 河北省 保定市,False,2022-01-20
6,12698219,3531219,2451,1,1.0,0,智***,疫情返乡,大约2022-01-24号从上海低风险返回范县。持有48小时核酸阴性报告，说是低风险区域是不集中隔离，需要居家隔离的。不知道范县疫情防...,1642664954,116.233.91.*,已办理,已办理,未交办,0,1,范县县委书记,咨询,治安,PC浏览器,,,,,0,1,,,,,,,0,0,1642735398, 上海市,False,2022-01-20
