,tid,userId,fid,typeId,domainId,topicId,nickName,subject,content,dateline,ip,stateInfo,traceInfo,processInfo,hasReported,favNum,forumName,typeName,domainName,sourceName,answerId,answerContent,answerDateline,answerOrganization,userType,threadState,publicAttachment,userFavStatus,grade,gradeLevel,gradeManner,gradeSpeed,trashRecheckState,attachment,threadsCheckTime,from,shisiwu,date
5,13351883,6080530,555,2,7.0,0,徐***,世茂集团欠钱不给,徐州璀璨江山项目欠我卖房佣金2万元，至今不给，2021年五月产生的业务，承诺7月份给钱，到现在还没结账，多次去项目讨钱，徐州推上海不给...,1645522776,117.136.19.*,已办理,已办理,未交办,0,0,上海市委书记李强,投诉,城建,手机浏览器,,,,,0,1,,,,,,,0,0,1645687898, 江苏省 南京市,False,2022-02-22
6,13350817,5717456,5205,6,11.0,0,W***,求助索要工资,本人2021年5月21日至2021年9月10日在上海宝冶雄东安置A单元一工区做水工，技工350元/天，分包商是河南平原建工集团有限公司...,1645520740,117.136.2.*,已办理,已办理,未交办,0,0,高新技术产业开发区党工委书记,求助,就业,微信小程序,,,,,0,1,,,,,,,0,0,1645600902, 河北省 石家庄市,False,2022-02-22
7,13350340,6027737,555,6,12.0,0,K***,随申码到期未变回绿码,"领导你好：
我于2022年2月6日经过苏州低风险地区，并于当天下午从苏州低风险地区回到上海（且此时苏州尚无疫情）。",1645519796,39.144.39.*,待回复,待回复,未交办,0,0,上海市委书记李强,求助,医疗,手机浏览器,,,,,0,1,,,,,,,0,0,1645762124, 北京市,False,2022-02-22
8,13348940,2876508,979,2,11.0,0,有***,上海由由世御别墅酒店拖欠工资,领导您好上海是全国一线城市是每个打工人的天堂，本人也抱着梦想从2000多公里外来到上...,1645517511,112.64.208.*,已办理,已一次评价,未交办,0,1,崇明区委书记李政,投诉,就业,客户端,,,,,0,1,0.0,,5.0,5.0,5.0,5.0,0,1,1645680968, 上海市,False,2022-02-22
9,13344915,5789201,979,6,7.0,0,Z***,农村拆迁集中居住优先解决处理,1.求助人情况：四级伤残（车祸：失去一条腿）2.居住在上海市崇明区庙镇江镇村***号，房子是1981年建造的泥土楼房共二层，无钢筋混泥...,1645511006,112.64.178.*,已办理,已一次评价,未交办,0,0,崇明区委书记李政,求助,城建,微信小程序,,,,,0,1,,,5.0,5.0,5.0,5.0,0,0,1645666494, 上海市,False,2022-02-22
0,13344486,4291825,1851,2,1.0,0,W***,南充绿地城（上海滩花园）二区违规停车,南充绿地城（上海滩花园）二区南门很多违规停车，私家车停在南门外的市政人行铺砖道路上面，导致人行道路面地砖破损严重，严重影响北部新城的城...,1645510417,171.95.208.*,已办理,已办理,线下交办,0,0,顺庆区委书记,投诉,治安,微信小程序,,,,,0,1,,,,,,,0,0,1645596425, 四川省 成都市,False,2022-02-22
1,13343713,6074966,556,5,14.0,0,名***,上海居住证,尊敬的领导：      我是一名沪漂，大学毕业来上海已有11年了，凭借自己的努力在上...,1645509282,180.163.115.*,已办理,已办理,未交办,0,2,上海市市长龚正,建言,教育,PC浏览器,,,,,0,1,,,,,,,0,0,1645659741, 上海市,False,2022-02-22
2,13340974,6073472,555,5,14.0,143,Z***,希望提高幼儿园教师薪资待遇,"1.提高幼儿园教师福利，青年教师在上海生活压力过大。
2.幼儿园是基础，对小朋友来说十分重要、家长对幼儿园老师要求也同步提高，希望也能...",1645505685,116.236.133.*,已办理,已办理,未交办,0,0,上海市委书记李强,建言,教育,手机浏览器,,,,,0,1,,,,,,,0,0,1645535277, 上海市,False,2022-02-22
3,13338237,6070261,963,6,7.0,0,l***,求帮助解决物业不配合安装充电桩问题,并且电力也做了扩容，现在国家大力推进新能源车，22年1月购入一辆新能源车，本人上下班比较远，一天来回近70公里，去物业申请充电桩时，遭到拒绝，小区物业表示他们同意，包括业委会也同意，现在不允许安装的原...,1645502375,202.170.219.*,待回复,待回复,未交办,0,0,闵行区委书记陈宇剑,求助,城建,PC浏览器,,,,,0,1,,,,,,,0,0,1645577584, 上海市,False,2022-02-22
4,13336785,2405365,2344,5,6.0,0,意***,关于寿县交通旅客运输的一点建议,3、铁路运输方面：向县铁办提议联系上海铁路局相关部门将阜阳西站往返北京的G1577、G1578次高铁列车双向延长到寿县，满足寿县及周边...,1645500613,223.245.210.*,已办理,已办理,未交办,0,0,寿县县委书记,建言,交通,客户端,,,,,0,1,,,,,,,0,0,1645607537, 安徽省 合肥市,False,2022-02-22
5,13335825,1643162,549,5,2.0,0,不***,建议改革公务员招考放宽专业限制和年龄限制,吉林、黑龙江、河南、福建、湖南、湖北、山东、上海、山西、江苏等省市已经开始大幅度减少专业限制，绝大部分岗位采取只限制专业门类例如管理学...,1645499588,113.228.93.*,办理中,待回复,线下交办,0,1,辽宁省委书记张国清,建言,政务,PC浏览器,,,,,0,1,,,,,,,0,0,1645540918, 辽宁省 铁岭市,False,2022-02-22
6,13335371,5642157,557,5,12.0,0,轮***,建议江苏省优化生育政策尽快落实,上海，浙江，安徽等省份应对人口快速下降问题，在2021年11月就出台相关政策，江苏省目前迟迟没有相关政策，建议领导多多关注该政策具体实...,1645499173,117.89.19.*,办理中,待回复,线下交办,0,0,江苏省委书记吴政隆,建言,医疗,客户端,,,,,0,1,,,,,,,0,0,1645540918, 江苏省 南京市,False,2022-02-22
7,13334928,6069124,555,5,11.0,143,Z***,40岁硕士面临就业难题，想创业却无适合政策,目前整个经济环境很不好，我所在的上海某外资企业就因为疫情影响去年关闭，我也失业了。,1645498731,116.233.197.*,已办理,已办理,未交办,0,0,上海市委书记李强,建言,就业,PC浏览器,,,,,0,1,,,,,,,0,0,1645535174, 上海市,False,2022-02-22
8,13334582,6068894,556,5,7.0,143,Z***,私占公共车位引起纠纷,目前，在上海很多老小区都没有产权车位，因此采用先到先停模式，很多车主为了一己之便，私占车位，还有更甚者占用消防通道，停车矛盾日益扩大，...,1645498413,117.74.132.*,已办理,已办理,未交办,0,0,上海市市长龚正,建言,城建,PC浏览器,,,,,0,1,,,,,,,0,0,1645535174, 上海市,False,2022-02-22
9,13334209,6066081,556,5,2.0,0,W***,为日趋老龄化的城市强化养老设施,上海老龄化日益严重，每年新增的养老院的建设杯水车薪，加快公房电梯改造刻不容缓，是让老人居家养老的一项重要保障措施，希望加强推进，从政策...,1645498061,101.82.57.*,已办理,已办理,未交办,0,0,上海市市长龚正,建言,政务,微信小程序,,,,,0,1,,,,,,,0,0,1645540918, 上海市,False,2022-02-22
0,13331243,6066554,556,5,6.0,143,Z***,崇明岛交通出行成本高,"中国新农村建设的最近几年，让我们新农村人眼前一亮，然而还是有几个问题的，希望农村的未来仅仅是“地理上是农村&quot;，五脏俱全，能吸引更多有资本的人去农村，共同建设农村;
2、崇明岛是祖国第三大岛，...",1645495269,180.164.63.*,已办理,已办理,未交办,0,0,上海市市长龚正,建言,交通,手机浏览器,,,,,0,1,,,,,,,0,0,1645535174, 上海市,False,2022-02-22
1,13330591,5896511,984,9,12.0,0,东***,感谢 ,前几天  东方天郡被封  跪求急需门冬胰岛素  得不到解决   之所 留言政府平台  急需胰岛素  两天后解决了  非常感谢送药上门  谢谢无锡政府 本人<label style='color:red...,1645494653,49.76.222.*,已办理,已办理,未交办,0,0,无锡市市长赵建军,感谢,医疗,PC浏览器,,,,,0,1,,,,,,,0,0,1645578169, 江苏省 无锡市,False,2022-02-22
2,13327023,4686280,967,6,4.0,0,小***,苹果官方无法提供相应付费服务却拒绝退款,本人目前求助诉求为，希望作为apple care➕服务提供的主体，苹果电脑贸易（上海）有限公司全额退款我的apple care ➕服务...,1645491251,222.128.187.*,待回复,待回复,未交办,0,0,浦东新区区委书记朱芝松,求助,企业,客户端,,,,,0,1,,,,,,,0,0,1645577459, 北京市,False,2022-02-22
3,13323546,6061384,555,5,14.0,143,Z***,外来孩子在沪中高考资格,我和我丈夫是来上海17年的外地人，在上海完成结婚，生子，买房，买车。...,1645485282,180.174.54.*,已办理,已办理,未交办,0,0,上海市委书记李强,建言,教育,手机浏览器,,,,,0,1,,,,,,,0,0,1645494494, 上海市,False,2022-02-21
4,13322556,3068419,2511,2,7.0,0,烟***,关于开发商违规收取燃气开口费的问题,倾尽半生的能力买了一套上海滩小区的商品房，很庆幸没有烂尾，去年就交房了，很多人已入住，本人因经济上的原因目前还没拿钥匙也没办房产证，近...,1645481035,171.8.12.*,已办理,已一次评价,未交办,0,0,驿城区委书记,投诉,城建,客户端,,,,,0,1,,,3.4,1.0,5.0,5.0,0,0,1645532257, 河南省 郑州市,False,2022-02-21
5,13322259,6060713,565,6,14.0,0,强***,请帮助拿回江西出众教育机构培训费,我在上海，21年8月咨询了江西出众教育的二级注册消防师，机构说证书出来机构可以挂靠，然后我分期付了1000元报名费及6900元培训费，...,1645477255,223.104.213.*,办理中,待回复,线上交办,0,0,江西省委书记易炼红,求助,教育,手机浏览器,,,,,0,1,0.0,,,,,,0,1,1645532016, 北京市,False,2022-02-21
6,13321626,6060280,539,5,5.0,0,我***,在北京建一个像上海那么大的迪士尼,建议在北京建一个像上海那么大的迪士尼，还能提升旅游，身边的大朋友小朋友都特别喜欢迪士尼！希望梦想成真,1645465284,123.122.60.*,办理中,待回复,线下交办,0,0,北京市委书记蔡奇,建言,旅游,手机浏览器,,,,,0,1,,,,,,,0,0,1645599415, 北京市,False,2022-02-21
7,13320989,5347027,793,2,14.0,0,天***,海教园南开学校故意人为设置招生节点门槛,海教园落户和教育政策规定购买海教园房产可以落户海教园，随迁子女可以上海教园南开学校，海教园南开必须是3月30日以前取得海教园户口的学生...,1645461559,39.144.82.*,已办理,已办理,未交办,0,1,津南区委书记刘惠,投诉,教育,客户端,,,,,0,1,0.0,,,,,,0,1,1645599415, 北京市,False,2022-02-21
8,13318676,6057946,556,5,14.0,143,Z***,养老托幼,"2.介于现在年轻人恐婚恐育的状态，建议将国家或者本市积极的应对福利或政策给予广泛宣传，给下一代充分了解和原则的权利

感谢国家和上海市...",1645456887,223.104.211.*,已办理,已办理,未交办,0,0,上海市市长龚正,建言,教育,手机浏览器,,,,,0,1,,,,,,,0,0,1645535174, 北京市,False,2022-02-21
9,13315921,3654607,582,2,1.0,0,W***,防疫问题的投诉,2、有填报我即将住宿的地方，对方重庆市南岸区铜元局街道上海城社区居委会电话一名女士电话粗鲁。我想解释我的所有行程单、健康码都是绿色的，...,1645453891,123.147.248.*,已办理,已办理,线上交办,0,0,重庆市市长胡衡华,投诉,治安,微信小程序,,,,,0,1,,,,,,,0,0,1645522987, 重庆市,False,2022-02-21
0,13314602,6054206,555,6,12.0,0,陈***,随申码突然变红码又变黄码,我的随申码当前为黄色，我于2022年2月10日从苏州抵沪，期间未去过中高风险，抵沪后一直未离开过上海，也一直在做核酸检测，结果均为阴性...,1645452485,183.195.33.*,已办理,已办理,未交办,0,0,上海市委书记李强,求助,医疗,手机浏览器,,,,,0,1,0.0,,,,,,0,1,1645578169, 上海市,False,2022-02-21
1,13313926,6054240,556,5,12.0,143,Z***,希望将生长激素纳入医保谈判,前些日子看到广东省将生长激素纳入带量采购谈判，希望上海也能早日开启谈判,1645451775,101.93.172.*,已办理,已办理,未交办,0,0,上海市市长龚正,建言,医疗,手机浏览器,,,,,0,1,,,,,,,0,0,1645521184, 上海市,False,2022-02-21
2,13313850,2790648,559,6,4.0,0,闲***,还我们的血汗钱！,我是河南省人，2022年春节疫情期间（2022年1月28号——2月20号），我在上海景瑞物业管理有限公司杭州项目部萧山钱江世纪城地铁商...,1645451694,223.104.36.*,已办理,已办理,未交办,0,0,浙江省委书记袁家军,求助,企业,客户端,,,,,0,1,0.0,,,,,,0,1,1645599415, 北京市,False,2022-02-21
3,13311743,6050780,1345,6,12.0,0,李***,医疗费用,我是昭通市昭阳区炎山镇松乐村村民委员会二十四组50号村民李**之子李**，由于家庭贫困从小被父亲带到上海奔波，一家四口人除了弟弟没有一...,1645449674,223.104.213.*,已办理,已办理,未交办,0,0,昭通市委书记郭大进,求助,医疗,手机浏览器,,,,,0,1,0.0,,,,,,0,1,1645492444, 北京市,False,2022-02-21
4,13308655,6049892,556,5,7.0,143,Z***,严查上海居住证办理收费事宜,上海很多租房的房东不提供和不配合办理居住证，有很多黄牛和一些房东要求租户缴费办理，这不合法也不合理。,1645446361,223.104.211.*,已办理,已办理,未交办,0,0,上海市市长龚正,建言,城建,手机浏览器,,,,,0,1,,,,,,,0,0,1645521184, 北京市,False,2022-02-21
5,13306525,5787034,1175,2,7.0,0,M***,霸占公摊面积，破坏邻里和谐,我是家住茅箭区上海路大美盛城香榭丽小区居民，2022年1月26日我们1#1单元10楼04户型邻居在无任何许可及告知情况下在公区走廊电梯...,1645444022,61.242.134.*,办理中,待回复,线上交办,0,0,十堰市委书记胡亚波,投诉,城建,手机浏览器,,,,,0,1,,,,,,,0,0,1645522987, 江西省,False,2022-02-21
6,13306368,2261655,4440,5,6.0,0,1***,道路常年维修,滨湖新区上海路塘西河桥路段，到上海路与杭州路交口路段，到<label...,1645443842,39.144.38.*,已办理,已办理,线下交办,0,0,包河区委书记,建言,交通,客户端,,,,,0,1,,,,,,,0,0,1645540918, 北京市,False,2022-02-21
7,13305872,6047238,561,1,6.0,0,南***,利辛县交通局随意篡改公交路线,从利辛北站至文州路，途经多个小区，附近学校众多，居民和学生乘车便捷，可是2022年2月18日上午10点左右，公交公司接到利辛县交通局通知，变更路线，造成利辛天煜大酒店以西沿途的6个小区（月亮湾，英伦华...,1645443271,120.243.55.*,已办理,已一次评价,未交办,0,0,安徽省委书记郑栅洁,咨询,交通,客户端,,,,,0,1,,,1.6,1.0,3.0,1.0,0,0,1645541303, 北京市,False,2022-02-21
8,13305061,6047339,556,5,14.0,143,Z***,学生的需求,不只只是在上海，全国的学生都苦于一大早早起的疲惫，或许早上稍微晚一点，8点甚至七点半到学校都能让学生有一个更好的精气神，睡眠对一个处于...,1645442342,39.144.39.*,待回复,待回复,未交办,0,0,上海市市长龚正,建言,教育,手机浏览器,,,,,0,1,,,,,,,0,0,1645521184, 北京市,False,2022-02-21
9,13302506,6044114,539,6,11.0,0,红***,求助,我是南通人，2022年2月16日网上购票21日8:30南通站到北京南站火车票，行程码、健康码、核酸检测证明都正常，早晨赶到车站被告知不能入京；随后打了...,1645439371,117.136.46.*,已办理,已办理,未交办,0,0,北京市委书记蔡奇,求助,就业,手机浏览器,,,,,0,1,0.0,,,,,,0,1,1645600807, 江苏省 南京市,False,2022-02-21
0,13296055,6040392,539,5,14.0,143,Z***,建议放宽落户条件,2022年1月上海居转户人数突破3000人大关，合计3615人，按照1月的单月公示人数推算，2022年全年居转户名额估计要突破4万人。...,1645432074,124.127.113.*,已办理,已办理,未交办,0,0,北京市委书记蔡奇,建言,教育,手机浏览器,,,,,0,1,,,,,,,0,0,1645533736, 北京市,False,2022-02-21
1,13295490,6031761,581,5,6.0,0,Z***,建议尽快修建渝怀高铁,修建渝怀高铁有利于武陵山区经济发展，有利于缩减重庆到上海的时间，有利于共同富裕。,1645431491,118.114.110.*,已办理,已办理,线上交办,0,1,重庆市委书记陈敏尔,建言,交通,客户端,,,,,0,1,,,,,,,0,0,1645540918, 四川省 成都市,False,2022-02-21
2,13294397,5014409,555,5,13.0,0,Z***,分散式电供暖集中式管理助力上海供热提前实现碳,上海冬季湿冷刺骨，急需集中供热，降低百姓的取暖费用。目前大多采用燃气供热，新增建筑越来越多，阻碍了碳达峰目标实现！推广分散式电供暖+集...,1645430318,117.136.120.*,已办理,已办理,未交办,0,0,上海市委书记李强,建言,环保,客户端,,,,,0,1,,,,,,,0,0,1645532272, 北京市,False,2022-02-21
3,13293304,5326159,1258,5,6.0,0,A***,恢复新兴火车站、新兴（天堂）火车站客运业务,火车站客运业务，升级改造新兴火车站（现代化改造，拆除既有旧站房，原址建新站房站房）新建站台5个或者6个，到发线也是5～6条以及其他的设备设施，改善车站周边的环境设施，增加跨省列车和省内列车的停靠，尤其...,1645429297,120.239.131.*,已办理,已办理,线下交办,0,0,云浮市市长李庆新,建言,交通,手机浏览器,,,,,0,1,0.0,,,,,,0,1,1645500494, 广东省,False,2022-02-21
4,13290705,3070478,947,1,6.0,0,添***,驿动巴士上海南站健康定制专线是否还在运营,上海南站作为接驳外省长途汽车的核心枢纽，原本有巴士接驳各大医院，不知现在是否依然运营，且发车时刻表如何？烦请询问，万分感谢！,1645426837,58.33.102.*,已办理,已办理,未交办,0,0,徐汇区委书记曹立强,咨询,交通,PC浏览器,,,,,0,1,,,,,,,0,0,1645512207, 上海市,False,2022-02-21
5,13286750,6033384,556,5,14.0,143,Z***,就业选择行业标杆还是自身兴趣？,尊敬的市长，您好：本人坐标上海，作为两个孩子（一个高一、一个初一）的妈妈来说，现在虽然学习压力没有这么大，但是孩子们的将来的就业压力以...,1645423423,218.82.186.*,待回复,待回复,未交办,0,0,上海市市长龚正,建言,教育,手机浏览器,,,,,0,1,,,,,,,0,0,1645435555, 上海市,False,2022-02-21
6,13282241,4703636,967,6,11.0,0,南***,随申码突然变黄，申诉不反应,我是外地回沪人员，2月11日上海到昆山。2月14日通过健康证明、昆山绿码从昆山高铁回沪，居委会已经登记并告知有绿码可以正常上班，行程上...,1645419824,140.207.23.*,待回复,待回复,未交办,0,0,浦东新区区委书记朱芝松,求助,就业,客户端,,,,,0,1,0.0,,,,,,0,1,1645586747, 上海市,False,2022-02-21
7,13275496,2881254,555,2,5.0,0,T***,上海酒店工作人员素质有待提高,1.上海市酒店工作人员，偷拍客人客人隐私，私下传播！2.酒店是上海市...,1645413989,117.136.120.*,待回复,待回复,未交办,0,0,上海市委书记李强,投诉,旅游,客户端,,,,,0,1,0.0,,,,,,0,1,1645584917, 北京市,False,2022-02-21
8,13273988,6022756,576,2,7.0,0,普***,污水反涌至全屋，物业仍不解决！,物管公司名称:上海绿地物业服务有限公司广州分公司具体情况:几个月内污水管堵塞反涌污水至少三次至全屋，木地板墙面门框等泡水发霉，无家可归...,1645412771,120.230.138.*,待回复,待回复,未交办,0,0,广东省省长王伟中,投诉,城建,PC浏览器,,,,,0,1,0.0,,,,,,0,1,1645433323, 广东省,False,2022-02-21
9,13271862,6014814,556,6,12.0,0,D***,随申码赋黄码,我于2月14日从上海至昆山开会，2021年2月15日乘坐G7221次从昆山南站返回上...,1645411117,183.192.121.*,已办理,已办理,未交办,0,0,上海市市长龚正,求助,医疗,PC浏览器,,,,,0,1,,,,,,,0,0,1645586191, 上海市,False,2022-02-21
0,13269422,6019459,556,6,2.0,0,y***,随申码无故变黄,自从我6日进入上海之后，从未离开上海，目前已经在<label sty...,1645409233,117.143.101.*,已办理,已办理,未交办,0,1,上海市市长龚正,求助,政务,PC浏览器,,,,,0,1,0.0,,,,,,0,1,1645582947, 上海市,False,2022-02-21
1,13265565,2617032,967,6,4.0,0,z***,员工工伤，不予理采,本人，于2012年12月8日在上海市东方久乐安全气囊有限公司上班途中，交通事故工伤，尾椎骨骨拆，痛苦不堪，气囊公司不与理会，不作回应，...,1645406204,117.136.81.*,待回复,待回复,未交办,0,0,浦东新区区委书记朱芝松,求助,企业,客户端,,,,,0,1,,,,,,,0,0,1645660843, 北京市,False,2022-02-21
2,13257596,6012123,948,6,11.0,0,W***,帮忙尽快要回我的工资,我是营业员，在上海博幻良品公司，上海璞物实业有限公司也是这个公司的，...,1645379466,220.197.208.*,待回复,待回复,未交办,0,0,徐汇区区长钟晓咏,求助,就业,微信小程序,,,,,0,1,0.0,,,,,,0,1,1645491699, 贵州省 贵阳市,False,2022-02-20
3,13255235,6008709,3805,6,9.0,0,f***,求助,尊敬的领导：       我是山西省沁源县交口乡新毅村王*平、来*苗夫妇的儿子，我现上海工作。,1645371611,117.143.19.*,已办理,已一次评价,未交办,0,0,沁源县委书记,求助,三农,PC浏览器,,,,,0,1,,,1.9,1.0,3.0,2.0,0,0,1645512207, 上海市,False,2022-02-20
4,13239730,2572596,1367,5,6.0,0,陕***,加强西安铁路局发展，助力关中平原城市群建设,"1.银川-平凉-宝鸡-汉中-巴中-南充高铁项目；
     2.十堰-安康-汉中-天水高铁项目；
     3.安康-十堰-南阳-信阳-驻马店-阜阳-合肥-南京-<label style='color...",1645356800,113.251.189.*,已办理,已一次评价,未交办,0,1,西安市委书记方红卫,建言,交通,客户端,,,,,0,1,,,1.6,1.0,2.0,2.0,0,0,1645535499, 重庆市,False,2022-02-20
5,13237616,4782715,541,6,7.0,0,鹭***,开发商无限期交房,2020年3月我从开发商天津市西青区杨柳青森林绿野建筑工程有限公司买的期房，项目名称：蓝光雍锦半岛（鹭岭景园），承建单位：上海七建，开...,1645355021,117.10.167.*,已办理,已办理,线上交办,0,0,天津市委书记李鸿忠,求助,城建,PC浏览器,,,,,0,1,,,,,,,0,0,1645434670, 天津市,False,2022-02-20
6,13229664,5989950,2487,1,7.0,0,z***,上海公积金在民权买房可以进行商转公吗,"书记您好:
       我之前在民权用商业贷款买的房，现在想转成公积金贷款，公积金是上海的，可以在民权进行商转公吗？",1645348021,115.172.255.*,已办理,已办理,未交办,0,0,民权县委书记,咨询,城建,手机浏览器,,,,,0,1,,,,,,,0,0,1645512207, 上海市,False,2022-02-20
7,13228934,5989775,556,2,14.0,0,王***,高顿教育拒绝退费不处理,2019年2月21日，在上海高顿教育培训有限公司，地址，上海市虹口区...,1645347332,1.68.167.*,已办理,已办理,未交办,0,0,上海市市长龚正,投诉,教育,客户端,,,,,0,1,0.0,,,,,,0,1,1645519458, 山西省 太原市,False,2022-02-20
8,13227788,2065302,1136,5,6.0,0,水***,关于限号问题,北京、上海、天津、杭州等地都在采用定期更换限行尾号措施，希望郑州样参考一下，每 3 个月轮换一次。谢谢,1645346359,117.159.18.*,已办理,已办理,未交办,0,0,郑州市市长何雄（代）,建言,交通,PC浏览器,,,,,0,1,,,,,,,0,0,1645541145, 河南省 省直辖县级行政区划,False,2022-02-20
9,13226904,5984525,1008,5,2.0,0,随***,高层次人才租房补贴取消户籍限制,其中租房补贴申请需要满足的条件之一：且持有市区常住居民户口（外籍人才持永久居留证或浙江省“红卡”）或经我市分类认定的外籍及北京、上海、...,1645345677,39.170.41.*,已办理,已一次评价,未交办,0,0,杭州市市长刘忻,建言,政务,客户端,,,,,0,1,0.0,,3.4,1.0,5.0,5.0,0,1,1645541145, 北京市,False,2022-02-20
0,13226418,5987539,556,1,12.0,0,O***,上海随申码变黄，但国家健康码为绿,您好，我一直居住在上海，2月 11 日因父亲生病去昆山探望，当天来回，于 2 月 18 日随申码突然转成黄色。,1645345293,101.88.146.*,已办理,已办理,未交办,0,0,上海市市长龚正,咨询,医疗,PC浏览器,,,,,0,1,,,,,,,0,0,1645513227, 上海市,False,2022-02-20
1,13221660,5705093,3209,6,12.0,0,汤***,个人情况求助,尊敬的领导您好，我叫汤*，是湖南省平江县人，2021年的7月15号，我在上海第十人民医院急诊，被确诊为世界罕见病，马凡综合征，那个时候...,1645341676,116.162.132.*,已办理,已办理,未交办,0,0,平江县委书记,求助,医疗,客户端,,,,,0,1,0.0,,,,,,0,1,1645660174, 辽宁省 朝阳市,False,2022-02-20
2,13199985,5964192,947,2,14.0,0,幼***,上海王氏教育没有教学资质收上万十几万学费,我报的上海王氏教育半年周末绘画班，咨询说是插画，能达到就业，实际上的原画班，就兴趣班。上课老师教学水平差，经常请假，学生用的电脑也经常...,1645329285,36.113.100.*,待回复,待回复,未交办,0,1,徐汇区委书记曹立强,投诉,教育,客户端,,,,,0,1,0.0,,,,,,0,1,1645410264, 浙江省 杭州市,False,2022-02-20
3,13188393,5337214,561,5,6.0,0,当***,加快改扩建安徽大公圩水阳江（马鞍山段）三大桥,基于长三角一体化 发展，囿于此三桥客观通行条件严重卡脖子，进而造成马鞍山、芜湖等地区安徽企业对接南京、上海与浙江东南通道物流速度与成本...,1645323129,183.192.94.*,已办理,已一次评价,未交办,0,0,安徽省委书记郑栅洁,建言,交通,PC浏览器,,,,,0,1,0.0,,2.7,3.0,3.0,2.0,0,1,1645518300, 上海市,False,2022-02-20
